Rusmini P.; Cortese K.; Crippa V.; Cristofani R.; Cicardi M.E.; Ferrari V.; Vezzoli G.; Tedesco B.; Meroni M.; Messi E.; Piccolella M.; Galbiati M.; Garrè M.; Morelli E.; Vaccari T.; Poletti A.,"Rusmini, Paola (8964506700); Cortese, Katia (57189448178); Crippa, Valeria (16237813400); Cristofani, Riccardo (55632576000); Cicardi, Maria Elena (56411758800); Ferrari, Veronica (57194550008); Vezzoli, Giulia (57194544854); Tedesco, Barbara (57093952000); Meroni, Marco (56915489100); Messi, Elio (6602495225); Piccolella, Margherita (13807158500); Galbiati, Mariarita (6701815972); Garrè, Massimiliano (24437963600); Morelli, Elena (56972645200); Vaccari, Thomas (6603645752); Poletti, Angelo (7006039454)",8964506700; 57189448178; 16237813400; 55632576000; 56411758800; 57194550008; 57194544854; 57093952000; 56915489100; 6602495225; 13807158500; 6701815972; 24437963600; 56972645200; 6603645752; 7006039454,Trehalose induces autophagy via lysosomal-mediated TFEB activation in models of motoneuron degeneration,2019,Autophagy,15,4,,631,651,351,10.1080/15548627.2018.1535292,https://www.scopus.com/inward/record.uri?eid=2-s2.0-85056143495&doi=10.1080%2F15548627.2018.1535292&partnerID=40&md5=24e3729361001cb185c878f2c636f03a,"Dipartimento di Scienze Farmacologiche e Biomolecolari (DiSFeB), Centro di Eccellenza sulle Malattie Neurodegenerative, Università degli Studi di Milano, Milano, Italy; DIMES, Dipartimento di Medicina Sperimentale, Anatomia Umana, Università di Genova, Genova, Italy; IFOM, Istituto FIRC di Oncologia Molecolare, Milano, Italy; Dipartimento di Bioscienze, Università degli Studi di Milano, Italy; Centro Interuniversitario sulle Malattie Neurodegenerative, Università degli Studi di Firenze, Genova e Milano, Italy","Rusmini P., Dipartimento di Scienze Farmacologiche e Biomolecolari (DiSFeB), Centro di Eccellenza sulle Malattie Neurodegenerative, Università degli Studi di Milano, Milano, Italy; Cortese K., DIMES, Dipartimento di Medicina Sperimentale, Anatomia Umana, Università di Genova, Genova, Italy; Crippa V., Dipartimento di Scienze Farmacologiche e Biomolecolari (DiSFeB), Centro di Eccellenza sulle Malattie Neurodegenerative, Università degli Studi di Milano, Milano, Italy; Cristofani R., Dipartimento di Scienze Farmacologiche e Biomolecolari (DiSFeB), Centro di Eccellenza sulle Malattie Neurodegenerative, Università degli Studi di Milano, Milano, Italy; Cicardi M.E., Dipartimento di Scienze Farmacologiche e Biomolecolari (DiSFeB), Centro di Eccellenza sulle Malattie Neurodegenerative, Università degli Studi di Milano, Milano, Italy; Ferrari V., Dipartimento di Scienze Farmacologiche e Biomolecolari (DiSFeB), Centro di Eccellenza sulle Malattie Neurodegenerative, Università degli Studi di Milano, Milano, Italy; Vezzoli G., Dipartimento di Scienze Farmacologiche e Biomolecolari (DiSFeB), Centro di Eccellenza sulle Malattie Neurodegenerative, Università degli Studi di Milano, Milano, Italy; Tedesco B., Dipartimento di Scienze Farmacologiche e Biomolecolari (DiSFeB), Centro di Eccellenza sulle Malattie Neurodegenerative, Università degli Studi di Milano, Milano, Italy; Meroni M., Dipartimento di Scienze Farmacologiche e Biomolecolari (DiSFeB), Centro di Eccellenza sulle Malattie Neurodegenerative, Università degli Studi di Milano, Milano, Italy; Messi E., Dipartimento di Scienze Farmacologiche e Biomolecolari (DiSFeB), Centro di Eccellenza sulle Malattie Neurodegenerative, Università degli Studi di Milano, Milano, Italy; Piccolella M., Dipartimento di Scienze Farmacologiche e Biomolecolari (DiSFeB), Centro di Eccellenza sulle Malattie Neurodegenerative, Università degli Studi di Milano, Milano, Italy; Galbiati M., Dipartimento di Scienze Farmacologiche e Biomolecolari (DiSFeB), Centro di Eccellenza sulle Malattie Neurodegenerative, Università degli Studi di Milano, Milano, Italy; Garrè M., IFOM, Istituto FIRC di Oncologia Molecolare, Milano, Italy; Morelli E., Dipartimento di Bioscienze, Università degli Studi di Milano, Italy; Vaccari T., Dipartimento di Bioscienze, Università degli Studi di Milano, Italy; Poletti A., Dipartimento di Scienze Farmacologiche e Biomolecolari (DiSFeB), Centro di Eccellenza sulle Malattie Neurodegenerative, Università degli Studi di Milano, Milano, Italy, Centro Interuniversitario sulle Malattie Neurodegenerative, Università degli Studi di Firenze, Genova e Milano, Italy","Macroautophagy/autophagy, a defense mechanism against aberrant stresses, in neurons counteracts aggregate-prone misfolded protein toxicity. Autophagy induction might be beneficial in neurodegenerative diseases (NDs). The natural compound trehalose promotes autophagy via TFEB (transcription factor EB), ameliorating disease phenotype in multiple ND models, but its mechanism is still obscure. We demonstrated that trehalose regulates autophagy by inducing rapid and transient lysosomal enlargement and membrane permeabilization (LMP). This effect correlated with the calcium-dependent phosphatase PPP3/calcineurin activation, TFEB dephosphorylation and nuclear translocation. Trehalose upregulated genes for the TFEB target and regulator Ppargc1a, lysosomal hydrolases and membrane proteins (Ctsb, Gla, Lamp2a, Mcoln1, Tpp1) and several autophagy-related components (Becn1, Atg10, Atg12, Sqstm1/p62, Map1lc3b, Hspb8 and Bag3) mostly in a PPP3- and TFEB-dependent manner. TFEB silencing counteracted the trehalose pro-degradative activity on misfolded protein causative of motoneuron diseases. Similar effects were exerted by trehalase-resistant trehalose analogs, melibiose and lactulose. Thus, limited lysosomal damage might induce autophagy, perhaps as a compensatory mechanism, a process that is beneficial to counteract neurodegeneration. Abbreviations: ALS: amyotrophic lateral sclerosis; AR: androgen receptor; ATG: autophagy related; AV: autophagic vacuole; BAG3: BCL2-associated athanogene 3; BECN1: beclin 1, autophagy related; CASA: chaperone-assisted selective autophagy; CTSB: cathepsin b; DAPI: 4ʹ,6-diamidino-2-phenylindole; DMEM: Dulbecco’s modified Eagle’s medium; EGFP: enhanced green fluorescent protein; fALS, familial amyotrophic lateral sclerosis; FRA: filter retardation assay; GAPDH: glyceraldehyde-3-phosphate dehydrogenase; GLA: galactosidase, alpha; HD: Huntington disease; hIPSCs: human induced pluripotent stem cells; HSPA8: heat shock protein A8; HSPB8: heat shock protein B8; IF: immunofluorescence analysis; LAMP1: lysosomal-associated membrane protein 1; LAMP2A: lysosomal-associated membrane protein 2A; LGALS3: lectin, galactose binding, soluble 3; LLOMe: L-leucyl-L-leucine methyl ester; LMP: lysosomal membrane permeabilization; Lys: lysosomes; MAP1LC3B: microtubule-associated protein 1 light chain 3 beta; MCOLN1: mucolipin 1; mRNA: messenger RNA; MTOR: mechanistic target of rapamycin kinase; NDs: neurodegenerative diseases; NSC34: neuroblastoma x spinal cord 34; PBS: phosphate-buffered saline; PD: Parkinson disease; polyQ: polyglutamine; PPARGC1A: peroxisome proliferative activated receptor, gamma, coactivator 1 alpha; PPP3CB: protein phosphatase 3, catalytic subunit, beta isoform; RT-qPCR: real-time quantitative polymerase chain reaction; SBMA: spinal and bulbar muscular atrophy; SCAs: spinocerebellar ataxias; siRNA: small interfering RNA; SLC2A8: solute carrier family 2, (facilitated glucose transporter), member 8; smNPCs: small molecules neural progenitors cells; SOD1: superoxide dismutase 1; SQSTM1/p62: sequestosome 1; STED: stimulated emission depletion; STUB1: STIP1 homology and U-box containing protein 1; TARDBP/TDP-43: TAR DNA binding protein; TFEB: transcription factor EB; TPP1: tripeptidyl peptidase I; TREH: trehalase (brush-border membrane glycoprotein); WB: western blotting; ZKSCAN3: zinc finger with KRAB and SCAN domains 3. © 2018, © 2018 Informa UK Limited, trading as Taylor & Francis Group.",Amyotrophic lateral sclerosis; autophagy; calcineurin; galectin-3; lactulose; lysosomes; melibiose; motoneuron diseases; neurodegeneration; protein quality control; spinal and bulbar muscular atrophy; TFEB; trehalose,"Amyotrophic Lateral Sclerosis; Animals; Autophagosomes; Autophagy; Autophagy-Related Proteins; Basic Helix-Loop-Helix Leucine Zipper Transcription Factors; Bulbo-Spinal Atrophy, X-Linked; Calcineurin; Calcium; Cell Differentiation; Cell Nucleus; Down-Regulation; Humans; Induced Pluripotent Stem Cells; Lysosomes; Membrane Proteins; Mice; Microtubule-Associated Proteins; Motor Neurons; Neuroprotection; RNA, Small Interfering; Sequestosome-1 Protein; Signal Transduction; Trehalose; Unfolded Protein Response; autophagy related protein 10; autophagy related protein 12; bag3 protein; beclin 1; calcineurin; copper zinc superoxide dismutase; ctsb protein; heat shock protein 22; histone H3; lactulose; lysosome associated membrane protein 2; mcoln1 protein; melibiose; membrane protein; osteocalcin; sequestosome 1; small interfering RNA; tpp1 proteiin; transcription factor; transcription factor EB; trehalase; trehalose; unclassified drug; autophagy related protein; basic helix loop helix leucine zipper transcription factor; calcineurin; calcium; MAP1LC3B protein, human; membrane protein; microtubule associated protein; sequestosome 1; SQSTM1 protein, human; TFEB protein, human; trehalose; Article; autophagy; calcium transport; cell nucleus; down regulation; gene activation; human; human tissue; immunofluorescence; lysosome membrane; motoneuron; motor neuron disease; neural stem cell; NSC-34 cell line; point mutation; protein dephosphorylation; protein localization; protein misfolding; real time polymerase chain reaction; upregulation; Western blotting; amyotrophic lateral sclerosis; animal; autophagosome; autophagy; cell differentiation; chemistry; drug effect; enzymology; genetics; induced pluripotent stem cell; Kennedy disease; lysosome; metabolism; motoneuron; mouse; neuroprotection; pathology; signal transduction; ultrastructure; unfolded protein response","A. Poletti; Dipartimento di Scienze Farmacologiche e Biomolecolari (DiSFeB), Milano, via Balzaretti 9, 20133, Italy; email: angelo.poletti@unimi.it",,Taylor and Francis Inc.,15548627,,,30335591,English,Autophagy,Article,Final,All Open Access; Bronze Open Access; Green Open Access,Scopus,2-s2.0-85056143495
Tunca C.; Pehlivan N.; Ak N.; Arnrich B.; Salur G.; Ersoy C.,"Tunca, Can (55292817900); Pehlivan, Nezihe (57193904227); Ak, Nağme (57193900575); Arnrich, Bert (6603173591); Salur, Gülüstü (57193906500); Ersoy, Cem (6701485879)",55292817900; 57193904227; 57193900575; 6603173591; 57193906500; 6701485879,Inertial sensor-based robust gait analysis in non-hospital settings for neurological disorders,2017,Sensors (Switzerland),17,4,825,,,130,10.3390/s17040825,https://www.scopus.com/inward/record.uri?eid=2-s2.0-85017447565&doi=10.3390%2Fs17040825&partnerID=40&md5=adbafcaf9d8d2b008af412c42fa6c8ea,"Department of Computer Engineering, Computer Networks Research Laboratory (NETLAB), Bogazici University, Istanbul, 34342, Turkey; 65+ Elder Rights Association, Istanbul, 34337, Turkey; Movement Disorders and Dementia Clinic, Istanbul, 34337, Turkey","Tunca C., Department of Computer Engineering, Computer Networks Research Laboratory (NETLAB), Bogazici University, Istanbul, 34342, Turkey; Pehlivan N., Department of Computer Engineering, Computer Networks Research Laboratory (NETLAB), Bogazici University, Istanbul, 34342, Turkey; Ak N., 65+ Elder Rights Association, Istanbul, 34337, Turkey; Arnrich B., Department of Computer Engineering, Computer Networks Research Laboratory (NETLAB), Bogazici University, Istanbul, 34342, Turkey; Salur G., 65+ Elder Rights Association, Istanbul, 34337, Turkey, Movement Disorders and Dementia Clinic, Istanbul, 34337, Turkey; Ersoy C., Department of Computer Engineering, Computer Networks Research Laboratory (NETLAB), Bogazici University, Istanbul, 34342, Turkey","The gold standards for gait analysis are instrumented walkways and marker-based motion capture systems, which require costly infrastructure and are only available in hospitals and specialized gait clinics. Even though the completeness and the accuracy of these systems are unquestionable, a mobile and pervasive gait analysis alternative suitable for non-hospital settings is a clinical necessity. Using inertial sensors for gait analysis has been well explored in the literature with promising results. However, the majority of the existing work does not consider realistic conditions where data collection and sensor placement imperfections are imminent. Moreover, some of the underlying assumptions of the existing work are not compatible with pathological gait, decreasing the accuracy. To overcome these challenges, we propose a foot-mounted inertial sensor-based gait analysis system that extends the well-established zero-velocity update and Kalman filtering methodology. Our system copes with various cases of data collection difficulties and relaxes some of the assumptions invalid for pathological gait (e.g., the assumption of observing a heel strike during a gait cycle). The system is able to extract a rich set of standard gait metrics, including stride length, cadence, cycle time, stance time, swing time, stance ratio, speed, maximum/minimum clearance and turning rate. We validated the spatio-temporal accuracy of the proposed system by comparing the stride length and swing time output with an IR depth-camera-based reference system on a dataset comprised of 22 subjects. Furthermore, to highlight the clinical applicability of the system, we present a clinical discussion of the extracted metrics on a disjoint dataset of 17 subjects with various neurological conditions. © 2017 by the authors. Licensee MDPI, Basel, Switzerland.",Gait analysis; Inertial sensors; Kalman filter; Neurological disorders; Parkinson’s disease; Spatio-temporal gait metrics; Wearable sensors,Foot; Gait; Humans; Nervous System Diseases; Data acquisition; Gait analysis; Hospitals; Inertial navigation systems; Kalman filters; Neurology; Gait analysis systems; Inertial sensor; Motion capture system; Neurological disorders; Realistic conditions; Reference systems; Spatio temporal; Spatio-temporal accuracy; foot; gait; human; neurologic disease; Wearable sensors,"C. Tunca; Department of Computer Engineering, Computer Networks Research Laboratory (NETLAB), Bogazici University, Istanbul, 34342, Turkey; email: can.tunca@boun.edu.tr",,MDPI AG,14248220,,,28398224,English,Sensors,Article,Final,All Open Access; Gold Open Access; Green Open Access,Scopus,2-s2.0-85017447565
Kotagal V.,"Kotagal, Vikas (8719176400)",8719176400,Is PIGD a legitimate motor subtype in Parkinson disease?,2016,Annals of Clinical and Translational Neurology,3,6,,473,477,46,10.1002/acn3.312,https://www.scopus.com/inward/record.uri?eid=2-s2.0-85015865399&doi=10.1002%2Facn3.312&partnerID=40&md5=61d521de1cf3288111f0c49dce7937cc,"Department of Neurology, University of Michigan, Ann Arbor, MI, United States; Neurology Service and GRECC, VAAAHS, Ann Arbor, MI, United States","Kotagal V., Department of Neurology, University of Michigan, Ann Arbor, MI, United States, Neurology Service and GRECC, VAAAHS, Ann Arbor, MI, United States","Parkinson disease is a chronic progressive syndrome with a broad array of clinical features. Different investigators have suggested the heterogeneous motor manifestations of early Parkinson disease can be conceptualized through a taxonomy of clinical subtypes including tremor-predominant and postural instability and gait difficulty-predominant subtypes. Although it is theoretically valuable to distinguish subtypes of Parkinson disease, the reality is that few patients fit these discrete categories well and many transition from exhibiting elements of one subtype to elements of another. In the time since the initial description of the postural instability and gait difficulty-predominant subtype, Parkinson disease clinical research has blossomed in many ways - including an increased emphasis on the role of medical comorbidities and extranigral pathologies in Parkinson disease as markers of prognostic significance. By conceptualizing the pathogenesis of an expansive disease process in the limited terms of categorical motor subtypes, we run the risk of overlooking or misclassifying clinically significant pathogenic risk factors that lead to the development of motor milestones such as falls and related axial motor disability. Given its critical influence on quality of life and overall prognosis, we are in need of a model of postural instability and gait difficulty-predominant features in Parkinson disease that emphasizes the overlooked pathological influence of aging and medical comorbidities on the development of axial motor burden and postural instability and gait difficulty-predominant features. This Point of View proposes thinking of postural instability and gait difficulties in Parkinson disease not as a discrete subtype, but rather as multidimensional continuum influenced by several overlapping age-related pathologies. © 2016 American Neurological Association.",,ADL disability; Article; cluster analysis; comorbidity; disease course; disease severity; factorial analysis; gait; human; Parkinson disease; priority journal; quality of life; risk factor,"V. Kotagal; Ann Arbor, 1500 E Medical Center Drive, SPC 5322, 48109, United States; email: vikaskot@med.umich.edu",,Wiley-Blackwell,23289503,,,,English,Ann. Clin. Transl. Neurol.,Article,Final,All Open Access; Gold Open Access; Green Open Access,Scopus,2-s2.0-85015865399
Gyurkó D.M.; Soti C.; Steták A.; Csermely P.,"Gyurkó, Dávid M. (36113780500); Soti, Csaba (6602109433); Steták, Attila (16032134600); Csermely, Peter (8916910300)",36113780500; 6602109433; 16032134600; 8916910300,"System level mechanisms of adaptation, learning, memory formation and evolvability: The role of chaperone and other networks",2014,Current Protein and Peptide Science,15,3,,171,188,10,10.2174/1389203715666140331110522,https://www.scopus.com/inward/record.uri?eid=2-s2.0-84904470251&doi=10.2174%2F1389203715666140331110522&partnerID=40&md5=c4f6f286c7ed6a79855384bb7bf56094,"Department of Medical Chemistry, Semmelweis University, Budapest, Hungary; Division of Molecular Neurosciences, Life Sciences Training Facility, University of Basel, Basel, Switzerland","Gyurkó D.M., Department of Medical Chemistry, Semmelweis University, Budapest, Hungary; Soti C., Department of Medical Chemistry, Semmelweis University, Budapest, Hungary; Steták A., Division of Molecular Neurosciences, Life Sciences Training Facility, University of Basel, Basel, Switzerland; Csermely P., Department of Medical Chemistry, Semmelweis University, Budapest, Hungary","During the last decade, network approaches became a powerful tool to describe protein structure and dynamics. Here, we describe first the protein structure networks of molecular chaperones, then characterize chaperone containing sub-networks of interactomes called as chaperone-networks or chaperomes. We review the role of molecular chaperones in short-term adaptation of cellular networks in response to stress, and in long-term adaptation discussing their putative functions in the regulation of evolvability. We provide a general overview of possible network mechanisms of adaptation, learning and memory formation. We propose that changes of network rigidity play a key role in learning and memory formation processes. Flexible network topology provides 'learning-competent' state. Here, networks may have much less modular boundaries than locally rigid, highly modular networks, where the learnt information has already been consolidated in a memory formation process. Since modular boundaries are efficient filters of information, in the 'learningcompetent' state information filtering may be much smaller, than after memory formation. This mechanism restricts high information transfer to the 'learning competent' state. After memory formation, modular boundary-induced segregation and information filtering protect the stored information. The flexible networks of young organisms are generally in a 'learning competent' state. On the contrary, locally rigid networks of old organisms have lost their 'learning competent' state, but store and protect their learnt information efficiently. We anticipate that the above mechanism may operate at the level of both protein-protein interaction and neuronal networks. © 2014 Bentham Science Publishers.",Adaptation; Chaperones; Evolution; Heat shock proteins; Learning; Memory; Protein structure networks; Protein-protein interaction networks; Stress,"Adaptation, Physiological; Evolution, Molecular; Humans; Memory; Molecular Chaperones; Protein Interaction Maps; adenosine diphosphate; adenosine triphosphate; alpha synuclein; AMPA receptor; brain derived neurotrophic factor; cell protein; chaperone; chaperonin 60; early pregnancy factor; glucose regulated protein 78; heat shock cognate protein 70; heat shock protein; heat shock protein 90; heterogeneous nuclear ribonucleoprotein; protein p23; sortilin; chaperone; article; caloric restriction; cell function; cellular stress signal; DNA repair; dyslexia; Escherichia coli; evolution; evolutionary adaptation; fluorescence resonance energy transfer; human; learning; long term depression; memory; molecular dynamics; nerve cell plasticity; nonhuman; Parkinson disease; protein binding; protein homeostasis; protein localization; protein protein interaction; protein structure; signal transduction; state dependent learning; synaptic transmission; adaptation; chemistry; memory; metabolism; molecular evolution; physiology; protein protein interaction","P. Csermely; Department of Medical Chemistry, Semmelweis University, H-1444 Budapest, P. O. Box 260, Hungary; email: csermely.peter@med.semmelweis-univ.hu",,Bentham Science Publishers,13892037,,CPPSC,24694371,English,Curr. Protein Pept. Sci.,Article,Final,All Open Access; Green Open Access,Scopus,2-s2.0-84904470251
Green R.D.; Guan L.; Burne J.A.,"Green, R.D. (7403916778); Guan, L. (55679853000); Burne, J.A. (7004261516)",7403916778; 55679853000; 7004261516,Video analysis of gait for diagnosing movement disorders,2000,Journal of Electronic Imaging,9,1,,16,21,18,10.1117/1.482723,https://www.scopus.com/inward/record.uri?eid=2-s2.0-0040183823&doi=10.1117%2F1.482723&partnerID=40&md5=13a19a38693757cd633ac834d45ed3cc,,,"This paper describes a video analysis system, free of markers and setup procedures, that quantitatively identified gait abnormalities in real time from standard video images. A novel color three-dimensional body model was sized and texture mapped to the exact characteristics of a person from video images. The kinematics of the body model was represented by a transformation tree to track the position and orientation of a person relative to the camera. Joint angles were used to track the location and orientation of each body part, with the range of joint angles being constrained by associating degrees of freedom with each joint. To stabilize tracking, the joint angles were estimated for the next frame. The calculation of joint angles, for the next frame, was cast as an estimation problem, which was solved using an iterated extended Kalman filter. Patients with dopa-responsive Parkinsonism, and age-matched normals, were video taped during several gait cycles with walking movements successfully tracked and classified. The results suggested that this approach has the potential to guide clinicians on the relative sensitivity of specific postural/gait features in diagnosis. © 2000 SPlE and IS&T.",,,,,SPIE,10179909,,JEIME,,English,J Electron Imaging,Article,Final,,Scopus,2-s2.0-0040183823
