Bartonikova T.; Mensikova K.; Mikulicova L.; Vodicka R.; Vrtel R.; Godava M.; Vastik M.; Kaiserova M.; Otruba P.; Dolinova I.; Nevrly M.; Kanovsky P.,"Bartonikova, Tereza (56453302000); Mensikova, Katerina (55583723400); Mikulicova, Lenka (55797398000); Vodicka, Radek (6602675360); Vrtel, Radek (6603558782); Godava, Marek (53463350900); Vastik, Miroslav (55797205600); Kaiserova, Michaela (36473365000); Otruba, Pavel (6505917537); Dolinova, Iva (56560132500); Nevrly, Martin (24478811700); Kanovsky, Petr (55865436500)",56453302000; 55583723400; 55797398000; 6602675360; 6603558782; 53463350900; 55797205600; 36473365000; 6505917537; 56560132500; 24478811700; 55865436500,Familial atypical parkinsonism with rare variant in VPS35 and FBXO7 genes: A case report,2016,Medicine (United States),95,46,e5398,,,7,10.1097/MD.0000000000005398,https://www.scopus.com/inward/record.uri?eid=2-s2.0-85012014495&doi=10.1097%2FMD.0000000000005398&partnerID=40&md5=daab54758e3ae05166d63e042f4dcae8,"Department of Neurology, Faculty of Medicine and Dentistry, Palacky University, University Hospital Olomouc, I. P. Pavlova 6, Olomouc, 775 20, Czech Republic; Department of Medical Genetics and Fetal Medicine, Faculty of Medicine and Dentistry, Palacky University, University Hospital, Olomouc, Czech Republic; Department of Nanomaterials in Natural Sciences, Technical University, Liberec, Czech Republic","Bartonikova T., Department of Neurology, Faculty of Medicine and Dentistry, Palacky University, University Hospital Olomouc, I. P. Pavlova 6, Olomouc, 775 20, Czech Republic; Mensikova K., Department of Neurology, Faculty of Medicine and Dentistry, Palacky University, University Hospital Olomouc, I. P. Pavlova 6, Olomouc, 775 20, Czech Republic; Mikulicova L., Department of Neurology, Faculty of Medicine and Dentistry, Palacky University, University Hospital Olomouc, I. P. Pavlova 6, Olomouc, 775 20, Czech Republic; Vodicka R., Department of Medical Genetics and Fetal Medicine, Faculty of Medicine and Dentistry, Palacky University, University Hospital, Olomouc, Czech Republic; Vrtel R., Department of Medical Genetics and Fetal Medicine, Faculty of Medicine and Dentistry, Palacky University, University Hospital, Olomouc, Czech Republic; Godava M., Department of Medical Genetics and Fetal Medicine, Faculty of Medicine and Dentistry, Palacky University, University Hospital, Olomouc, Czech Republic; Vastik M., Department of Neurology, Faculty of Medicine and Dentistry, Palacky University, University Hospital Olomouc, I. P. Pavlova 6, Olomouc, 775 20, Czech Republic; Kaiserova M., Department of Neurology, Faculty of Medicine and Dentistry, Palacky University, University Hospital Olomouc, I. P. Pavlova 6, Olomouc, 775 20, Czech Republic; Otruba P., Department of Neurology, Faculty of Medicine and Dentistry, Palacky University, University Hospital Olomouc, I. P. Pavlova 6, Olomouc, 775 20, Czech Republic; Dolinova I., Department of Nanomaterials in Natural Sciences, Technical University, Liberec, Czech Republic; Nevrly M., Department of Neurology, Faculty of Medicine and Dentistry, Palacky University, University Hospital Olomouc, I. P. Pavlova 6, Olomouc, 775 20, Czech Republic; Kanovsky P., Department of Neurology, Faculty of Medicine and Dentistry, Palacky University, University Hospital Olomouc, I. P. Pavlova 6, Olomouc, 775 20, Czech Republic","Background: A higher prevalence of parkinsonism was recently identified in southeastern Moravia (Czech Republic). Further research confirmed 3 large pedigrees with familial autosomal-dominant parkinsonism spanning 5 generations. Methods: This case report concerns a patient belonging to one of these 3 pedigrees, in whom motor and oculomotor symptoms were accompanied by frontal-type dementia, who finally developed a clinical phenotype of progressive supranuclear palsy. Molecular genetic examinations were performed due to the positive family history. Results: No previously described causal mutation was found. After filtering against common variants (minor allele frequency (MAF)<0.01), 2 noncoding and 1 synonymous rare mutation potentially associable with parkinsonism were identified: GIGYF2 - GRB10 Interacting GYF Protein 2, PARK11 (c.∗2030G>A, rs115669549); VPS35 gene - vacuolar protein sorting 35, PARK17 (c.102+33G>A, rs192115886); and FBXO7 - F-box only protein 7 gene, PARK15 (c.540A>G, rs41311141). Conclusion: As to the changes in the FBXO7 and VPS35 genes (despite phylogenetic conservation in primates), probably neither the FBXO7 nor the VPS35 variants will be direct causal mutations. Both described variants, and possibly the influence of their combination, could increase the risk of the disease. © 2016 the Author(s). Published by Wolters Kluwer Health, Inc. All rights reserved.",Atypical parkinsonism; FBXO7; Hereditary parkinsonism; VPS35,"Aged, 80 and over; Brain; F-Box Proteins; Genetic Predisposition to Disease; Genetic Testing; Humans; Magnetic Resonance Imaging; Male; Mutation; Parkinsonian Disorders; Pedigree; Supranuclear Palsy, Progressive; Vesicular Transport Proteins; alpha synuclein; growth factor receptor bound protein 10; levodopa; phospholipase A2 group VI; protein deglycase DJ-1; ubiquitin protein ligase E3; ubiquitin thiolesterase; F box protein; FBXO7 protein, human; vesicular transport protein; VPS35 protein, human; Article; autosomal dominant inheritance; bradykinesia; brain atrophy; case report; central nervous system; clinical article; cognitive defect; dementia; f box only protein 7 gene; familial disease; family history; father; gait disorder; gene; gene frequency; gene mutation; genetic analysis; genetic variability; grandfather; grandmother; gyf protein 2 gene; human; hypertension; hypomania; male; medical history; Mini Mental State Examination; mother; motor dysfunction; neuroimaging; neurologic disease; nuclear magnetic resonance imaging; park11 gene; parkinson disease protein 2 gene; parkinsonism; pedigree; phenotype; priority journal; progressive supranuclear palsy; protein targeting; slurred speech; treatment response; tremor; upper limb; vacuolar protein sorting 35 gene; brain; complication; diagnostic imaging; genetic predisposition; genetic screening; genetics; mutation; Parkinsonian Disorders; pathophysiology; procedures; Supranuclear Palsy, Progressive; very elderly","K. Mensikova; Department of Neurology, Faculty of Medicine and Dentistry, Palacky University, University Hospital Olomouc, Olomouc, I. P. Pavlova 6, 775 20, Czech Republic; email: katmen@centrum.cz",,Lippincott Williams and Wilkins,00257974,,MEDIA,27861377,English,Medicine,Article,Final,All Open Access; Gold Open Access; Green Open Access,Scopus,2-s2.0-85012014495
Al-ani T.; Cazettes F.; Palfi S.; Lefaucheur J.-P.,"Al-ani, Tarik (6506357239); Cazettes, Fanny (49960962300); Palfi, Stéphane (6603939441); Lefaucheur, Jean-Pascal (7006214637)",6506357239; 49960962300; 6603939441; 7006214637,Automatic removal of high-amplitude stimulus artefact from neuronal signal recorded in the subthalamic nucleus,2011,Journal of Neuroscience Methods,198,1,,135,146,34,10.1016/j.jneumeth.2011.03.022,https://www.scopus.com/inward/record.uri?eid=2-s2.0-79955556398&doi=10.1016%2Fj.jneumeth.2011.03.022&partnerID=40&md5=20e2bb2fc844867b1192c60871885440,"LISV-UVSQ, 78140 Vélizy, 10-12 Av. de l'Europe, France; Dept. Informatique, ESIEE-Paris, Université Paris Est, 93162 Noisy-Le-Grand, Cité Descartes-BP 99, France; ISBS-ESIEE-Paris, 93162 Noisy-Le-Grand, Cité Descartes-BP 99, France; Unité de Neurochirurgie Fonctionnelle, Hôpital Henri Mondor, APHP, 94010 Créteil, 51 av. de Lattre de Tassigny, France; Service de Physiologie, Hôpital Henri Mondor, APHP, 94010 Créteil, 51 av. de Lattre de Tassigny, France; EA 4391, Faculté de Médecine, Université Paris Est Créteil, 94010 Créteil, 8 av. du Général Sarrail, France","Al-ani T., LISV-UVSQ, 78140 Vélizy, 10-12 Av. de l'Europe, France, Dept. Informatique, ESIEE-Paris, Université Paris Est, 93162 Noisy-Le-Grand, Cité Descartes-BP 99, France, ISBS-ESIEE-Paris, 93162 Noisy-Le-Grand, Cité Descartes-BP 99, France; Cazettes F., ISBS-ESIEE-Paris, 93162 Noisy-Le-Grand, Cité Descartes-BP 99, France; Palfi S., Unité de Neurochirurgie Fonctionnelle, Hôpital Henri Mondor, APHP, 94010 Créteil, 51 av. de Lattre de Tassigny, France; Lefaucheur J.-P., Service de Physiologie, Hôpital Henri Mondor, APHP, 94010 Créteil, 51 av. de Lattre de Tassigny, France, EA 4391, Faculté de Médecine, Université Paris Est Créteil, 94010 Créteil, 8 av. du Général Sarrail, France","Over the last few years, deep brain stimulation (DBS) with targets such as the subthalamic nucleus or the pallidum were found to be beneficial in the treatment of Parkinson's disease and dystonia. The investigation of the mechanisms of action of DBS by recording concomitant neural activities in basal ganglia is hampered by the large stimulus artefacts (SA). Approaches to remove the SA with conventional filters, or other conventional digital methods, are not always effective due to the significant overlap between the spectral contents of the neuronal signal and the SA. Thus, such approaches may produce a significant residual SA or alter the neuronal signal dynamics by removing its frequency contents. In this work, we propose a method based on an on-line SA template extraction and on the Ensemble empirical mode decomposition (EEMD) to automatically detect and remove the dynamics of the SA without altering the embedded dynamics of the neuronal signal during stimulation. The results, based on real signals recorded in the subthalamic nucleus during Motor cortex stimulation (MCS) experiments, show that this technique, which may be applied on-line, effectively identifies, separates and removes the SA, and uncovers neuronal potentials superimposed on the artefact. © 2011 Elsevier B.V.",Deep brain stimulation; Ensemble empirical mode decomposition; Motor cortex stimulation; Parkinson's disease; Stimulus artefact,"Algorithms; Artifacts; Automatic Data Processing; Deep Brain Stimulation; Humans; Models, Neurological; Motor Cortex; Neurons; Online Systems; Parkinson Disease; Reproducibility of Results; Subthalamic Nucleus; amplitude modulation; article; autoanalyzer; brain depth stimulation; priority journal; signal processing; subthalamic nucleus","T. Al-ani; Dept. Informatique, ESIEE-Paris, Université Paris Est, 93162 Noisy-Le-Grand, Cité Descartes-BP 99, France; email: t.alani@esiee.fr",,,01650270,,JNMED,21463654,English,J. Neurosci. Methods,Article,Final,,Scopus,2-s2.0-79955556398
Gloersen P.; Yu J.; Mollo-Christensen E.,"Gloersen, Per (7003305888); Yu, Jun (41262723900); Mollo-Christensen, Erik (6602543193)",7003305888; 41262723900; 6602543193,Oscillatory behavior in Arctic sea ice concentrations,1996,Journal of Geophysical Research: Oceans,101,C3,95JC02958,6641,6650,15,10.1029/95JC02958,https://www.scopus.com/inward/record.uri?eid=2-s2.0-0029749384&doi=10.1029%2F95JC02958&partnerID=40&md5=7e8a6e66f5b0ed4bf40fa23bccb28b52,"Oceans and Ice Branch, Lab. for Hydrospheric Processes, NASA Goddard Space Flight Center, Greenbelt, MD, United States; Dept. of Mathematics and Statistics, University of Vermont, Burlington; Dept. Earth, Atmosph.,/Planet. Sci., Massachusetts Inst. of Technology, Cambridge; Lab. for Hydrospheric Processes, Oceans and Ice Branch, NASA Goddard Space Flight Center, Greenbelt, MD 20771, United States; Dept. Earth, Atmosph.,/Planet. Sci., Massachusetts Inst. of Technology, Cambridge, MA 02138, United States; Dept. of Mathematics and Statistics, University of Vermont, Burlington, VT 05405, United States","Gloersen P., Oceans and Ice Branch, Lab. for Hydrospheric Processes, NASA Goddard Space Flight Center, Greenbelt, MD, United States, Lab. for Hydrospheric Processes, Oceans and Ice Branch, NASA Goddard Space Flight Center, Greenbelt, MD 20771, United States; Yu J., Dept. of Mathematics and Statistics, University of Vermont, Burlington, Dept. of Mathematics and Statistics, University of Vermont, Burlington, VT 05405, United States; Mollo-Christensen E., Dept. Earth, Atmosph.,/Planet. Sci., Massachusetts Inst. of Technology, Cambridge, Dept. Earth, Atmosph.,/Planet. Sci., Massachusetts Inst. of Technology, Cambridge, MA 02138, United States","We have done a frequency analysis of the 9-year record of sea ice concentrations obtained with the NASA Nimbus 7 scanning multichannel microwave radiometer (SMMR). Because of the periodic revisit time of the SMMR, we are able to examine recurrence of shorter-period oscillations, as aliased by the revisit frequency, and longer-period oscillations per se. A number of findings result from a sequence of two analysis schemes, as follows. We have first determined, then removed, the mean, linear trend, and seasonal cycle (the latter composed of five harmonics of the annual cycle) from the time series for each pixel of gridded SMMR ice concentration data in the Arctic, using multiple linear regression. We find that the 9-year trends are most positive in the Beaufort and East Greenland Seas, whereas the most negative areas are in the Barents Sea and the sea ice surrounding Svalbard; this is similar to trend patterns in the lengths of the sea ice season reported earlier by Parkinson [1992]. In the residual data the standard deviation ranges from 12% to 16% in the central Arctic basin, considerably above the estimated wintertime ice concentration accuracies of 5% in that region; this is in part due to fluctuations in the ice concentration rather than noise. Secondly, we have used Fourier analysis and multiple-taper filtering techniques to identify tentatively some of these fluctuations as tidal components or multiyear components similar to those found in the El Niño-Southern Oscillation Index, and we show their spatial distribution. However, there are some high-amplitude, periodic components that we have not yet been able to identify; we show the spatial distribution of one of these components. Copyright 1996 by the American Geophysical Union.",,frequency analysis; ice observations; oscillations; sea ice,"P. Gloersen; Lab. for Hydrospheric Processes, Oceans and Ice Branch, NASA Goddard Space Flight Center, Greenbelt, MD 20771, United States; email: Per.Gloersen@gsfc.nasa.gov",,American Geophysical Union,01480227,,,,English,J. Geophys. Res. C Oceans,Article,Final,,Scopus,2-s2.0-0029749384
Brimblecombe K.R.; Gracie C.J.; Platt N.J.; Cragg S.J.,"Brimblecombe, Katherine R. (56491306000); Gracie, Caitlin J. (56495203500); Platt, Nicola J. (36911802600); Cragg, Stephanie J. (7003659379)",56491306000; 56495203500; 36911802600; 7003659379,"Gating of dopamine transmission by calcium and axonal N-, Q-, T- and L-type voltage-gated calcium channels differs between striatal domains",2015,Journal of Physiology,593,4,,929,946,83,10.1113/jphysiol.2014.285890,https://www.scopus.com/inward/record.uri?eid=2-s2.0-84923430130&doi=10.1113%2Fjphysiol.2014.285890&partnerID=40&md5=71bfc16a146fe89e57950f34cc2b3609,"Department of Physiology, Anatomy and Genetics, Sherrington Building, University of Oxford, Oxford, United Kingdom; Oxford Parkinson's Disease Centre, University of Oxford, Oxford, United Kingdom","Brimblecombe K.R., Department of Physiology, Anatomy and Genetics, Sherrington Building, University of Oxford, Oxford, United Kingdom; Gracie C.J., Department of Physiology, Anatomy and Genetics, Sherrington Building, University of Oxford, Oxford, United Kingdom; Platt N.J., Department of Physiology, Anatomy and Genetics, Sherrington Building, University of Oxford, Oxford, United Kingdom; Cragg S.J., Department of Physiology, Anatomy and Genetics, Sherrington Building, University of Oxford, Oxford, United Kingdom, Oxford Parkinson's Disease Centre, University of Oxford, Oxford, United Kingdom","Key points: The voltage-gated Ca2+ channels (VGCCs) that catalyse striatal dopamine transmission are critical to dopamine function and might prime subpopulations of neurons for parkinsonian degeneration. However, the VGCCs that operate on mesostriatal axons are incompletely defined; previous studies encompassed channels on striatal cholinergic interneurons that strongly influence dopamine transmission. We define that multiple types of axonal VGCCs operate that extend beyond classic presynaptic N/P/Q channels to include T- and L-types. We reveal differences in VGCC function between mouse axon types that in humans are vulnerable versus resistant to Parkinson's disease. We show for the first time that this is underpinned by different sensitivity of dopamine transmission to extracellular Ca2+ and by different spatiotemporal intracellular Ca2+ microdomains. These data define key principles of how Ca2+ and VGCCs govern dopamine transmission in the healthy brain and reveal differences between neuron types that might contribute to vulnerability in disease. The axonal voltage-gated Ca2+ channels (VGCCs) that catalyse dopamine (DA) transmission are incompletely defined. Yet, they are critical to DA function and might prime subpopulations of DA neurons for parkinsonian degeneration. Previous studies of VGCCs will have encompassed those on striatal cholinergic interneurons, which strongly influence DA transmission. We identify which VGCCs on DA axons govern DA transmission, we determine their dynamic properties and reveal an underlying basis for differences between the caudate putamen (CPu) and nucleus accumbens (NAc). We detected DA release evoked electrically during nicotinic receptor blockade or optogenetically by light activation of channel rhodopsin-expressing DA axons in mouse striatal slices. Subtype-specific VGCC blockers indicated that N-, Q-, T- and L-VGCCs govern DA release in CPu, but in NAc, T and L-channels are relatively silent. The roles of the most dominant channels were inversely frequency-dependent, due to low-pass filtering of DA release by Ca2+-dependent relationships between initial release probability and short-term plasticity. Ca2+ concentration-response curves revealed that differences between CPu and NAc were due to greater underlying Ca2+ sensitivity of DA transmission from CPu axons. Functions for 'silent' L- and T-channels in NAc could be unmasked by elevating extracellular [Ca2+]. Furthermore, we identified a greater coupling between BAPTA-sensitive, fast Ca2+ transients and DA transmission in CPu axons, and evidence for endogenous fast buffering of Ca2+ in NAc. These data reveal that a range of VGCCs operate dynamically on DA axons, depending on local driving forces. Furthermore, they reveal dramatic differences in Ca2+ handling between axonal subpopulations that show different vulnerability to parkinsonian degeneration. © 2014 The Physiological Society.",,"Animals; Axons; Calcium; Calcium Channels; Corpus Striatum; Dopamine; In Vitro Techniques; Male; Mice, Inbred C57BL; calcium channel L type; calcium channel N type; calcium channel Q type; calcium channel T type; nicotinic receptor; rhodopsin; voltage gated calcium channel; calcium; calcium channel; dopamine; adult; animal experiment; Article; caudate nucleus; channel gating; comparative anatomy; controlled study; corpus striatum; dopaminergic transmission; extracellular calcium; frequency modulation; male; mouse; nerve cell plasticity; nerve fiber; nonhuman; nucleus accumbens; optogenetics; priority journal; protein expression; protein function; putamen; receptor blocking; animal; C57BL mouse; corpus striatum; in vitro study; physiology","S.J. Cragg; Department of Physiology, Anatomy and Genetics, Sherrington Building, University of Oxford, Oxford, OX1 3PT, United Kingdom; email: Stephanie.cragg@dpag.ox.ac.uk",,Blackwell Publishing Ltd,00223751,,JPHYA,25533038,English,J. Physiol.,Article,Final,All Open Access; Green Open Access; Hybrid Gold Open Access,Scopus,2-s2.0-84923430130
Camalier C.R.; Wang A.Y.; McIntosh L.G.; Park S.; Neimat J.S.,"Camalier, Corrie R. (16836243300); Wang, Alice Y. (57193265033); McIntosh, Lindsey G. (54403382600); Park, Sohee (7501834137); Neimat, Joseph S. (13003364900)",16836243300; 57193265033; 54403382600; 7501834137; 13003364900,Subthalamic nucleus deep brain stimulation affects distractor interference in auditory working memory,2017,Neuropsychologia,97,,,66,71,2,10.1016/j.neuropsychologia.2017.02.007,https://www.scopus.com/inward/record.uri?eid=2-s2.0-85012207595&doi=10.1016%2Fj.neuropsychologia.2017.02.007&partnerID=40&md5=6491b8a3f8f41e2818467e873323cbc8,"Department of Neurosurgery, Vanderbilt University Medical Center, Nashville, TN, United States; Department of Psychology, Vanderbilt University, Nashville, TN, United States","Camalier C.R., Department of Neurosurgery, Vanderbilt University Medical Center, Nashville, TN, United States; Wang A.Y., Department of Neurosurgery, Vanderbilt University Medical Center, Nashville, TN, United States; McIntosh L.G., Department of Psychology, Vanderbilt University, Nashville, TN, United States; Park S., Department of Psychology, Vanderbilt University, Nashville, TN, United States; Neimat J.S., Department of Neurosurgery, Vanderbilt University Medical Center, Nashville, TN, United States","Computational and theoretical accounts hypothesize the basal ganglia play a supramodal “gating” role in the maintenance of working memory representations, especially in preservation from distractor interference. There are currently two major limitations to this account. The first is that supporting experiments have focused exclusively on the visuospatial domain, leaving questions as to whether such “gating” is domain-specific. The second is that current evidence relies on correlational measures, as it is extremely difficult to causally and reversibly manipulate subcortical structures in humans. To address these shortcomings, we examined non-spatial, auditory working memory performance during reversible modulation of the basal ganglia, an approach afforded by deep brain stimulation of the subthalamic nucleus. We found that subthalamic nucleus stimulation impaired auditory working memory performance, specifically in the group tested in the presence of distractors, even though the distractors were predictable and completely irrelevant to the encoding of the task stimuli. This study provides key causal evidence that the basal ganglia act as a supramodal filter in working memory processes, further adding to our growing understanding of their role in cognition. © 2017 Elsevier Ltd","Basal ganglia; Domain general; Non-spatial, Parkinson's disease; Phonological; Subthalamic nucleus; Working memory","Aged; Attention; Auditory Perception; Basal Ganglia; Deep Brain Stimulation; Humans; Memory, Short-Term; Middle Aged; Parkinson Disease; Subthalamic Nucleus; levodopa; adult; Article; auditory memory; basal ganglion; brain depth stimulation; clinical article; controlled study; correlation analysis; human; intelligence quotient; mental performance; neuromodulation; Parkinson disease; subthalamic nucleus; Wechsler intelligence scale; Wechsler memory scale; working memory; aged; attention; brain depth stimulation; hearing; middle aged; Parkinson disease; pathophysiology; physiology; procedures; short term memory; subthalamic nucleus",C.R. Camalier; United States; email: corrie.camalier@gmail.com,,Elsevier Ltd,00283932,,NUPSA,28174049,English,Neuropsychologia,Article,Final,,Scopus,2-s2.0-85012207595
