"﻿""Authors""",Author full names,Author(s) ID,Title,Year,Source title,Volume,Issue,Art. No.,Page start,Page end,Cited by,DOI,Link,Affiliations,Authors with affiliations,Abstract,Author Keywords,Index Keywords,Correspondence Address,Editors,Publisher,ISSN,ISBN,CODEN,PubMed ID,Language of Original Document,Abbreviated Source Title,Document Type,Publication Stage,Open Access,Source,EID
Syrimi Z.J.; Vojtisek L.; Eliasova I.; Viskova J.; Svatkova A.; Vanicek J.; Rektorova I.,"Syrimi, Zoe Joanna (57193517509); Vojtisek, Lubomir (36136096000); Eliasova, Ilona (55524322100); Viskova, Jana (57053482500); Svatkova, Alena (56716573300); Vanicek, Jiri (24778846600); Rektorova, Irena (6603054591)",57193517509; 36136096000; 55524322100; 57053482500; 56716573300; 24778846600; 6603054591,Arterial spin labelling detects posterior cortical hypoperfusion in non-demented patients with Parkinson’s disease,2017,Journal of Neural Transmission,124,5,,551,557,50,10.1007/s00702-017-1703-1,https://www.scopus.com/inward/record.uri?eid=2-s2.0-85014524280&doi=10.1007%2Fs00702-017-1703-1&partnerID=40&md5=44deccc1eb77d521c8526770d2578a58,"Medical Faculty, Masaryk University, Brno, Czech Republic; Multimodal and Functional Neuroimaging Research Group, CEITEC-Central European Institute of Technology, Masaryk University, Brno, Czech Republic; Applied Neuroscience Research Group, CEITEC-Central European Institute of Technology, Masaryk University, Brno, Czech Republic; First Department of Neurology, Medical Faculty, Masaryk University and St. Anne’s University Hospital, Brno, Czech Republic; Department of Medical Imaging, Medical Faculty, Masaryk University and St. Anne’s University Hospital, Brno, Czech Republic; Department of Paediatrics, University of Minnesota, Minneapolis, MN, United States","Syrimi Z.J., Medical Faculty, Masaryk University, Brno, Czech Republic; Vojtisek L., Multimodal and Functional Neuroimaging Research Group, CEITEC-Central European Institute of Technology, Masaryk University, Brno, Czech Republic; Eliasova I., Applied Neuroscience Research Group, CEITEC-Central European Institute of Technology, Masaryk University, Brno, Czech Republic, First Department of Neurology, Medical Faculty, Masaryk University and St. Anne’s University Hospital, Brno, Czech Republic; Viskova J., Applied Neuroscience Research Group, CEITEC-Central European Institute of Technology, Masaryk University, Brno, Czech Republic, Department of Medical Imaging, Medical Faculty, Masaryk University and St. Anne’s University Hospital, Brno, Czech Republic; Svatkova A., Multimodal and Functional Neuroimaging Research Group, CEITEC-Central European Institute of Technology, Masaryk University, Brno, Czech Republic, Department of Paediatrics, University of Minnesota, Minneapolis, MN, United States; Vanicek J., Department of Medical Imaging, Medical Faculty, Masaryk University and St. Anne’s University Hospital, Brno, Czech Republic; Rektorova I., Applied Neuroscience Research Group, CEITEC-Central European Institute of Technology, Masaryk University, Brno, Czech Republic, First Department of Neurology, Medical Faculty, Masaryk University and St. Anne’s University Hospital, Brno, Czech Republic","While previous studies suggested that perfusion abnormalities in Parkinson’s disease (PD) are driven by dementia, our study aimed to identify perfusion underpinning of cognitive alteration in non-demented PD patients. Cerebral blood flow was measured using arterial spin labelling (ASL) in 28 PD patients (age 65 years ± 9.9 SD) and 16 age-matched healthy controls (HC) (age 65 years ± 7.8 SD), who also underwent neurological and cognitive testing. The 3D pseudocontinuous ASL and T2-weighted scans from 22 PD patients and 16 HC were analysed in a voxel-wise manner using SPM8 software. Associations between the ASL values in volumes of interest (VOIs) and behavioural and cognitive measures were assessed by Spearman correlation analysis. Posterior cortical hypoperfusion was found in PD patients compared to HC in the left supramarginal gyrus/superior temporal gyrus (VOI1) and left posterior cingulate/precuneus (VOI2). Positive correlation was revealed between perfusion in the VOI2 and Addenbrooke’s Cognitive Examination Revised (ACE-R) scores after filtering out the effect of age, levodopa equivalent dose (LED), and total intracranial volume (TIV) (R = 0.51, p = 0.04). Conversely, negative correlation between VOI1 and ACE-R was detected (R = −0.62, p = 0.01) after regressing out the effects of motor impairment, age, LED, and TIV. In non-demented subjects with PD, blood flow abnormalities in precuneus/posterior cingulate were linked to the level of motor impairment and global cognitive performance. Oppositely, perfusion abnormalities in supramarginal gyrus might serve as a compensatory mechanism for brain degeneration and decreased cognitive performance. © 2017, Springer-Verlag Wien.",Arterial spin labelling; Cognitive performance; Parkinson’s disease; Perfusion,"Aged; Cerebral Cortex; Cerebrovascular Circulation; Cerebrovascular Disorders; Cross-Sectional Studies; Female; Humans; Image Processing, Computer-Assisted; Imaging, Three-Dimensional; Magnetic Resonance Imaging; Male; Motor Activity; Parkinson Disease; Severity of Illness Index; Spin Labels; spin label; Addenbrooke Cognitive Examination Revised; aged; arterial spin labeling; Article; brain blood flow; brain degeneration; brain region; clinical article; comparative study; controlled study; data analysis software; dementia assessment; female; human; imaging software; male; neuroimaging; nuclear magnetic resonance imaging; nuclear magnetic resonance scanner; Parkinson disease; perfusion; posterior cingulate; posterior cortical hypoperfusion; priority journal; brain circulation; brain cortex; cerebrovascular disease; cross-sectional study; diagnostic imaging; image processing; motor activity; nuclear magnetic resonance imaging; Parkinson disease; pathophysiology; physiology; psychology; severity of illness index; three dimensional imaging","I. Rektorova; Applied Neuroscience Research Group, CEITEC-Central European Institute of Technology, Masaryk University, Brno, Czech Republic; email: irena.rektorova@fnusa.cz",,Springer-Verlag Wien,03009564,,JNTRF,28271290,English,J. Neural Transm.,Article,Final,,Scopus,2-s2.0-85014524280
Klempíř O.; Krupička R.; Jech R.,"Klempíř, Ondřej (57195508277); Krupička, Radim (35181511900); Jech, Robert (6701631254)",57195508277; 35181511900; 6701631254,Median method for determining cortical brain activity in a near infrared spectroscopy image,2018,Lekar a Technika,48,1,,11,16,0,,https://www.scopus.com/inward/record.uri?eid=2-s2.0-85049771148&partnerID=40&md5=720e3fc99ac93cf54b7f45d2cc34003e,"Department of Biomedical Informatics, Faculty of Biomedical Engineering, Czech Technical University in Prague, Kladno, Czech Republic; Department of Neurology, First Medical Faculty and General University Hospital, Charles University, Prague, Czech Republic","Klempíř O., Department of Biomedical Informatics, Faculty of Biomedical Engineering, Czech Technical University in Prague, Kladno, Czech Republic; Krupička R., Department of Biomedical Informatics, Faculty of Biomedical Engineering, Czech Technical University in Prague, Kladno, Czech Republic; Jech R., Department of Neurology, First Medical Faculty and General University Hospital, Charles University, Prague, Czech Republic","Near-InfraRed-Spectroscopy (NIRS) is a neuroimaging method of brain cortical activity using low-energy optical radiation to detect local changes in (de)oxyhaemoglobin concentration. A methodology consisting of a raw signal pre-processing phase, followed by statistical analysis based on a general linear model, is currently being used to determine signal activity. The aim of this research is to define the median modification of the standard method usually used for the estimation of cortical activity from the NIRS signal and to verify its applicability in measuring motor tasks for patients with Parkinson's disease. Individual examinations were conducted in 10 cycles, during which finger tapping, and rest phases were alternating. Changes in oxyhaemoglobin concentration were calculated from the native NIRS signal using the modified Lambert-Beer equation. The signals were filtered in the 0.015–0.3 Hz band and fitted by the physiological response function of the brain tissue for each finger tapping cycle separately. The median value from the 10 cycles was then computed. Activity values obtained in individual subjects have been used in Brain Mapping visualizations. These describe motor task patterns during the ON and OFF deep brain stimulation of the subthalamic nucleus in Parkinson's disease, which demonstrates activation in accordance with the current state of knowledge in functional imaging. © 2018, Czech Medical Association J.E. Purkyne. All rights reserved.",Brain mapping; Near infrared spectroscopy; Neuroimaging; Neuromodulation; Neurophotonics; Parkinson's disease,oxyhemoglobin; adult; Article; association cortex; brain cortex; brain depth stimulation; brain mapping; brain tissue; clinical article; data analysis software; electroencephalogram; female; finger tapping test; frontal cortex; functional near-infrared spectroscopy; functional neuroimaging; human; male; middle aged; motor activity; motor performance; neuromodulation; parietal cortex; Parkinson disease; premotor cortex; primary motor cortex; primary somatosensory cortex; signal processing; subthalamic nucleus; supplementary motor area; task performance,"O. Klempíř; Department of Biomedical Informatics, Faculty of Biomedical Engineering, Czech Technical University in Prague, Kladno, Nám Sítná 3105, CZ-272 01, Czech Republic; email: klempond@gmail.com",,Czech Medical Association J.E. Purkyne,03015491,,LETED,,English,Lek. Tech.,Article,Final,,Scopus,2-s2.0-85049771148
Rocca W.A.; Bower J.H.; Ahlskog J.E.; Elbaz A.; Grossardt B.R.; McDonnell S.K.; Schaid D.J.; Maraganore D.M.,"Rocca, Walter A. (7006276394); Bower, James H. (7202437394); Ahlskog, J. Eric (7007036448); Elbaz, Alexis (7003618656); Grossardt, Brandon R. (8673768000); McDonnell, Shannon K. (7006725552); Schaid, Daniel J. (7006237594); Maraganore, Demetrius M. (7005578846)",7006276394; 7202437394; 7007036448; 7003618656; 8673768000; 7006725552; 7006237594; 7005578846,Increased risk of essential tremor in first-degree relatives of patients with Parkinson's disease,2007,Movement Disorders,22,11,,1607,1614,68,10.1002/mds.21584,https://www.scopus.com/inward/record.uri?eid=2-s2.0-34748857591&doi=10.1002%2Fmds.21584&partnerID=40&md5=97ff57d5f371330aac8552c063a5f849,"Division of Epidemiology, Department of Health Sciences Research, Mayo Clinic College of Medicine, Rochester, MN, United States; Department of Neurology, Mayo Clinic College of Medicine, Rochester, MN, United States; Institut National de la Sante et de la Recherché Médical, Inserm, U708, Paris, F-75013, France; Division of Biostatistics, Department of Health Sciences Research, May Clinic College of Medicine, Rochester, MN, United States; Division of Epidemiology, Department of Health Sciences Research, Mayo Clinic, Rochester, MN 55905, 200 First Street SW, United States","Rocca W.A., Division of Epidemiology, Department of Health Sciences Research, Mayo Clinic College of Medicine, Rochester, MN, United States, Department of Neurology, Mayo Clinic College of Medicine, Rochester, MN, United States, Division of Epidemiology, Department of Health Sciences Research, Mayo Clinic, Rochester, MN 55905, 200 First Street SW, United States; Bower J.H., Department of Neurology, Mayo Clinic College of Medicine, Rochester, MN, United States; Ahlskog J.E., Department of Neurology, Mayo Clinic College of Medicine, Rochester, MN, United States; Elbaz A., Division of Epidemiology, Department of Health Sciences Research, Mayo Clinic College of Medicine, Rochester, MN, United States, Institut National de la Sante et de la Recherché Médical, Inserm, U708, Paris, F-75013, France; Grossardt B.R., Division of Biostatistics, Department of Health Sciences Research, May Clinic College of Medicine, Rochester, MN, United States; McDonnell S.K., Division of Biostatistics, Department of Health Sciences Research, May Clinic College of Medicine, Rochester, MN, United States; Schaid D.J., Division of Biostatistics, Department of Health Sciences Research, May Clinic College of Medicine, Rochester, MN, United States; Maraganore D.M., Department of Neurology, Mayo Clinic College of Medicine, Rochester, MN, United States","We conducted a historical cohort study of 981 first-degree relatives of 162 patients with Parkinson's disease (PD) and of 838 first-degree relatives of 147 controls representative of the population of Olmsted County, Minnesota. In addition, we studied 2,684 first-degree relatives of 411 patients with PD referred to the Mayo Clinic. Relatives were interviewed and screened for tremor either directly or through a proxy, and those who screened positive were examined or copies of their medical records were obtained to confirm the diagnosis of essential tremor (ET). We also obtained ET information from a medical records-linkage system (family study method). In the population-based sample, the risk of ET was significantly increased for relatives of patients with onset of PD ≤ 66 years (first tertile; hazard ratio [HR] = 2.24; 95% confidence interval [95% CI] = 1.26-3.98; P = 0.006). In the referral-based sample, the risk of ET among relatives increased with younger onset of PD in patients (linear trend; P = 0.001), and was higher in relatives of PD patients with the tremor-predominant or mixed form when compared with relatives of patients with the akinetic-rigid form, and in men compared with women. These findings suggest that PD and ET may share familial susceptibility factors. © 2007 Movement Disorder Society.",Cohort study; Essential tremor; Familial aggregation; Genetics; Parkinson's disease,"Age Factors; Aged; Aged, 80 and over; Cohort Studies; Confidence Intervals; Essential Tremor; Family Health; Female; Humans; Male; Middle Aged; Parkinson Disease; Proportional Hazards Models; Retrospective Studies; Risk; Sex Factors; adult; aged; analytic method; article; cohort analysis; comparative study; confidence interval; controlled study; disease predisposition; essential tremor; female; hazard ratio; human; interview; major clinical study; male; medical record; Parkinson disease; population research; priority journal; relative; screening","W.A. Rocca; Division of Epidemiology, Department of Health Sciences Research, Mayo Clinic, Rochester, MN 55905, 200 First Street SW, United States; email: rocca@mayo.edu",,,15318257,,MOVDE,17546668,English,Mov. Disord.,Article,Final,,Scopus,2-s2.0-34748857591
Chandran K.S.; Perumalsamy M.,"Chandran, Kalyana Sundaram (57191346286); Perumalsamy, Marichamy (56595148600)",57191346286; 56595148600,EEG Based Strategies for Human Gustation Classification Using Spartan—6 FPGA,2018,Wireless Personal Communications,103,4,,3041,3053,7,10.1007/s11277-018-5993-x,https://www.scopus.com/inward/record.uri?eid=2-s2.0-85054312604&doi=10.1007%2Fs11277-018-5993-x&partnerID=40&md5=b3680e7d6850525ba7235b6af1cb2d6d,"MEPCO Schlenk Engineering College, Sivakasi, Tamilnadu, India; P.S.R. Engineering College, Sivakasi, Tamilnadu, India","Chandran K.S., MEPCO Schlenk Engineering College, Sivakasi, Tamilnadu, India; Perumalsamy M., P.S.R. Engineering College, Sivakasi, Tamilnadu, India","Gustation is one of the five sensations and is responsible for the inhibition of electrical stimulation, thus reflecting in the overall cortical activity of the brain due to the electrical stimulation. The information processing of gustation are employed for disorder recognition such as Parkinson’s disease, etc. and is a source of reimbursement for better clinical diagnosis. EEG signal of gustatory stimulus is preprocessed using IIR band pass filter to remove the artifacts due to noise. The advantage of using IIR filter is the requirement of lesser memory space and works faster than FIR filter. Extraction of features such as Short Time Fourier Transform and Fast Fourier Transform are frequency-domain analysis in which the signal is assumed to be stationary. An algorithm for feature extraction used in the proposed work is Stationary Wavelet Transform (SWT) which provides time frequency representation. In time domain, the statistical features of the detailed coefficients are computed and a filtered EEG signal is decomposed using SWT. The statistical features computed here are the mean which is an average of the absolute value of the EEG signal, variance which uses the power of the EEG signal as a feature of the signal and power spectral density. The different gustatory stimuli of bitter, sour and sweet are classified based on the features extracted. Lastly, the feature extraction and preprocessing algorithms are implemented in Spartan—6 FPGA kit. The proposed system possesses an advantage of increased computational speed and reduced area utilization compared to existing method. © 2018, Springer Science+Business Media, LLC, part of Springer Nature.",BCI; EEG; ERP; Gustatory stimuli; IIR filter; SWT,Bandpass filters; Brain; Brain computer interface; Diagnosis; Electroencephalography; Enterprise resource planning; Extraction; Fast Fourier transforms; Feature extraction; Field programmable gate arrays (FPGA); FIR filters; Frequency domain analysis; IIR filters; Spectral density; Time domain analysis; Computational speed; Electrical stimulations; Gustatory stimuli; Pre-processing algorithms; Short time Fourier transforms; Stationary wavelet; Statistical features; Time-frequency representations; Biomedical signal processing,"K.S. Chandran; MEPCO Schlenk Engineering College, Sivakasi, India; email: kalyan@mepcoeng.ac.in",,Springer New York LLC,09296212,,WPCOF,,English,Wireless Pers Commun,Article,Final,,Scopus,2-s2.0-85054312604
Miyashita N.; Narabayashi Y.; Oshima T.,"Miyashita, Nobuo (58712800100); Narabayashi, Yohsuke (58714109900); Oshima, Tomokazu (58713674100)",58712800100; 58714109900; 58713674100,Comparative study of non-parkinsonian and parkinsonian motor symptoms in view of brain activities monitored during thalamotomy,2016,Neurology and Clinical Neuroscience,4,2,,41,51,1,10.1111/ncn3.12032,https://www.scopus.com/inward/record.uri?eid=2-s2.0-85177647907&doi=10.1111%2Fncn3.12032&partnerID=40&md5=bb15cdbdb3da9f310c10f51022986c3e,"Narabayashi Memorial Laboratory of Neurology, Neurological Clinic, Tokyo, Japan","Miyashita N., Narabayashi Memorial Laboratory of Neurology, Neurological Clinic, Tokyo, Japan; Narabayashi Y., Narabayashi Memorial Laboratory of Neurology, Neurological Clinic, Tokyo, Japan; Oshima T., Narabayashi Memorial Laboratory of Neurology, Neurological Clinic, Tokyo, Japan","Background: We treat non-parkinsonian motor disorders by thalamotomy, assuming their pathophysiological similarity to Parkinson's disease (PD). Aim: We compared the non-parkinsonian and parkinsonian brain activities to clarify their similarity and difference. Methods: We examined patients only with tremor of essential tremor and of unknown origin (NP-I; n = 8), patients with tremor complicated by other deficits including rigidity and bradykinesia (NP-II; n = 15), PD patients with rigidity, but no tremor (PD-I; n = 10), and PD patients with tremor and rigidity (PD-II; n = 10). Estimation of tremor, rigidity and bradykinesia followed the Unified Parkinson's Disease Rating Scale. We recorded brain local field potentials, multiple unit spikes, and neck and limb electromyograms. Local field potentials were separately rated in bands of 3-7, 7-13, 13-27 and 27-80 Hz. Results: Surgery alleviated tremor and rigidity. Thalamic 3-7-Hz (τ-range) activities led to tremor in NP-I as in PD-II. The amounts of τ-range activities in NP-I and II were ranked between PD-I and II. Thalamic 13-27-Hz (β-band) activities led to rigidity in PDI and II, but were far less in NP-I, and were ranked in NP-II between NP-I and PD groups. Conclusion: Surgical alleviation of tremor in NP-I and PD-II implicates their common pathophysiology with τ-range activities. Low β-band activities in NP-I assure that their amount is within the physiologically normal level, and suggest that their exaggeration causes parkinsonian rigidity. In all the groups, positive quantitative correlations were found between tremor and τ-range activities, and between rigidity and β-band activities. © 2016 Japanese Society of Neurology and John Wiley & Sons Australia, Ltd.",13-27-Hz activities; 3-7-Hz activities; Essential tremor; Non-parkinsonian motor disorders; Thalamotomy,adult; aged; Article; bradykinesia; clinical article; controlled study; electroencephalogram; female; human; male; middle aged; parkinsonism; priority journal; rigidity; thalamotomy; tremor; Unified Parkinson Disease Rating Scale; very elderly; young adult,"T. Oshima; Narabayashi Memorial Laboratory of Neurology, Neurological Clinic, Suginami-ku, Tokyo, 2-23-6 Izumi, 168-0063, Japan; email: ZVD05122@nifty.ne.jp",,,20494173,,,,English,Neurol. Clin. Neurosci.,Article,Final,All Open Access; Bronze Open Access,Scopus,2-s2.0-85177647907
Yasutake D.; Kitano M.; Hamakoga M.; Araki T.; Nagasuga K.; Suzuki Y.,"Yasutake, D. (18438989800); Kitano, M. (7201437678); Hamakoga, M. (6506163397); Araki, T. (9249831100); Nagasuga, K. (6508266935); Suzuki, Y. (57206758881)",18438989800; 7201437678; 6506163397; 9249831100; 6508266935; 57206758881,An improved cuvette for individual evaluations of gas exchange parameters on adaxial and abaxial leaf surfaces under different air currents,2000,Biotronics,29,,,33,42,3,,https://www.scopus.com/inward/record.uri?eid=2-s2.0-0034466098&partnerID=40&md5=05bc4ffd8c47d8ca4b434edaa9bb63cc,"Graduate School of Bioresource, Bioenvironmental Sciences, Kyushu University, Fukuoka 812-8581, Japan","Yasutake D., Graduate School of Bioresource, Bioenvironmental Sciences, Kyushu University, Fukuoka 812-8581, Japan; Kitano M., Graduate School of Bioresource, Bioenvironmental Sciences, Kyushu University, Fukuoka 812-8581, Japan; Hamakoga M., Graduate School of Bioresource, Bioenvironmental Sciences, Kyushu University, Fukuoka 812-8581, Japan; Araki T., Graduate School of Bioresource, Bioenvironmental Sciences, Kyushu University, Fukuoka 812-8581, Japan; Nagasuga K., Graduate School of Bioresource, Bioenvironmental Sciences, Kyushu University, Fukuoka 812-8581, Japan; Suzuki Y., Graduate School of Bioresource, Bioenvironmental Sciences, Kyushu University, Fukuoka 812-8581, Japan","For individual evaluations of gas exchange parameters on adaxial and abaxial leaf surfaces, the Parkinson leaf cuvette (PP Systems. Ltd., UK) was improved by providing individual air paths to the respective upper (adaxial) and lower (abaxial) leaf cuvettes, where air current in each cuvette was also adjustable independently. The performance of the improved cuvette system was examined by using a wetted filter paper and a cucumber leaf. The three different modes of measurement, i.e. the upper cuvette mode, the lower cuvette mode and the both cuvettes mode, were selected successively, and leaf boundary layer conductance on each surface was arbitrarily adjusted in the range of 0.3 mol m-2s-1 to 1.0 mol m-2s-1. The heterogeneity between adaxial and abaxial surfaces of the cucumber leaf was found in gas exchange parameters such as stomatal conductance and rates of transpiration and photosynthesis, and further stomatal response to air current was revealed quantitatively by change in stomatal conductance.",Adaxial and abaxial surfaces; Heterogeneity; Leaf cuvette; Stomatal response to air current,,,,,02890011,,BIOTE,,English,Biotronics,Article,Final,,Scopus,2-s2.0-0034466098
