Belda-Lois J.M.; Martinez-Reyero A.I.; Castillo A.; Rocon E.; Pons J.L.; Loureiro R.; Manto M.; Normie L.; Soede M.,"Belda-Lois, Juan Ma (6505849621); Martinez-Reyero, A.I. (23492883900); Castillo, A. (7101820122); Rocon, E. (57194829160); Pons, J.L. (7202123192); Loureiro, R. (14034214600); Manto, M. (35565096000); Normie, L. (6506567486); Soede, M. (6603873617)",6505849621; 23492883900; 7101820122; 57194829160; 7202123192; 14034214600; 35565096000; 6506567486; 6603873617,Controllable mechanical tremor reduction. Assessment of two orthoses,2007,Technology and Disability,19,4,,169,178,32,10.3233/tad-2007-19402,https://www.scopus.com/inward/record.uri?eid=2-s2.0-39049145244&doi=10.3233%2Ftad-2007-19402&partnerID=40&md5=78c502875aefabfa2cdf454da4f247ed,"Instituto de Biomecánica de Valencia, Universidad Politécnica de Valencia, E46022 Valencia, Edificio 9c. Camino de Vera s/n, Spain; Hospital General Universitario de Valencia, Valencia, Spain; Insituto de Automática Industria; Department of Cybernetics, University of Reading, Reading, United Kingdom; Univerisité Libre de Bruxelles, Bruxelles, Belgium; GeronTech, The Israeli Center for Assistive Technology and Aging, Israel; iRv. Institute for Rehabilitation Research, Hoensbroek, Netherlands","Belda-Lois J.M., Instituto de Biomecánica de Valencia, Universidad Politécnica de Valencia, E46022 Valencia, Edificio 9c. Camino de Vera s/n, Spain; Martinez-Reyero A.I., Instituto de Biomecánica de Valencia, Universidad Politécnica de Valencia, E46022 Valencia, Edificio 9c. Camino de Vera s/n, Spain; Castillo A., Hospital General Universitario de Valencia, Valencia, Spain; Rocon E., Insituto de Automática Industria; Pons J.L., Insituto de Automática Industria; Loureiro R., Department of Cybernetics, University of Reading, Reading, United Kingdom; Manto M., Univerisité Libre de Bruxelles, Bruxelles, Belgium; Normie L., GeronTech, The Israeli Center for Assistive Technology and Aging, Israel; Soede M., iRv. Institute for Rehabilitation Research, Hoensbroek, Netherlands","This paper presents the results of clinical trials performed using two upper-limb orthotic devices for tremor suppression, developed under the Fifth Framework Project DRIFTS (Contract QLK6-CT-2002-00536). The orthoses were tested on six subjects presenting various aetiological forms of tremor. Two different strategies of tremor reduction were investigated: viscous friction and notch filtering. The results obtained from the trials suggest that ambulatory and controllable mechanical suppression of tremor by orthotic means is a feasible intervention. The degree of tremor reduction is dependent upon the power associated with tremor. Expected reduction of tremor can be as high as 98% in severe cases. There are hints that for many persons suffering with tremor active mechanical suppression of tremor can produce a reinforcing feedback: when participants perceived and initial reduction of tremor due to the orthosis, they exhibited a further spontaneous reduction of the tremor. There are also indications in some participants that tremor can migrate from a controlled joint to other free joints. © 2007 IOS Press. All rights reserved.",,levodopa; article; clinical article; clinical trial; controlled clinical trial; controlled study; disease severity; double blind procedure; essential tremor; feasibility study; function test; human; limb tremor; orthosis; Parkinson disease,"J.M. Belda-Lois; Instituto de Biomecánica de Valencia, Universidad Politécnica de Valencia, E46022 Valencia, Edificio 9c. Camino de Vera s/n, Spain; email: juanma.belda@ibv.upv.es",,IOS Press,10554181,,TEDIF,,English,Technol. Disabil.,Article,Final,,Scopus,2-s2.0-39049145244
Redenšek S.; Bizjan B.J.; Trošt M.; Dolžan V.,"Redenšek, Sara (57193522851); Bizjan, Barbara Jenko (57211311207); Trošt, Maja (7003908826); Dolžan, Vita (6602823313)",57193522851; 57211311207; 7003908826; 6602823313,Clinical-pharmacogenetic predictive models for time to occurrence of levodopa related motor complications in Parkinson's disease,2019,Frontiers in Genetics,10,MAY,461,,,21,10.3389/fgene.2019.00461,https://www.scopus.com/inward/record.uri?eid=2-s2.0-85067873113&doi=10.3389%2Ffgene.2019.00461&partnerID=40&md5=67979425ec061802de0dce560981a4d7,"Pharmacogenetics Laboratory, Institute of Biochemistry, Faculty of Medicine, University of Ljubljana, Ljubljana, Slovenia; Department of Neurology, University Medical Centre Ljubljana, Ljubljana, Slovenia","Redenšek S., Pharmacogenetics Laboratory, Institute of Biochemistry, Faculty of Medicine, University of Ljubljana, Ljubljana, Slovenia; Bizjan B.J., Pharmacogenetics Laboratory, Institute of Biochemistry, Faculty of Medicine, University of Ljubljana, Ljubljana, Slovenia; Trošt M., Department of Neurology, University Medical Centre Ljubljana, Ljubljana, Slovenia; Dolžan V., Pharmacogenetics Laboratory, Institute of Biochemistry, Faculty of Medicine, University of Ljubljana, Ljubljana, Slovenia","The response to dopaminergic treatment in Parkinson's disease depends on many clinical and genetic factors. The very common motor fluctuations (MF) and dyskinesia affect approximately half of patients after 5 years of treatment with levodopa. We did an evaluation of a combined effect of 16 clinical parameters and 34 single nucleotide polymorphisms to build clinical and clinical-pharmacogenetic models for prediction of time to occurrence of motor complications and to compare their predictive abilities. In total, 220 Parkinson's disease patients were included in the analysis. Their demographic, clinical, and genotype data were obtained. The combined effect of clinical and genetic factors was assessed using The Least Absolute Shrinkage and Selection Operator penalized regression in the Cox proportional hazards model. Clinical and clinical-pharmacogenetic models were constructed. The predictive capacity of the models was evaluated with the cross-validated area under time-dependent receiver operating characteristic curve. Clinical-pharmacogenetic model included age at diagnosis (HR = 0.99), time from diagnosis to initiation of levodopa treatment (HR = 1.24), COMT rs165815 (HR = 0.90), DRD3 rs6280 (HR = 1.03), and BIRC5 rs9904341 (HR = 0.95) as predictive factors for time to occurrence of MF. Furthermore, clinical-pharmacogenetic model for prediction of time to occurrence of dyskinesia included female sex (HR = 1.07), age at diagnosis (HR = 0.97), tremor-predominant Parkinson's disease (HR = 0.88), beta-blockers (HR = 0.95), alcohol consumption (HR = 0.99), time from diagnosis to initiation of levodopa treatment (HR = 1.15), CAT rs1001179 (HR = 1.27), SOD2 rs4880 (HR = 0.95), NOS1 rs2293054 (HR = 0.99), COMT rs165815 (HR = 0.92), and SLC22A1 rs628031 (HR = 0.80). Areas under the curves for clinical and clinical-pharmacogenetic models for MF after 5 years of levodopa treatment were 0.68 and 0.70, respectively. Areas under the curves for clinical and clinical-pharmacogenetic models for dyskinesia after 5 years of levodopa treatment were 0.71 and 0.68, respectively. These results show that clinical-pharmacogenetic models do not have better ability to predict time to occurrence of motor complications in comparison to the clinical ones despite the significance of several polymorphisms. Models could be improved by a larger sample size and by additional polymorphisms, epigenetic predictors or serum biomarkers. Copyright © 2019 Redenšek, Jenko Bizjan, Trošt and Dolžan. This is an open-access article distributed under the terms of the Creative Commons Attribution License (CC BY). The use, distribution or reproduction in other forums is permitted, provided the original author(s) and the copyright owner(s) are credited and that the original publication in this journal is cited, in accordance with accepted academic practice. No use, distribution or reproduction is permitted which does not comply with these terms.",Dopaminergic treatment; Dyskinesia; Motor fluctuations; Parkinson's disease; Personalized medicine; Pharmacogenetics; Polymorphisms,beta adrenergic receptor blocking agent; levodopa; nonsteroid antiinflammatory agent; adult; aged; alcohol consumption; apoptosis; area under the curve; Article; cell proliferation; coffee; constipation; depression; diagnostic accuracy; DNA extraction; dyskinesia; ethnicity; female; follow up; gene frequency; genetic association; genetic association study; genotype; human; major clinical study; male; middle aged; motor dysfunction; nerve cell differentiation; nervous system inflammation; oxidative stress; parasomnia; Parkinson disease; pharmacogenetics; predictive value; receiver operating characteristic; sensitivity and specificity; single nucleotide polymorphism; smoking; structured interview; treatment duration; tremor,"V. Dolžan; Pharmacogenetics Laboratory, Institute of Biochemistry, Faculty of Medicine, University of Ljubljana, Ljubljana, Slovenia; email: vita.dolzan@mf.uni-lj.si",,Frontiers Media S.A.,16648021,,,,English,Front. Genet.,Article,Final,All Open Access; Gold Open Access; Green Open Access,Scopus,2-s2.0-85067873113
Zech M.; Castrop F.; Schormair B.; Jochim A.; Wieland T.; Gross N.; Lichtner P.; Peters A.; Gieger C.; Meitinger T.; Strom T.M.; Oexle K.; Haslinger B.; Winkelmann J.,"Zech, Michael (57555730300); Castrop, Florian (15727305500); Schormair, Barbara (18042766200); Jochim, Angela (6508339292); Wieland, Thomas (57194649184); Gross, Nadine (42961452500); Lichtner, Peter (34570846800); Peters, Annette (7402105900); Gieger, Christian (57216996786); Meitinger, Thomas (57215631099); Strom, Tim M. (7102342124); Oexle, Konrad (57189356630); Haslinger, Bernhard (6701784886); Winkelmann, Juliane (7005034324)",57555730300; 15727305500; 18042766200; 6508339292; 57194649184; 42961452500; 34570846800; 7402105900; 57216996786; 57215631099; 7102342124; 57189356630; 6701784886; 7005034324,DYT16 revisited: Exome sequencing identifies PRKRA mutations in a European dystonia family,2014,Movement Disorders,29,12,,1504,1510,47,10.1002/mds.25981,https://www.scopus.com/inward/record.uri?eid=2-s2.0-84927564405&doi=10.1002%2Fmds.25981&partnerID=40&md5=ced2d541d5227d27b672202cc980ac23,"Neurologische Klinik und Poliklinik, Klinikum rechts der Isar, Technische Universität München, Munich, Germany; Institut für Humangenetik, Helmholtz Zentrum München, Munich, Germany; Institut für Humangenetik, Technische Universität München, Munich, Germany; Institute of Epidemiology II, Helmholtz Zentrum München, Munich, Germany; Institute of Genetic Epidemiology, Helmholtz Zentrum München, Munich, Germany; Munich Cluster for Systems Neurology, SyNergy, Munich, Germany; Department of Neurology and Neurological Sciences and Center for Sleep Sciences and Medicine, Stanford University School of Medicine, Palo Alto, CA, United States","Zech M., Neurologische Klinik und Poliklinik, Klinikum rechts der Isar, Technische Universität München, Munich, Germany, Institut für Humangenetik, Helmholtz Zentrum München, Munich, Germany; Castrop F., Neurologische Klinik und Poliklinik, Klinikum rechts der Isar, Technische Universität München, Munich, Germany; Schormair B., Neurologische Klinik und Poliklinik, Klinikum rechts der Isar, Technische Universität München, Munich, Germany, Institut für Humangenetik, Helmholtz Zentrum München, Munich, Germany, Institut für Humangenetik, Technische Universität München, Munich, Germany; Jochim A., Neurologische Klinik und Poliklinik, Klinikum rechts der Isar, Technische Universität München, Munich, Germany; Wieland T., Institut für Humangenetik, Helmholtz Zentrum München, Munich, Germany; Gross N., Neurologische Klinik und Poliklinik, Klinikum rechts der Isar, Technische Universität München, Munich, Germany; Lichtner P., Institut für Humangenetik, Helmholtz Zentrum München, Munich, Germany, Institut für Humangenetik, Technische Universität München, Munich, Germany; Peters A., Institute of Epidemiology II, Helmholtz Zentrum München, Munich, Germany; Gieger C., Institute of Genetic Epidemiology, Helmholtz Zentrum München, Munich, Germany; Meitinger T., Institut für Humangenetik, Helmholtz Zentrum München, Munich, Germany, Institut für Humangenetik, Technische Universität München, Munich, Germany, Munich Cluster for Systems Neurology, SyNergy, Munich, Germany; Strom T.M., Institut für Humangenetik, Helmholtz Zentrum München, Munich, Germany, Institut für Humangenetik, Technische Universität München, Munich, Germany; Oexle K., Institut für Humangenetik, Helmholtz Zentrum München, Munich, Germany, Institut für Humangenetik, Technische Universität München, Munich, Germany; Haslinger B., Neurologische Klinik und Poliklinik, Klinikum rechts der Isar, Technische Universität München, Munich, Germany; Winkelmann J., Neurologische Klinik und Poliklinik, Klinikum rechts der Isar, Technische Universität München, Munich, Germany, Institut für Humangenetik, Helmholtz Zentrum München, Munich, Germany, Institut für Humangenetik, Technische Universität München, Munich, Germany, Munich Cluster for Systems Neurology, SyNergy, Munich, Germany, Department of Neurology and Neurological Sciences and Center for Sleep Sciences and Medicine, Stanford University School of Medicine, Palo Alto, CA, United States","Recessive DYT16 dystonia associated with mutations in PRKRA has until now been reported only in seven Brazilian patients. The aim of this study was to elucidate the genetic cause underlying disease in a Polish family with autosomal-recessive, early-onset generalized dystonia and slight parkinsonism, and to explore further the role of PRKRA in a dystonia series of European ancestry. We employed whole-exome sequencing in two affected siblings of the Polish family and filtered for rare homozygous and compound heterozygous variants shared by both exomes. Validation of the identified variants as well as homozygosity screening and copy number variation analysis was carried out in the two affected individuals and their healthy siblings. PRKRA was analyzed in 339 German patients with various forms of dystonia and 376 population-based controls by direct sequencing or high-resolution melting. The previously described homozygous p.Pro222Leu mutation in PRKRA was found to segregate with the disease in the studied family, contained in a 1.2 Mb homozygous region identical by state with all Brazilian patients in chromosome 2q31.2. The clinical presentation with young-onset, progressive generalized dystonia and mild parkinsonism resembled the phenotype of the original DYT16 cases. PRKRA mutational screening in additional dystonia samples revealed three novel heterozygous changes (p.Thr34Ser, p.Asn102Ser, c.-14A>G), each in a single subject with focal/segmental dystonia. Our study provides the first independent replication of the DYT16 locus at 2q31.2 and strongly confirms the causal contribution of the PRKRA gene to DYT16. Our data suggest worldwide involvement of PRKRA in dystonia. © 2014 International Parkinson and Movement Disorder Society.",Dystonia; DYT16; Gene; PRKRA,"Adolescent; Adult; Child; Chromosomes, Human, Pair 2; DNA Copy Number Variations; Dystonic Disorders; Europe; Exome; Family Health; Female; Humans; Male; Middle Aged; Phenotype; RNA-Binding Proteins; Severity of Illness Index; Young Adult; amantadine; clonazepam; leucine rich repeat kinase 2; levodopa; propranolol; protein; protein prkra; serine; threonine; unclassified drug; PRKRA protein, human; RNA binding protein; adult; akinesia; Article; autosomal recessive disorder; brain atrophy; Brazilian; chromosome 2q; clinical feature; cognitive defect; controlled study; copy number variation; deterioration; disease severity; DNA flanking region; dystonia; European; exome; female; gene linkage disequilibrium; gene mutation; gene sequence; generalized dystonia; genetic screening; genetic variability; haplotype; hemiparesis; high resolution melting analysis; homozygosity; homozygote; human; indel mutation; involuntary movement; major clinical study; male; Meige syndrome; middle aged; missense mutation; muscle spasm; nuclear magnetic resonance imaging; pallidotomy; parkinsonism; phenotype; priority journal; segmental dystonia; sibling; single nucleotide polymorphism; slurred speech; adolescent; child; chromosome 2; dystonic disorder; Europe; exome; family health; genetics; severity of illness index; young adult","J. Winkelmann; Department of Neurology and Neurological Sciences and Center for Sleep Sciences and Medicine, Stanford University School of Medicine, Palo Alto, 3165 Porter Drive, 94301; email: winkelm@stanford.edu",,John Wiley and Sons Inc,08853185,,MOVDE,25142429,English,Mov. Disord.,Article,Final,,Scopus,2-s2.0-84927564405
Savica R.; Turcano P.; Bower J.H.; Ahlskog J.E.; Mielke M.M.,"Savica, Rodolfo (55941082300); Turcano, Pierpaolo (57195479779); Bower, James H. (7202437394); Ahlskog, J. Eric (7007036448); Mielke, Michelle M. (7004869517)",55941082300; 57195479779; 7202437394; 7007036448; 7004869517,Survival and Progression in Synucleinopathy Phenotypes With Parkinsonism: A Population-Based Study,2019,Mayo Clinic Proceedings,94,9,,1825,1831,6,10.1016/j.mayocp.2019.04.010,https://www.scopus.com/inward/record.uri?eid=2-s2.0-85070307787&doi=10.1016%2Fj.mayocp.2019.04.010&partnerID=40&md5=ae042b3890c4dd07b7d1e8739af93781,"Department of Neurology, Mayo Clinic, Rochester, MN, United States; Division of Epidemiology, Department of Health Sciences Research, Mayo Clinic, Rochester, MN, United States","Savica R., Department of Neurology, Mayo Clinic, Rochester, MN, United States, Division of Epidemiology, Department of Health Sciences Research, Mayo Clinic, Rochester, MN, United States; Turcano P., Department of Neurology, Mayo Clinic, Rochester, MN, United States; Bower J.H., Department of Neurology, Mayo Clinic, Rochester, MN, United States; Ahlskog J.E., Department of Neurology, Mayo Clinic, Rochester, MN, United States; Mielke M.M., Department of Neurology, Mayo Clinic, Rochester, MN, United States, Division of Epidemiology, Department of Health Sciences Research, Mayo Clinic, Rochester, MN, United States","Objective: To compare survival by the presenting parkinsonism symptoms at diagnosis among patients with incident clinically diagnosed synucleinopathies. Patients and Methods: Using the Rochester Epidemiology Project medical records–linkage system, we identified all persons residing in Olmsted County, Minnesota, who received a diagnostic code of parkinsonism from January 1, 1991, through December 31, 2010. A movement disorder specialist reviewed the complete medical records of each individual to confirm the presence of parkinsonism, determine the type of synucleinopathy, and identify the onset dates of each cardinal symptom (tremor at rest, bradykinesia, rigidity, and impaired postural reflexes). We determined the median time from age at diagnosis to death or censoring (June 30, 2015) for each presenting symptom and the age- and sex-adjusted risk of death. Results: From 1991 through 2010, a total of 433 individuals had a synucleinopathy diagnosed (301 [69.5%], Parkinson disease; 68 [15.7%], dementia with Lewy bodies; 52 [12.0%], Parkinson disease dementia; and 12 [2.8%], multiple systems atrophy with parkinsonism). Overall, the risk of death in the tremor-predominant group was less than that in the bradykinesia/rigidity-only group (hazard ratio [HR], 0.59; 95% CI, 0.40-0.87; P=.007). Similarly, risk of death in the bradykinesia/rigidity-only group was significantly greater than in the tremor-predominant group (HR, 1.75; 95% CI, 1.23-2.51; P=.002) and compared with tremor before bradykinesia (HR, 1.75; 95% CI, 1.24-2.47; P=.001). Conclusion: Patients with tremor as a presenting symptom have longer survival. In contrast, the presence of bradykinesia/rigidity as a presenting symptom correlates with reduced survival across all types of synucleinopathies. © 2019",,"Age Factors; Aged; Databases, Factual; Disease Progression; Female; Humans; Incidence; Kaplan-Meier Estimate; Male; Middle Aged; Minnesota; Parkinson Disease; Phenotype; Population Surveillance; Prognosis; Proportional Hazards Models; Retrospective Studies; Risk Assessment; Severity of Illness Index; Sex Factors; Survival Analysis; Synucleinopathies; Tremor; aged; Article; bradykinesia; death; diffuse Lewy body disease; disease exacerbation; female; human; major clinical study; male; medical record; Minnesota; mortality risk; parkinsonism; population research; reflex disorder; rigidity; survival; synucleinopathy; tremor; age; disease exacerbation; factual database; health survey; incidence; Kaplan Meier method; middle aged; Parkinson disease; pathophysiology; phenotype; prognosis; proportional hazards model; retrospective study; risk assessment; severity of illness index; sex factor; survival analysis; synucleinopathy; tremor","R. Savica; Departments of Neurology and Health Sciences Research, Mayo Clinic, Rochester, 200 First St SW, 55905, United States; email: savica.rodolfo@mayo.edu",,Elsevier Ltd,00256196,,MACPA,31405749,English,Mayo Clin. Proc.,Article,Final,All Open Access; Green Open Access,Scopus,2-s2.0-85070307787
Hall H.; Cuellar-Baena S.; Denisov V.; Kirik D.,"Hall, Hélène (35169488400); Cuellar-Baena, Sandra (37052018200); Denisov, Vladimir (7202950840); Kirik, Deniz (7003535125)",35169488400; 37052018200; 7202950840; 7003535125,Development of NMR spectroscopic methods for dynamic detection of acetylcholine synthesis by choline acetyltransferase in hippocampal tissue,2013,Journal of Neurochemistry,124,3,,336,346,8,10.1111/jnc.12025,https://www.scopus.com/inward/record.uri?eid=2-s2.0-84872084475&doi=10.1111%2Fjnc.12025&partnerID=40&md5=971b9b91f1422f6ca7a5b52332890447,"Brain Repair and Imaging in Neural Systems (B.R.A.I.N.S), Department of Experimental Medical Science, Lund University, Lund 22184, Sweden; Lund University BioImaging Center, BMC D11, Lund University, Lund, Sweden","Hall H., Brain Repair and Imaging in Neural Systems (B.R.A.I.N.S), Department of Experimental Medical Science, Lund University, Lund 22184, Sweden; Cuellar-Baena S., Brain Repair and Imaging in Neural Systems (B.R.A.I.N.S), Department of Experimental Medical Science, Lund University, Lund 22184, Sweden; Denisov V., Lund University BioImaging Center, BMC D11, Lund University, Lund, Sweden; Kirik D., Brain Repair and Imaging in Neural Systems (B.R.A.I.N.S), Department of Experimental Medical Science, Lund University, Lund 22184, Sweden","Choline acetyltransferase (ChAT) is the key enzyme for acetylcholine (ACh) synthesis and constitutes a reliable marker for the integrity of cholinergic neurons. Cortical ChAT activity is decreased in the brain of patients suffering from Alzheimer's and Parkinson's diseases. The standard method used to measure the activity of ChAT enzyme relies on a very sensitive radiometric assay, but can only be performed on post-mortem tissue samples. Here, we demonstrate the possibility to monitor ACh synthesis in rat brain homogenates in real time using NMR spectroscopy. First, the experimental conditions of the radiometric assay were carefully adjusted to produce maximum ACh levels. This was important for translating the assay to NMR, which has a low intrinsic sensitivity. We then used 15N-choline and a pulse sequence designed to filter proton polarization by nitrogen coupling before 1H-NMR detection. ACh signal was resolved from choline signal and therefore it was possible to monitor ChAT-mediated ACh synthesis selectively over time. We propose that the present approach using a labeled precursor to monitor the enzymatic synthesis of ACh in rat brain homogenates through real-time NMR represents a useful tool to detect neurotransmitter synthesis. This method may be adapted to assess the state of the cholinergic system in the brain in vivo in a non-invasive manner using NMR spectroscopic techniques. © 2012 International Society for Neurochemistry.",acetylcholine; choline acetyltransferase; hippocampus; labeled choline; NMR spectroscopy,"Acetylcholine; Animals; Choline O-Acetyltransferase; Cholinergic Neurons; Female; Hippocampus; Humans; Magnetic Resonance Spectroscopy; Nitrogen Isotopes; Protons; Radioligand Assay; Rats; Rats, Sprague-Dawley; Reference Standards; Reproducibility of Results; Translational Medical Research; Rattus; acetylcholine; choline; choline acetyltransferase; animal tissue; article; brain homogenate; cholinergic system; controlled study; enzyme activity; female; hippocampus; nonhuman; nuclear magnetic resonance spectroscopy; priority journal; proton nuclear magnetic resonance; radiometry; rat; synthesis","H. Hall; Brain Repair and Imaging in Neural Systems (B.R.A.I.N.S), Department of Experimental Medical Science, Lund University, Lund 22184, Sweden; email: helene.hall@med.lu.se",,,14714159,,JONRA,23004566,English,J. Neurochem.,Article,Final,,Scopus,2-s2.0-84872084475
