"﻿""Authors""",Author full names,Author(s) ID,Title,Year,Source title,Volume,Issue,Art. No.,Page start,Page end,Cited by,DOI,Link,Affiliations,Authors with affiliations,Abstract,Author Keywords,Index Keywords,Correspondence Address,Editors,Publisher,ISSN,ISBN,CODEN,PubMed ID,Language of Original Document,Abbreviated Source Title,Document Type,Publication Stage,Open Access,Source,EID
Balaji C.; Suresh D.S.,"Balaji, Chetan (57292820500); Suresh, D.S. (56736003100)",57292820500; 56736003100,Multi-class Recognition of Alzheimer’s and Parkinson’s diseases using Bag of Deep reduced Features (BoDrF) with Improved Chaotic Multi Verse Harris Hawks Optimization (CMVHHO) and Random Forest (RF) based classification for early diagnosis,2023,Computer Methods in Biomechanics and Biomedical Engineering: Imaging and Visualization,11,3,,774,785,3,10.1080/21681163.2022.2111721,https://www.scopus.com/inward/record.uri?eid=2-s2.0-85136584119&doi=10.1080%2F21681163.2022.2111721&partnerID=40&md5=d5e125b933d30cc58755f072b6b82174,"Department of Electronics and Communication Engineering, Channabasaveshwara Institute of Technology, Tumkur, India; Department of Electronics and Communication Engineering, Visvesvaraya Technological University, Karnataka, Belagavi, India","Balaji C., Department of Electronics and Communication Engineering, Channabasaveshwara Institute of Technology, Tumkur, India, Department of Electronics and Communication Engineering, Visvesvaraya Technological University, Karnataka, Belagavi, India; Suresh D.S., Department of Electronics and Communication Engineering, Channabasaveshwara Institute of Technology, Tumkur, India, Department of Electronics and Communication Engineering, Visvesvaraya Technological University, Karnataka, Belagavi, India","This manuscript proposes a multi-class recognition system with improved classification accuracy using machine-learning techniques by considering electroencephalogram (EEG) and speech signal analysis to classify and detect patients affected by Alzheimer’s disease (AD) and Parkinson’s disease (PD) in its initial stages. Acquired raw EEG and speech signal are pre-processed utilising wavelet filters to eliminate noises, then the features impedivity, phase angle, higher frequency slope of phase angle, standard deviation, minimal pitch, maximal pitch, count of voice breaks are extracted from EEG and speech signal using bag of deep reduced features. Optimal features mean absolute values, enhanced wavelength, wavelength, zeros crossing are selected using an improved chaotic multi-verse Harris Hawks optimisation (CMVHHO) algorithm. Finally, Random Forest (RF) classifier is employed to classify patients suffered by AD with PD. Experimental results show 95.17%, 96.31% and 97.48% higher accuracy for AD compared with existing methods, like MCR-AD-PD-SPWVD-CNN, MCR-AD-PD-ICA-DSCHN and MCR-AD-DWT-KNN-RLDA, respectively. © 2022 Informa UK Limited, trading as Taylor & Francis Group.",Alzheimer’s disease; Bag of Deep reduced Features; Chaotic Multi-Verse Harris Hawks Optimisation; Electroencephalography; Parkinson’s disease; Random forest classifier; wavelet filters,Biomedical signal processing; Classification (of information); Computer aided diagnosis; Continuous speech recognition; Decision trees; Electrophysiology; Learning systems; Speech communication; Alzheimer; Alzheimer’s disease; Bag of deep reduced feature; Chaotic multi-verse harris hawk optimization; Chaotics; Electroencephalogram signals; Optimisations; Parkinson’s disease; Random forest classifier; Wavelet filters; Alzheimer disease; Article; artificial intelligence; artificial neural network; Bag of Deep  reduced Features; Chaotic Multi Verse Harris Hawks  Optimization; controlled study; data mining; diagnostic accuracy; diagnostic test accuracy study; discriminant analysis; electroencephalogram; electroencephalography; genetic algorithm; human; image segmentation; learning algorithm; limit of detection; limit of quantitation; machine learning; nuclear magnetic resonance imaging; operation duration; positron emission tomography; quantitative structure activity relation; random forest; receiver operating characteristic; sensitivity analysis; sensitivity and specificity; support vector machine; Electroencephalography,"C. Balaji; Department of Electronics and Communication Engineering, Channabasaveshwara Institute of Technology, Tumkur, Karnataka, 572216, India; email: chetan.balaji@gmail.com",,Taylor and Francis Ltd.,21681163,,,,English,Comput. Methods Biomech. Biomed. Eng. Imaging and Visualization,Article,Final,,Scopus,2-s2.0-85136584119
Florio E.; Serra M.; Lewis R.G.; Kramár E.; Freidberg M.; Wood M.; Morelli M.; Borrelli E.,"Florio, Ermanno (55746200900); Serra, Marcello (57215730295); Lewis, Robert G. (57191538362); Kramár, Enikö (6601967963); Freidberg, Michael (57191749038); Wood, Marcello (8914184500); Morelli, Micaela (7103166484); Borrelli, Emiliana (7006750016)",55746200900; 57215730295; 57191538362; 6601967963; 57191749038; 8914184500; 7103166484; 7006750016,D2R signaling in striatal spiny neurons modulates L-DOPA induced dyskinesia,2022,iScience,25,10,105263,,,6,10.1016/j.isci.2022.105263,https://www.scopus.com/inward/record.uri?eid=2-s2.0-85139831672&doi=10.1016%2Fj.isci.2022.105263&partnerID=40&md5=d54e7dc2df190c7fe3b84bcb67557e97,"Department of Microbiology & Molecular Genetics, INSERM U1233, Center for Epigenetics and Metabolism, 308 Sprague Hall, University of California, Irvine, Irvine, 92697, CA, United States; Department of Biomedical Sciences, Section of Neuroscience, University of Cagliari, Cittadella Universitaria di Monserrato, Monserrato (CA), 09042, Italy; Department of Neurobiology and Behavior, University of California, Irvine, 200 Qureshey Research Lab., Irvine, 92697, CA, United States; Department of Chemistry, University of California, Irvine, 1102 Natural Sciences II, Irvine, 92697, CA, United States","Florio E., Department of Microbiology & Molecular Genetics, INSERM U1233, Center for Epigenetics and Metabolism, 308 Sprague Hall, University of California, Irvine, Irvine, 92697, CA, United States; Serra M., Department of Biomedical Sciences, Section of Neuroscience, University of Cagliari, Cittadella Universitaria di Monserrato, Monserrato (CA), 09042, Italy; Lewis R.G., Department of Microbiology & Molecular Genetics, INSERM U1233, Center for Epigenetics and Metabolism, 308 Sprague Hall, University of California, Irvine, Irvine, 92697, CA, United States; Kramár E., Department of Neurobiology and Behavior, University of California, Irvine, 200 Qureshey Research Lab., Irvine, 92697, CA, United States; Freidberg M., Department of Chemistry, University of California, Irvine, 1102 Natural Sciences II, Irvine, 92697, CA, United States; Wood M., Department of Neurobiology and Behavior, University of California, Irvine, 200 Qureshey Research Lab., Irvine, 92697, CA, United States; Morelli M., Department of Biomedical Sciences, Section of Neuroscience, University of Cagliari, Cittadella Universitaria di Monserrato, Monserrato (CA), 09042, Italy; Borrelli E., Department of Microbiology & Molecular Genetics, INSERM U1233, Center for Epigenetics and Metabolism, 308 Sprague Hall, University of California, Irvine, Irvine, 92697, CA, United States","Degeneration of dopaminergic neurons leads to Parkinson's disease (PD), characterized by reduced levels of striatal dopamine (DA) and impaired voluntary movements. DA replacement is achieved by levodopa treatment which in long-term causes involuntary movements or dyskinesia. Dyskinesia is linked to the pulsatile activation of D1 receptors of the striatal medium spiny neurons (MSNs) forming the direct output pathway (dMSNs). The contribution of DA stimulation of D2R in MSNs of the indirect pathway (iMSNs) is less clear. Using the 6-hydroxydopamine model of PD, here we show that loss of DA-mediated inhibition of these neurons intensifies levodopa-induced dyskinesia (LID) leading to reprogramming of striatal gene expression. We propose that the motor impairments characteristic of PD and of its therapy are critically dependent on D2R-mediated iMSNs activity. D2R signaling not only filters inputs to the striatum but also indirectly regulates dMSNs mediated responses. © 2022 The Author(s)",Behavioral neuroscience; Biological sciences; Neuroscience; Transcriptomics,,"E. Borrelli; Department of Microbiology & Molecular Genetics, INSERM U1233, Center for Epigenetics and Metabolism, 308 Sprague Hall, University of California, Irvine, Irvine, 92697, United States; email: borrelli@uci.edu",,Elsevier Inc.,25890042,,,,English,iScience,Article,Final,All Open Access; Gold Open Access; Green Open Access,Scopus,2-s2.0-85139831672
Fahmi R.; Platsch G.; Sadr A.B.; Gouttard S.; Thobois S.; Zuehlsdorff S.; Scheiber C.,"Fahmi, Rachid (13908120300); Platsch, Günther (6603409491); Sadr, Alexandre Bani (57202111372); Gouttard, Sylvain (8436715100); Thobois, Stephane (56265051600); Zuehlsdorff, Sven (35291172700); Scheiber, Christian (56030560000)",13908120300; 6603409491; 57202111372; 8436715100; 56265051600; 35291172700; 56030560000,Single-site 123I-FP-CIT reference values from individuals with non-degenerative parkinsonism—comparison with values from healthy volunteers,2020,European Journal of Hybrid Imaging,4,1,5,,,8,10.1186/s41824-020-0074-2,https://www.scopus.com/inward/record.uri?eid=2-s2.0-85100694327&doi=10.1186%2Fs41824-020-0074-2&partnerID=40&md5=266a4ef05add4a27ea426aac98b13986,"Siemens Medical Solutions USA, Inc., Molecular Imaging, Knoxville, TN, United States; Siemens Healthineers, Erlangen, Germany; Nuclear Medicine, Hospices Civils de Lyon, Bron, 69500, France; Movement Disorder Clinic, Pierre Wertheimer Neurologic Hospital, Hospices Civils de Lyon, Bron, 69500, France; Faculté de Médecine Lyon Sud, Université Claude Bernard Lyon 1, Lyon, France; Institut des Sciences Cognitives Marc Jeannerod, UMR 5229, CNRS, Bron, France","Fahmi R., Siemens Medical Solutions USA, Inc., Molecular Imaging, Knoxville, TN, United States; Platsch G., Siemens Healthineers, Erlangen, Germany; Sadr A.B., Nuclear Medicine, Hospices Civils de Lyon, Bron, 69500, France; Gouttard S., Nuclear Medicine, Hospices Civils de Lyon, Bron, 69500, France; Thobois S., Movement Disorder Clinic, Pierre Wertheimer Neurologic Hospital, Hospices Civils de Lyon, Bron, 69500, France, Faculté de Médecine Lyon Sud, Université Claude Bernard Lyon 1, Lyon, France, Institut des Sciences Cognitives Marc Jeannerod, UMR 5229, CNRS, Bron, France; Zuehlsdorff S., Siemens Medical Solutions USA, Inc., Molecular Imaging, Knoxville, TN, United States; Scheiber C., Nuclear Medicine, Hospices Civils de Lyon, Bron, 69500, France","Purpose: Iodine 123-radiolabeled 2β-carbomethoxy-3β-(4-iodophenyl)-N-(3-fluoropropyl) nortropane (123I-FP-CIT) SPECT can be performed to distinguish degenerative forms of movement disorders/parkinsonism/tremor from other entities such as idiopathic tremor or drug-induced parkinsonism. For equivocal cases, semi-quantification and comparison to reference values are a necessary addition to visual interpretation of 123I-FP-CIT scans. To overcome the challenges of multi-center recruitment and scanning of healthy volunteers, we generated 123I-FP-CIT reference values from individuals with various neurological conditions but without dopaminergic degeneration, scanned at a single center on the same SPECT-CT system following the same protocol, and compared them to references from a multi-center database built using healthy volunteers’ data. Methods: From a cohort of 1884 patients, we identified 237 subjects (120 men, 117 women, age range 16–88 years) through a two-stage selection process. Every patient had a final clinical diagnosis after a mean follow-up of 4.8 ± 1.3 years. Images were reconstructed using (1) Flash3D with scatter and CT-based attenuation corrections (AC) and (2) filtered back projection with Chang AC. Volume-of-interest analysis was performed using a commercial software to calculate specific binding ratios (SBRs), caudate-to-putamen ratios, and asymmetry values on different striatal regions. Generated reference values were assessed according to age and gender and compared with those from the ENC-DAT study, and their robustness was tested against a cohort of patients with different diagnoses. Results: Age had a significant negative linear effect on all SBRs. Overall, the reduction rate per decade in SBR was between 3.80 and 5.70%. Women had greater SBRs than men, but this gender difference was only statistically significant for the Flash3D database. Linear regression was used to correct for age-dependency of SBRs and to allow comparisons to age-matched reference values and “normality” limits. Generated regression parameters and their 95% confidence intervals (CIs) were comparable to corresponding European Normal Control Database of DaTscan (ENC-DAT) results. For example, 95% CI mean slope for the striatum in women is − 0.015 ([− 0.019, − 0.011]) for the Flash3D database versus − 0.015 ([− 0.021, − 0.009]) for ENC-DAT. Caudate-to-putamen ratios and asymmetries were not influenced by age or gender. Conclusion: The generated 123I-FP-CIT references values have similar age-related distribution, with no increase in variance due to comorbidities when compared to values from a multi-center study with healthy volunteers. This makes it possible for sites to build their 123I-FP-CIT references from scans acquired during routine clinical practice. © 2020, The Author(s).","         <sup>123</sup>I-FP-CIT SPECT,·Age effect; Dopamine transporter; Gender difference; Reference values",,"C. Scheiber; Nuclear Medicine, Hospices Civils de Lyon, Bron, 69500, France; email: christian.scheiber@chu-lyon.fr",,Springer Science and Business Media B.V.,25103636,,,,English,Eur. J. Hybrid Imag.,Article,Final,All Open Access; Gold Open Access; Green Open Access,Scopus,2-s2.0-85100694327
Popova E.; Jacobs M.; Hofmann-Apitius M.; Babaiha N.S.,"Popova, Elizaveta (60161568900); Jacobs, Marc (57200142182); Hofmann-Apitius, Martin (57204494354); Babaiha, Negin Sadat (57351743100)",60161568900; 57200142182; 57204494354; 57351743100,Leveraging multimodal large language models to extract mechanistic insights from biomedical visuals: A case study on COVID-19 and neurodegenerative diseases,2026,Machine Learning with Applications,23,,100816,,,0,10.1016/j.mlwa.2025.100816,https://www.scopus.com/inward/record.uri?eid=2-s2.0-105027881070&doi=10.1016%2Fj.mlwa.2025.100816&partnerID=40&md5=d32f70e544f4fd5efb329cd499acdf75,"Bonn-Aachen International Center for Information Technology (b-it), University of Bonn, Bonn, Germany; Department of Bioinformatics, Fraunhofer Institute for Algorithms and Scientific Computing (SCAI), Schloss Birlinghoven, Sankt Augustin, Germany","Popova E., Bonn-Aachen International Center for Information Technology (b-it), University of Bonn, Bonn, Germany; Jacobs M., Department of Bioinformatics, Fraunhofer Institute for Algorithms and Scientific Computing (SCAI), Schloss Birlinghoven, Sankt Augustin, Germany; Hofmann-Apitius M., Bonn-Aachen International Center for Information Technology (b-it), University of Bonn, Bonn, Germany, Department of Bioinformatics, Fraunhofer Institute for Algorithms and Scientific Computing (SCAI), Schloss Birlinghoven, Sankt Augustin, Germany; Babaiha N.S., Department of Bioinformatics, Fraunhofer Institute for Algorithms and Scientific Computing (SCAI), Schloss Birlinghoven, Sankt Augustin, Germany","Background The COVID-19 pandemic has intensified concerns about its long-term neurological impact, with evidence linking SARS-CoV-2 infection to neurodegenerative diseases (NDDs) such as Alzheimer’s (AD) and Parkinson’s (PD). Patients with these conditions face higher risk of severe COVID-19 outcomes and may experience accelerated cognitive or motor decline following infection. Proposed mechanisms—including neuroinflammation, blood–brain barrier (BBB) disruption, and abnormal protein aggregation—closely mirror core features of neurodegenerative pathology. However, current knowledge remains fragmented across text, figures, and pathway diagrams, limiting integration into computational models that could reveal systemic patterns. Results To address this gap, we applied GPT-4 Omni (GPT-4o), a multimodal large language model (LLM), to extract mechanistic insights from biomedical figures. Over 10,000 images were retrieved through targeted searches on COVID-19 and neurodegeneration; after automated and manual filtering, a curated subset was analyzed. GPT-4o extracted biological relationships as semantic triples, grouped into six mechanistic categories—including microglial activation and barrier disruption—using ontology-guided similarity and assembled into a Neo4j knowledge graph (KG). Accuracy was evaluated against a gold-standard dataset of expert-annotated images using Biomedical Bidirectional Encoder Representations from Transformers (BioBERT)–based semantic matching. This evaluation enabled prompt tuning, threshold optimization, and hyperparameter assessment. Results show that GPT-4o successfully recovers both established and novel mechanisms, yielding interpretable outputs that illuminate complex biological links between SARS-CoV-2 and neurodegeneration. Conclusions This study demonstrates the potential of multimodal LLMs to mine biomedical visual data at scale. By complementing text mining and integrating figure-derived knowledge, our framework advances understanding of COVID-19–related neurodegeneration and supports future translational research. © 2025 The Authors.",Biomedical Information Extraction; Biomedical Knowledge Graph; COVID-19; Multimodal Large Language Models; Neurodegenerative Diseases,Brain; COVID-19; Data mining; Information retrieval; Knowledge graph; Learning systems; Medical imaging; Ontology; Semantics; Biomedical information extractions; Biomedical knowledge graph; Case-studies; Knowledge graphs; Language model; Mechanistics; Multi-modal; Multimodal large language model; Neurodegeneration; Neurodegenerative; Neurodegenerative diseases,"N.S. Babaiha; Department of Bioinformatics, Fraunhofer Institute for Algorithms and Scientific Computing (SCAI), Schloss Birlinghoven, Sankt Augustin, Germany; email: negin.babaiha@scai.fraunhofer.de",,Elsevier Ltd,26668270,,,,English,Mach. Learn. Appl.,Article,Final,All Open Access; Gold Open Access,Scopus,2-s2.0-105027881070
Peiris S.; Ekanayake A.; Lu J.; Elyan R.; Geesey K.; Cottrill R.; Eslinger P.; Huang X.; Karunanayaka P.,"Peiris, Senal (59008564900); Ekanayake, Anupa (58605752700); Lu, Jiaming (57193443717); Elyan, Rommy (57211965207); Geesey, Katie (60076049700); Cottrill, Ross (59194044700); Eslinger, Paul (7004204851); Huang, Xuemei (55770777800); Karunanayaka, Prasanna (15065381800)",59008564900; 58605752700; 57193443717; 57211965207; 60076049700; 59194044700; 7004204851; 55770777800; 15065381800,Olfactory Network Functional Connectivity as a Marker for Parkinson’s Disease Severity,2025,Life,15,8,1324,,,0,10.3390/life15081324,https://www.scopus.com/inward/record.uri?eid=2-s2.0-105014464551&doi=10.3390%2Flife15081324&partnerID=40&md5=e1646d9d68c8902135fda9e754bb06a2,"Department of Radiology, The Pennsylvania State University College of Medicine, Hershey, 17033, PA, United States; Medical School of Nanjing University, Nanjing University, Nanjing, 210993, China; Department of Neurology, The Pennsylvania State University College of Medicine, Hershey, 17033, PA, United States; Department of Neurology, School of Medicine, The University of Virginia, Charlottesville, 22903, VA, United States","Peiris S., Department of Radiology, The Pennsylvania State University College of Medicine, Hershey, 17033, PA, United States; Ekanayake A., Department of Radiology, The Pennsylvania State University College of Medicine, Hershey, 17033, PA, United States; Lu J., Department of Radiology, The Pennsylvania State University College of Medicine, Hershey, 17033, PA, United States, Medical School of Nanjing University, Nanjing University, Nanjing, 210993, China; Elyan R., Department of Radiology, The Pennsylvania State University College of Medicine, Hershey, 17033, PA, United States; Geesey K., Department of Radiology, The Pennsylvania State University College of Medicine, Hershey, 17033, PA, United States; Cottrill R., Department of Radiology, The Pennsylvania State University College of Medicine, Hershey, 17033, PA, United States; Eslinger P., Department of Radiology, The Pennsylvania State University College of Medicine, Hershey, 17033, PA, United States, Department of Neurology, The Pennsylvania State University College of Medicine, Hershey, 17033, PA, United States; Huang X., Department of Neurology, School of Medicine, The University of Virginia, Charlottesville, 22903, VA, United States; Karunanayaka P., Department of Radiology, The Pennsylvania State University College of Medicine, Hershey, 17033, PA, United States","Olfactory impairment was assessed in akinetic-rigid (PDAR) and tremor-predominant (PDT) subtypes of Parkinson’s disease (PD), classified based on motor symptoms. Seventeen PDAR, fifteen PDT, and twenty-four cognitively normal (CN) participants completed the University of Pennsylvania Smell Identification Test (UPSIT). Groups were well-matched for age and demographic variables, with cognitive performance statistically controlled. Resting-state fMRI (rs-fMRI) and seed-based functional connectivity (FC) analyses were conducted to characterize olfactory network (ON) connectivity across groups. UPSIT scores were significantly lower in PDAR compared to PDT. Consistently, ON FC values were reduced in PDAR relative to both PDT and CN. FC of the primary olfactory cortex (POC) significantly differed between CN and the PD subtypes. Furthermore, connectivity in the orbitofrontal cortex and insula showed significant differences between PDAR and PDT, as well as between PDAR and CN. Notably, ON FC between the left hippocampus and the posterior cingulate cortex (PCC) also differed significantly between PDAR and PDT. These findings reveal distinct ON FC patterns across PDAR and PDT subtypes. Variations in UPSIT scores suggest that motor symptom subtype is associated with olfactory performance. Moreover, ON connectivity closely paralleled the UPSIT scores, reinforcing a neural basis for olfactory deficits in PD. Given the accelerated motor and cognitive decline often observed in the PDAR, these results support the potential of olfactory impairment as a clinical marker for disease severity. © 2025 by the authors.",functional connectivity; olfactory network; Parkinson’s disease; resting-state fMRI; UPSIT,,"P. Karunanayaka; Department of Radiology, The Pennsylvania State University College of Medicine, Hershey, 17033, United States; email: pkarunanayaka@pennstatehealth.psu.edu",,Multidisciplinary Digital Publishing Institute (MDPI),20751729,,,,English,Life,Article,Final,All Open Access; Gold Open Access; Green Open Access,Scopus,2-s2.0-105014464551
