"﻿""Authors""",Author full names,Author(s) ID,Title,Year,Source title,Volume,Issue,Art. No.,Page start,Page end,Cited by,DOI,Link,Affiliations,Authors with affiliations,Abstract,Author Keywords,Index Keywords,Correspondence Address,Editors,Publisher,ISSN,ISBN,CODEN,PubMed ID,Language of Original Document,Abbreviated Source Title,Document Type,Publication Stage,Open Access,Source,EID
Zimnik A.J.; Nora G.J.; Desmurget M.; Turner R.S.,"Zimnik, Andrew J. (55627034800); Nora, Gerald J. (36342769700); Desmurget, Michel (6701457007); Turner, Robert S. (7404556739)",55627034800; 36342769700; 6701457007; 7404556739,Movement-related discharge in the macaque globus pallidus during high-frequency stimulation of the subthalamic nucleus,2015,Journal of Neuroscience,35,9,,3978,3989,23,10.1523/JNEUROSCI.4899-14.2015,https://www.scopus.com/inward/record.uri?eid=2-s2.0-84924787967&doi=10.1523%2FJNEUROSCI.4899-14.2015&partnerID=40&md5=2a919d47b0301f49a456da6eba0cc220,"Department of Neurobiology, Center for the Neural Basis of Cognition, University of Pittsburgh, Pittsburgh, 15261, PA, United States; Centre for Cognitive Neuroscience, UMR5229, CNRS, 67 Boulevard Pinel, Bron, 69500, France","Zimnik A.J., Department of Neurobiology, Center for the Neural Basis of Cognition, University of Pittsburgh, Pittsburgh, 15261, PA, United States; Nora G.J., Department of Neurobiology, Center for the Neural Basis of Cognition, University of Pittsburgh, Pittsburgh, 15261, PA, United States; Desmurget M., Centre for Cognitive Neuroscience, UMR5229, CNRS, 67 Boulevard Pinel, Bron, 69500, France; Turner R.S., Department of Neurobiology, Center for the Neural Basis of Cognition, University of Pittsburgh, Pittsburgh, 15261, PA, United States","Deep brain stimulation (DBS) of the subthalamic nucleus (STN-DBS) has largely replaced ablative therapies for Parkinson’s disease. Because of the similar efficacies of the two treatments, it has been proposed that DBS acts by creating an “informational lesion,” whereby pathologic neuronal firing patterns are replaced by low-entropy, stimulus-entrained firing patterns. The informationallesionhypothesis, in its current form, states that DBS blocks the transmission of all information from the basal ganglia, including both pathologic firing patterns and normal, task-related modulations in activity. We tested this prediction in two healthy rhesus macaques by recording single-unit spiking activity from the globus pallidus (232 neurons) while the animals completed choice reaction time reaching movements with and without STN-DBS. Despite strong effects of DBS on the activity of most pallidal cells, reach-related modulations in firing rate were equally prevalent in the DBS-on and DBS-off states. This remained true even when the analysis was restricted to cells affected significantly by DBS. In addition, the overall form and timing of perimovement modulations in firing rate were preserved between DBS-on and DBS-off states in the majority of neurons (66%). Active movement and DBS had largely additive effects on the firing rate of most neurons, indicating an orthogonal relationship in which both inputs contribute independently to the overall firing rate of pallidal neurons. These findings suggest that STN-DBS does not act as an indiscriminate informational lesion but rather as a filter that permits task-related modulations in activity while, presumably, eliminating the pathological firing associated with parkinsonism. © 2015 the authors.",Basal ganglia; Nonhuman primate; Reaching,"Animals; Behavior, Animal; Deep Brain Stimulation; Entropy; Globus Pallidus; Macaca mulatta; Male; Movement; Subthalamic Nucleus; Synaptic Transmission; animal cell; animal experiment; animal model; Article; artifact reduction; brain depth stimulation; craniotomy; electrode implantation; electrophysiology; electrostimulation; globus pallidus; histology; Macaca; mathematical model; nerve conduction; nonhuman; nuclear magnetic resonance imaging; priority journal; spike wave; stimulus response; subthalamic nucleus; task performance; animal; animal behavior; entropy; globus pallidus; male; movement (physiology); physiology; rhesus monkey; subthalamic nucleus; synaptic transmission",,,Society for Neuroscience,02706474,,JNRSD,25740526,English,J. Neurosci.,Article,Final,All Open Access; Bronze Open Access; Green Open Access,Scopus,2-s2.0-84924787967
Slamnoiu S.; Vlad C.; Stumbaum M.; Moise A.; Lindner K.; Engel N.; Vilanova M.; Diaz M.; Karreman C.; Leist M.; Ciossek T.; Hengerer B.; Vilaseca M.; Przybylski M.,"Slamnoiu, Stefan (36198784300); Vlad, Camelia (37027602100); Stumbaum, Mihaela (43561840200); Moise, Adrian (14831649300); Lindner, Kathrin (56468928200); Engel, Nicole (56719350000); Vilanova, Mar (56293738100); Diaz, Mireia (55956793100); Karreman, Christiaan (56017752900); Leist, Marcel (7005865830); Ciossek, Thomas (56253209400); Hengerer, Bastian (6701389643); Vilaseca, Marta (7005878133); Przybylski, Michael (35230730000)",36198784300; 37027602100; 43561840200; 14831649300; 56468928200; 56719350000; 56293738100; 55956793100; 56017752900; 7005865830; 56253209400; 6701389643; 7005878133; 35230730000,Identification and affinity-quantification of ß-amyloid and α-synuclein polypeptides using on-line SAW-biosensor-mass spectrometry,2014,Journal of the American Society for Mass Spectrometry,25,8,,1472,1481,16,10.1007/s13361-014-0904-1,https://www.scopus.com/inward/record.uri?eid=2-s2.0-84904858139&doi=10.1007%2Fs13361-014-0904-1&partnerID=40&md5=83c19222ad6d4fea96a619ee6c174a84,"Laboratory of Analytical Chemistry, Steinbeis Center for Biopolymer Structure Analysis, University of Konstanz, 78457, Konstanz, Germany; Department of Biology, University of Konstanz, 78457, Konstanz, Germany; CNS Research Division, Boehringer Ingelheim Pharma, Biberach, Germany; IRB Barcelona - Institute for Research in Biomedicine, Barcelona, Spain; SAW- Instruments, 53177 Bonn, Schwertberger Strasse 16, Germany; Department of Chemical Technology, Technical University of Vienna, 1060, Vienna, Austria","Slamnoiu S., Laboratory of Analytical Chemistry, Steinbeis Center for Biopolymer Structure Analysis, University of Konstanz, 78457, Konstanz, Germany; Vlad C., Laboratory of Analytical Chemistry, Steinbeis Center for Biopolymer Structure Analysis, University of Konstanz, 78457, Konstanz, Germany, SAW- Instruments, 53177 Bonn, Schwertberger Strasse 16, Germany; Stumbaum M., Laboratory of Analytical Chemistry, Steinbeis Center for Biopolymer Structure Analysis, University of Konstanz, 78457, Konstanz, Germany, SAW- Instruments, 53177 Bonn, Schwertberger Strasse 16, Germany; Moise A., Laboratory of Analytical Chemistry, Steinbeis Center for Biopolymer Structure Analysis, University of Konstanz, 78457, Konstanz, Germany; Lindner K., Laboratory of Analytical Chemistry, Steinbeis Center for Biopolymer Structure Analysis, University of Konstanz, 78457, Konstanz, Germany; Engel N., Laboratory of Analytical Chemistry, Steinbeis Center for Biopolymer Structure Analysis, University of Konstanz, 78457, Konstanz, Germany, Department of Chemical Technology, Technical University of Vienna, 1060, Vienna, Austria; Vilanova M., IRB Barcelona - Institute for Research in Biomedicine, Barcelona, Spain; Diaz M., IRB Barcelona - Institute for Research in Biomedicine, Barcelona, Spain; Karreman C., Department of Biology, University of Konstanz, 78457, Konstanz, Germany; Leist M., Department of Biology, University of Konstanz, 78457, Konstanz, Germany; Ciossek T., CNS Research Division, Boehringer Ingelheim Pharma, Biberach, Germany; Hengerer B., CNS Research Division, Boehringer Ingelheim Pharma, Biberach, Germany; Vilaseca M., IRB Barcelona - Institute for Research in Biomedicine, Barcelona, Spain; Przybylski M., Laboratory of Analytical Chemistry, Steinbeis Center for Biopolymer Structure Analysis, University of Konstanz, 78457, Konstanz, Germany","Bioaffinity analysis using a variety of biosensors has become an established tool for detection and quantification of biomolecular interactions. Biosensors, however, are generally limited by the lack of chemical structure information of affinity-bound ligands. On-line bioaffinity-mass spectrometry using a surface-acoustic wave biosensor (SAW-MS) is a new combination providing the simultaneous affinity detection, quantification, and mass spectrometric structural characterization of ligands. We describe here an on-line SAW-MS combination for direct identification and affinity determination, using a new interface for MS of the affinity-isolated ligand eluate. Key element of the SAW-MS combination is a microfluidic interface that integrates affinity-isolation on a gold chip, in-situ sample concentration, and desalting with a microcolumn for MS of the ligand eluate from the biosensor. Suitable MS- acquisition software has been developed that provides coupling of the SAW-MS interface to a Bruker Daltonics ion trap-MS, FTICR-MS, and Waters Synapt-QTOF- MS systems. Applications are presented for mass spectrometric identifications and affinity (KD) determinations of the neurodegenerative polypeptides, ß-amyloid (Aß), and pathophysiological and physiological synucleins (α- and ß-synucleins), two key polypeptide systems for Alzheimer's disease and Parkinson's disease, respectively. Moreover, first in vivo applications of αSyn polypeptides from brain homogenate show the feasibility of on-line affinity-MS to the direct analysis of biological material. These results demonstrate on-line SAW-bioaffinity-MS as a powerful tool for structural and quantitative analysis of biopolymer interactions. © 2014 American Society for Mass Spectrometry.",Affinity quantification; Identification; Ion trap-MS; Microfluidic affinity-MS interface; Mouse brain homogenate; On-line bioaffinity-mass spectrometry; ß-amyloid; ß-Synucleins; Surface acoustic wave (SAW) biosensor; Waters Synapt-QTOF-MS; α-Synucleins,"alpha-Synuclein; Amino Acid Sequence; Amino Acid Substitution; Amyloid beta-Peptides; Animals; Antibodies, Monoclonal; Antibody Affinity; Biosensing Techniques; Brain; Cyclotrons; Epitopes; Feasibility Studies; Fourier Analysis; Humans; Mass Spectrometry; Mice, Transgenic; Microfluidic Analytical Techniques; Molecular Weight; Mutant Proteins; Neurons; Recombinant Proteins; Sound; Acoustic surface wave devices; Acoustic waves; Acoustics; Biological materials; Desalination; Glycoproteins; Identification (control systems); Ligands; Mass spectrometers; Mass spectrometry; Microfluidics; Neurodegenerative diseases; Polypeptides; Saws; alpha synuclein; amyloid beta protein; polypeptide; water; alpha synuclein; amyloid beta protein; epitope; monoclonal antibody; mutant protein; recombinant protein; SNCA protein, human; Affinity quantification; Affinity-MS; Biomolecular interactions; Detection and quantifications; Mass spectrometric identification; Mouse brain; Structural characterization; Surface acoustic waves; arterial filter; article; biosensor; brain homogenate; chemical structure; computer program; mass spectrometry; pathophysiology; protein analysis; quantitative analysis; amino acid sequence; amino acid substitution; animal; antibody affinity; brain; chemistry; cyclotron; feasibility study; Fourier analysis; genetic procedures; genetics; human; metabolism; microfluidic analysis; molecular weight; nerve cell; radiation response; sound; transgenic mouse; Biosensors","M. Przybylski; Laboratory of Analytical Chemistry, Steinbeis Center for Biopolymer Structure Analysis, University of Konstanz, 78457, Konstanz, Germany; email: michael.przybylski@uni-konstanz.de",,Springer New York LLC,10440305,,JAMSE,24845351,English,J. Am. Soc. Mass Spectrom.,Article,Final,,Scopus,2-s2.0-84904858139
Atashzar S.F.; Shahbazi M.; Samotus O.; Tavakoli M.; Jog M.S.; Patel R.V.,"Atashzar, Seyed Farokh (12040259900); Shahbazi, Mahya (26424000600); Samotus, Olivia (57189005620); Tavakoli, Mahdi (8668966400); Jog, Mandar S. (7006435056); Patel, Rajni V. (7403736805)",12040259900; 26424000600; 57189005620; 8668966400; 7006435056; 7403736805,Characterization of Upper-Limb Pathological Tremors: Application to Design of an Augmented Haptic Rehabilitation System,2016,IEEE Journal on Selected Topics in Signal Processing,10,5,7407298,888,903,38,10.1109/JSTSP.2016.2530632,https://www.scopus.com/inward/record.uri?eid=2-s2.0-84982711452&doi=10.1109%2FJSTSP.2016.2530632&partnerID=40&md5=34be046f2c1ed1a7c34ac2c1edf29e96,"Canadian Surgical Technologies and Advanced Robotics (CSTAR), Western University, London, N6A 3K7, ON, Canada; Department of Electrical and Computer Engineering, Western University, London, N6A 3K7, ON, Canada; Department of Clinical Neurological Sciences, Department of Surgery, Western University, London, N6A 3K7, ON, Canada; Department of Clinical Neurosciences, Western University, London, N6A 3K7, ON, Canada; London Health Sciences Centre, London, N6A 5W9, ON, Canada; Department of Electrical and Computer Engineering, University of Alberta, Edmonton, T6G 1H9, AB, Canada","Atashzar S.F., Canadian Surgical Technologies and Advanced Robotics (CSTAR), Western University, London, N6A 3K7, ON, Canada, Department of Electrical and Computer Engineering, Western University, London, N6A 3K7, ON, Canada; Shahbazi M., Canadian Surgical Technologies and Advanced Robotics (CSTAR), Western University, London, N6A 3K7, ON, Canada, Department of Electrical and Computer Engineering, Western University, London, N6A 3K7, ON, Canada; Samotus O., Department of Clinical Neurosciences, Western University, London, N6A 3K7, ON, Canada, London Health Sciences Centre, London, N6A 5W9, ON, Canada; Tavakoli M., Department of Electrical and Computer Engineering, University of Alberta, Edmonton, T6G 1H9, AB, Canada; Jog M.S., Department of Clinical Neurosciences, Western University, London, N6A 3K7, ON, Canada, London Health Sciences Centre, London, N6A 5W9, ON, Canada; Patel R.V., Canadian Surgical Technologies and Advanced Robotics (CSTAR), Western University, London, N6A 3K7, ON, Canada, Department of Electrical and Computer Engineering, Western University, London, N6A 3K7, ON, Canada, Department of Clinical Neurological Sciences, Department of Surgery, Western University, London, N6A 3K7, ON, Canada","In this paper, an adaptive filtering technique is proposed to estimate and characterize pathological tremors caused by Parkinson's Disease (PD) and Essential Tremor (ET). The technique is based on the formulation of band-limited multiple Fourier Linear Combiners (BMFLC) and is called Enhanced-BMFLC (E-BMFLC). The effectiveness of the designed filter is statistically evaluated through a clinical study involving 14 PD and 13 ET patients. The hand tremors of the participants are studied in three Degrees Of Freedom (DOF). Using statistical analysis, it is shown that the new design of the filter significantly enhances the accuracy in comparison with the performance of conventional BMFLC filtering. In addition, E-BMFLC significantly reduces the sensitivity to parameter tuning and intrapatient variabilities. The observed improvements are achieved by modulating the memory of the proposed filter, and by enriching the utilized harmonic model. The proposed filter is then used to develop a safe haptics-enabled robotic rehabilitation architecture, designed for patients having hand tremors. The architecture is entitled Augmented Haptic Rehabilitation (AHR), which enables adaptive management of the involuntary components of the hand motion while delivering assist-as-needed haptic therapy (for the voluntary component) and avoiding unsafe amplification of hand tremors. Experimental evaluations are provided to evaluate the efficacy of the proposed AHR system. © 2007-2012 IEEE.",Adaptive filters; assist-as-needed robotic rehabilitation; pathological hand tremors,Adaptive filtering; Adaptive filters; Degrees of freedom (mechanics); Robotics; Experimental evaluation; Fourier linear combiner; Hand tremors; Pathological tremors; Rehabilitation System; Robotic rehabilitation; Sensitivity to parameters; Three degrees of freedom; Patient rehabilitation,,,Institute of Electrical and Electronics Engineers Inc.,19324553,,,,English,IEEE J. Sel. Top. Sign. Proces.,Article,Final,,Scopus,2-s2.0-84982711452
Gulberti A.; Hamel W.; Buhmann C.; Boelmans K.; Zittel S.; Gerloff C.; Westphal M.; Engel A.K.; Schneider T.R.; Moll C.K.E.,"Gulberti, A. (55872920200); Hamel, W. (56256802900); Buhmann, C. (7004508449); Boelmans, K. (6506205536); Zittel, S. (12765577400); Gerloff, C. (7003268447); Westphal, M. (56048241600); Engel, A.K. (57202521319); Schneider, T.R. (23994400600); Moll, C.K.E. (8606370400)",55872920200; 56256802900; 7004508449; 6506205536; 12765577400; 7003268447; 56048241600; 57202521319; 23994400600; 8606370400,Subthalamic deep brain stimulation improves auditory sensory gating deficit in Parkinson's disease,2015,Clinical Neurophysiology,126,3,,565,574,25,10.1016/j.clinph.2014.06.046,https://www.scopus.com/inward/record.uri?eid=2-s2.0-84922509441&doi=10.1016%2Fj.clinph.2014.06.046&partnerID=40&md5=b0f8fab66e7987622aab7982bfcf519b,"Department of Neurophysiology and Pathophysiology, University Medical Center Hamburg-Eppendorf, Martinistr. 52, Hamburg, 20246, Germany; Department of Neurosurgery, University Medical Center Hamburg-Eppendorf, Martinistr. 52, Hamburg, 20246, Germany; Department of Neurology, University Medical Center Hamburg-Eppendorf, Martinistr. 52, Hamburg, 20246, Germany; Department of Psychiatry, University Medical Center Hamburg-Eppendorf, Martinistr. 52, Hamburg, 20246, Germany; Department of Paediatric and Adult Movement Disorders and Neuropsychiatry, Institute of Neurogenetics, University of Lübeck, Lübeck, Germany","Gulberti A., Department of Neurophysiology and Pathophysiology, University Medical Center Hamburg-Eppendorf, Martinistr. 52, Hamburg, 20246, Germany; Hamel W., Department of Neurosurgery, University Medical Center Hamburg-Eppendorf, Martinistr. 52, Hamburg, 20246, Germany; Buhmann C., Department of Neurology, University Medical Center Hamburg-Eppendorf, Martinistr. 52, Hamburg, 20246, Germany; Boelmans K., Department of Neurology, University Medical Center Hamburg-Eppendorf, Martinistr. 52, Hamburg, 20246, Germany, Department of Psychiatry, University Medical Center Hamburg-Eppendorf, Martinistr. 52, Hamburg, 20246, Germany; Zittel S., Department of Neurology, University Medical Center Hamburg-Eppendorf, Martinistr. 52, Hamburg, 20246, Germany, Department of Paediatric and Adult Movement Disorders and Neuropsychiatry, Institute of Neurogenetics, University of Lübeck, Lübeck, Germany; Gerloff C., Department of Neurology, University Medical Center Hamburg-Eppendorf, Martinistr. 52, Hamburg, 20246, Germany; Westphal M., Department of Neurosurgery, University Medical Center Hamburg-Eppendorf, Martinistr. 52, Hamburg, 20246, Germany; Engel A.K., Department of Neurophysiology and Pathophysiology, University Medical Center Hamburg-Eppendorf, Martinistr. 52, Hamburg, 20246, Germany; Schneider T.R., Department of Neurophysiology and Pathophysiology, University Medical Center Hamburg-Eppendorf, Martinistr. 52, Hamburg, 20246, Germany; Moll C.K.E., Department of Neurophysiology and Pathophysiology, University Medical Center Hamburg-Eppendorf, Martinistr. 52, Hamburg, 20246, Germany","Objective: While motor effects of dopaminergic medication and subthalamic nucleus deep brain stimulation (STN-DBS) in Parkinson's disease (PD) patients are well explored, their effects on sensory processing are less well understood. Here, we studied the impact of levodopa and STN-DBS on auditory processing. Methods: Rhythmic auditory stimulation (RAS) was presented at frequencies between 1 and 6. Hz in a passive listening paradigm. High-density EEG-recordings were obtained before (levodopa ON/OFF) and 5. months following STN-surgery (ON/OFF STN-DBS). We compared auditory evoked potentials (AEPs) elicited by RAS in 12 PD patients to those in age-matched controls. Tempo-dependent amplitude suppression of the auditory P1/N1-complex was used as an indicator of auditory gating. Results: Parkinsonian patients showed significantly larger AEP-amplitudes (P1, N1) and longer AEP-latencies (N1) compared to controls. Neither interruption of dopaminergic medication nor of STN-DBS had an immediate effect on these AEPs. However, chronic STN-DBS had a significant effect on abnormal auditory gating characteristics of parkinsonian patients and restored a physiological P1/N1-amplitude attenuation profile in response to RAS with increasing stimulus rates. Conclusions: This differential treatment effect suggests a divergent mode of action of levodopa and STN-DBS on auditory processing. Significance: STN-DBS may improve early attentive filtering processes of redundant auditory stimuli, possibly at the level of the frontal cortex. © 2014 International Federation of Clinical Neurophysiology.",Auditory evoked potentials; Deep brain stimulation; Parkinson's disease; Sensory gating; Subthalamic nucleus,"Aged; Antiparkinson Agents; Auditory Cortex; Combined Modality Therapy; Deep Brain Stimulation; Electroencephalography; Evoked Potentials, Auditory; Female; Humans; Levodopa; Male; Middle Aged; Parkinson Disease; Sensory Gating; Subthalamic Nucleus; levodopa; antiparkinson agent; levodopa; adult; Article; auditory processing disorder; auditory stimulation; brain depth stimulation; clinical article; controlled study; electroencephalogram; evoked auditory response; female; human; male; Parkinson disease; priority journal; reliability; sensory gating; subthalamus; aged; auditory cortex; drug effects; electroencephalography; middle aged; multimodality cancer therapy; Parkinson disease; pathophysiology; physiology; sensory gating; subthalamic nucleus",,,Elsevier Ireland Ltd,13882457,,CNEUF,25085452,English,Clin. Neurophysiol.,Article,Final,,Scopus,2-s2.0-84922509441
Bruno V.; Fox S.H.,"Bruno, Veronica (24400522100); Fox, Susan H. (7401924307)",24400522100; 7401924307,Tremor-Predominant Fragile X-Associated Tremor/Ataxia Syndrome in a Female,2015,Movement Disorders Clinical Practice,2,1,,45,46,0,10.1002/mdc3.12129,https://www.scopus.com/inward/record.uri?eid=2-s2.0-85067373791&doi=10.1002%2Fmdc3.12129&partnerID=40&md5=d4b1679c593abb3b957bc0b0e40751af,"Morton and Gloria Shulman Movement Disorders Clinic and the Edmond J. Safra Program in Parkinson's Disease, Toronto Western Hospital, University Health Network, Toronto, ON, Canada","Bruno V., Morton and Gloria Shulman Movement Disorders Clinic and the Edmond J. Safra Program in Parkinson's Disease, Toronto Western Hospital, University Health Network, Toronto, ON, Canada; Fox S.H., Morton and Gloria Shulman Movement Disorders Clinic and the Edmond J. Safra Program in Parkinson's Disease, Toronto Western Hospital, University Health Network, Toronto, ON, Canada",[No abstract available],FXTAS; Tremor; Women,fragile X mental retardation protein; aged; anxiety; Article; ataxic gait; autonomic dysfunction; case report; clinical assessment; cognitive defect; depression; female; fragile X associated tremor ataxia syndrome; fragile X syndrome; human; hypertension; limb tremor; nuclear magnetic resonance imaging; parkinsonism; peripheral neuropathy; phenotype; priority journal; signal processing,"V. Bruno; Toronto, 399 Bathurst Street, 7th floor, M5T 2S8, Canada; email: vbruno@uhnresearch.ca",,Wiley-Blackwell,23301619,,,,English,Mov. Disord. Clin. Pract.,Article,Final,All Open Access; Bronze Open Access; Green Open Access,Scopus,2-s2.0-85067373791
