Onay A.; Onay M.,"Onay, Aytun (26639554700); Onay, Melih (56271768600)",26639554700; 56271768600,A drug decision support system for developing a successful drug candidate using machine learning techniques,2020,Current Computer-Aided Drug Design,16,4,,407,419,9,10.2174/1573409915666190716143601,https://www.scopus.com/inward/record.uri?eid=2-s2.0-85090491464&doi=10.2174%2F1573409915666190716143601&partnerID=40&md5=cce0413395581281451ad627e633beaa,"Department of Computer Engineering, Faculty of Engineering & Architecture, Kafkas University, Kars, 36100, Turkey; Department of Environmental Engineering, Computational & Experimental Biochemistry Lab, Faculty of Engineering, Van Yuzuncu Yil University, Van, 65100, Turkey","Onay A., Department of Computer Engineering, Faculty of Engineering & Architecture, Kafkas University, Kars, 36100, Turkey; Onay M., Department of Environmental Engineering, Computational & Experimental Biochemistry Lab, Faculty of Engineering, Van Yuzuncu Yil University, Van, 65100, Turkey","Background: Virtual screening of candidate drug molecules using machine learning techniques plays a key role in pharmaceutical industry to design and discovery of new drugs. Computational classification methods can determine drug types according to the disease groups and dis-tinguish approved drugs from withdrawn ones. Introduction: Classification models developed in this study can be used as a simple filter in drug modelling to eliminate potentially inappropriate molecules in the early stages. In this work, we developed a Drug Decision Support System (DDSS) to classify each drug candidate molecule as potentially drug or non-drug and to predict its disease group. Methods: Molecular descriptors were identified for the determination of a number of rules in drug molecules. They were derived using ADRIANA.Code program and Lipinski's rule of five. We used Artificial Neural Network (ANN) to classify drug molecules correctly according to the types of dis-eases. Closed frequent molecular structures in the form of subgraph fragments were also obtained with Gaston algorithm included in ParMol Package to find common molecular fragments for withdrawn drugs. Results: We observed that TPSA, XlogP Natoms, HDon_O and TPSA are the most distinctive fea-tures in the pool of the molecular descriptors and evaluated the performances of classifiers on all datasets and found that classification accuracies are very high on all the datasets. Neural network models achieved 84.6% and 83.3% accuracies on test sets including cardiac therapy, anti-epileptics and anti-parkinson drugs with approved and withdrawn drugs for drug classification problems. Conclusion: The experimental evaluation shows that the system is promising at determination of potential drug molecules to classify drug molecules correctly according to the types of diseases. © 2020 Bentham Science Publishers.",ADRIANA.Code; Artificial neural network; Data mining; Drug design; Frequent subgraph mining; Molecular descriptors,"Data Mining; Drug Design; Drug Discovery; Humans; Machine Learning; Neural Networks, Computer; Classification (of information); Decision support systems; Diagnosis; Filtration; Learning algorithms; Learning systems; Machine learning; Molecules; Natural language processing systems; Network coding; Neural networks; anticonvulsive agent; dihydrofolate reductase; ADRIANA.; Candidate drugs; Code; Drug candidates; Drug Design; Drug molecules; Frequent subgraph mining; Machine learning techniques; Molecular descriptors; Virtual Screening; algorithm; Article; artificial intelligence; artificial neural network; chemical structure; classifier; clinical decision support system; computer aided design; data mining; data processing; decision support system; decision tree; drug decision support system; drug design; heart disease; human; hypertension; machine learning; preeclampsia; sensitivity and specificity; support vector machine; systematic review; training; drug development; procedures; Data mining","A. Onay; Department of Computer Engineering, Faculty of Engineering & Architecture, Kafkas University, Kars, 36100, Turkey; email: aytun.onay@kafkas.edu.tr",,Bentham Science Publishers,15734099,,,31438830,English,Curr. Comput.-Aided Drug Des.,Article,Final,,Scopus,2-s2.0-85090491464
Vanegas-Arroyave N.; Zaghloul K.A.; Hallett M.; Lungu C.,"Vanegas-Arroyave, Nora (15766618400); Zaghloul, Kareem A (7004248538); Hallett, Mark (55552602400); Lungu, Codrin (57825430900)",15766618400; 7004248538; 55552602400; 57825430900,Leg Movements During General Anesthesia,2016,Movement Disorders Clinical Practice,3,5,,510,512,2,10.1002/mdc3.12310,https://www.scopus.com/inward/record.uri?eid=2-s2.0-85067372471&doi=10.1002%2Fmdc3.12310&partnerID=40&md5=b932f649b423a68a800c56cf9cb26ae7,"Department of Neurology, Columbia University College of Physicians and Surgeons, New York, NY, United States; Surgical Neurology Branch, National Institute of Neurological Disorders and Stroke, National Institutes of Health, Bethesda, MD, United States; Human Motor Control Section, National Institute of Neurological Disorders and Stroke, National Institutes of Health, Bethesda, MD, United States; Office of the Clinical Director, National Institute of Neurological Disorders and Stroke, National Institutes of Health, Bethesda, MD, United States","Vanegas-Arroyave N., Department of Neurology, Columbia University College of Physicians and Surgeons, New York, NY, United States; Zaghloul K.A., Surgical Neurology Branch, National Institute of Neurological Disorders and Stroke, National Institutes of Health, Bethesda, MD, United States; Hallett M., Human Motor Control Section, National Institute of Neurological Disorders and Stroke, National Institutes of Health, Bethesda, MD, United States; Lungu C., Office of the Clinical Director, National Institute of Neurological Disorders and Stroke, National Institutes of Health, Bethesda, MD, United States","The authors describe a case of atypical leg movements during general anesthesia. The differential diagnosis of this presentation includes rhythmic movement phenomena, such as leg myoclonus, alternating leg muscle activation, and periodic leg movements of sleep. The patient had a history of tremor-predominant Parkinson's disease since age 43 years. He underwent deep brain stimulation surgery at the National Institutes of Health after an overnight dopaminergic medication withdrawal. Shortly after anesthetic induction, he developed periodic, involuntary movements of his legs that were stereotyped, bilateral and synchronous. The movements were characterized by partial flexion of the ankle, knee, and hip for 3 or 4 seconds at intervals of 5 to 10 seconds. After cessation of the anesthetic infusion, his movements promptly subsided. The total duration of the event was approximately 2 minutes. There were no residual motor or sensory deficits on neurologic examination. Although the exact mechanism responsible for the described observation requires further investigation, this phenomenology should be known, because its occurrence under intravenous anesthetics could be confused for other, pathophysiologically different phenomena. © 2016 International Parkinson and Movement Disorder Society",general anesthesia; leg movements; Parkinson disease,fentanyl; midazolam; propofol; adult; Article; brain depth stimulation; case report; general anesthesia; human; leg movement; male; middle aged; Parkinson disease; polysomnography; priority journal; sleep disordered breathing; stereotypy,"N. Vanegas-Arroyave; Department of Neurology, Columbia University College of Physicians and Surgeons, New York, United States; email: nv2281@cumc.columbia.edu",,Wiley-Blackwell,23301619,,,,English,Mov. Disord. Clin. Pract.,Article,Final,All Open Access; Bronze Open Access; Green Open Access,Scopus,2-s2.0-85067372471
Elble R.J.,"Elble, Rodger J. (7004503339)",7004503339,Tremor and dopamine agonists,2002,Neurology,58,4 SUPPL. 1,,S57,S62,36,10.1212/wnl.58.suppl_1.s57,https://www.scopus.com/inward/record.uri?eid=2-s2.0-0037176819&doi=10.1212%2Fwnl.58.suppl_1.s57&partnerID=40&md5=a115f838b0f58aaca95f2125563de374,"Department of Neurology, Southern Illinois Univ. Sch. of Med., Springfield, IL 62794-9643, PO Box 19643, United States","Elble R.J., Department of Neurology, Southern Illinois Univ. Sch. of Med., Springfield, IL 62794-9643, PO Box 19643, United States","Although all dopaminergic drugs are effective in reducing tremor, no single drug has been shown to be clearly superior in the treatment of tremor. Levodopa produces a mean improvement of 30 to 50% in the Unified Parkinson's Disease Rating Scale (UPDRS) subtest for rest tremor. Comparable improvement is achieved with the dopamine agonists. Dopamine agonists are particularly well suited for patients with newly diagnosed tremor-predominant disease and no cognitive impairment, but they are also useful in advanced patients with tremor that is refractory to levodopa and anticholinergics. The response of tremor to pharmacotherapy is variable, and clinicians must be prepared to try all of the available drugs before concluding that surgery is the only alternative.",Dopamine agonists; Levodopa; Surgery; Tremor,"Antiparkinson Agents; Diagnosis, Differential; Dopamine Agonists; Humans; Levodopa; Parkinson Disease; Tremor; amantadine; benzatropine; bromocriptine; carbidopa plus levodopa; cholinergic receptor blocking agent; clozapine; dopamine receptor stimulating agent; entacapone; levodopa; pergolide; pramipexole; propranolol; ropinirole; selegiline; tolcapone; trihexyphenidyl; antiparkinson agent; dopamine receptor stimulating agent; levodopa; cognitive defect; differential diagnosis; disease severity; drug cost; drug efficacy; drug formulation; drug indication; drug response; essential tremor; human; neuropathology; neurosurgery; Parkinson disease; priority journal; review; treatment indication; tremor; Parkinson disease; pathophysiology; tremor","R.J. Elble; Department of Neurology, Southern Illinois Univ. Sch. of Med., Springfield, IL 62794-9643, PO Box 19643, United States; email: relble@siumed.edu",,Lippincott Williams and Wilkins,00283878,,NEURA,11909986,English,Neurology,Review,Final,,Scopus,2-s2.0-0037176819
Kumsa D.; Steinke G.K.; Molnar G.F.; Hudak E.M.; Montague F.W.; Kelley S.C.; Untereker D.F.; Shi A.; Hahn B.P.; Condit C.; Lee H.; Bardot D.; Centeno J.A.; Krauthamer V.; Takmakov P.A.,"Kumsa, Doe (55173937300); Steinke, G. Karl (56765621600); Molnar, Gregory F. (21934918900); Hudak, Eric M. (57172867400); Montague, Fred W. (6602795026); Kelley, Shawn C. (56224849700); Untereker, Darrel F. (6603787145); Shi, Alan (57195326165); Hahn, Benjamin P. (57191404410); Condit, Chris (58450243700); Lee, Hyowon (59106583700); Bardot, Dawn (10642244200); Centeno, Jose A. (7006773214); Krauthamer, Victor (56124611400); Takmakov, Pavel A. (8635032500)",55173937300; 56765621600; 21934918900; 57172867400; 6602795026; 56224849700; 6603787145; 57195326165; 57191404410; 58450243700; 59106583700; 10642244200; 7006773214; 56124611400; 8635032500,Public Regulatory Databases as a Source of Insight for Neuromodulation Devices Stimulation Parameters,2018,Neuromodulation,21,2,,117,125,15,10.1111/ner.12641,https://www.scopus.com/inward/record.uri?eid=2-s2.0-85027098043&doi=10.1111%2Fner.12641&partnerID=40&md5=c45f9d5eca2e8362f038d8d4510a6917,"Division of Biology, Chemistry and Materials Science, Office of Science and Engineering Laboratories, Center for Devices and Radiological Health, U.S. Food and Drug Administration, White Oak Federal Research Center, Silver Spring, MD, United States; Medical Device Innovation Consortium, Minneapolis, MN, United States; Neuromodulation Division, Boston Scientific Corporation, Valencia, CA, United States; Department of Neurology, Medical School, University of Minnesota, Minneapolis, MN, United States; Department of Research & Technology, Advanced Bionics LLC, Valencia, CA, United States; Department of Biomedical Engineering, Case Western Reserve University, Cleveland, OH, United States; Medtronic Plc, Minneapolis, MN, United States; Implantable Electronic Systems Division, St. Jude Medical, Plano, TX, United States; Weldon School of Biomedical Engineering, Birck Nanotechnology Center, Purdue University, West Lafayette, IN, United States; Division of Biomedical Physics, Office of Science and Engineering Laboratories, Center for Devices and Radiological Health, U.S. Food and Drug Administration, White Oak Federal Research Center, Silver Spring, MD, United States","Kumsa D., Division of Biology, Chemistry and Materials Science, Office of Science and Engineering Laboratories, Center for Devices and Radiological Health, U.S. Food and Drug Administration, White Oak Federal Research Center, Silver Spring, MD, United States, Medical Device Innovation Consortium, Minneapolis, MN, United States; Steinke G.K., Neuromodulation Division, Boston Scientific Corporation, Valencia, CA, United States; Molnar G.F., Medical Device Innovation Consortium, Minneapolis, MN, United States, Department of Neurology, Medical School, University of Minnesota, Minneapolis, MN, United States; Hudak E.M., Department of Research & Technology, Advanced Bionics LLC, Valencia, CA, United States; Montague F.W., Department of Biomedical Engineering, Case Western Reserve University, Cleveland, OH, United States; Kelley S.C., Medtronic Plc, Minneapolis, MN, United States; Untereker D.F., Medtronic Plc, Minneapolis, MN, United States; Shi A., Medtronic Plc, Minneapolis, MN, United States; Hahn B.P., Neuromodulation Division, Boston Scientific Corporation, Valencia, CA, United States; Condit C., Implantable Electronic Systems Division, St. Jude Medical, Plano, TX, United States; Lee H., Weldon School of Biomedical Engineering, Birck Nanotechnology Center, Purdue University, West Lafayette, IN, United States; Bardot D., Medical Device Innovation Consortium, Minneapolis, MN, United States; Centeno J.A., Division of Biology, Chemistry and Materials Science, Office of Science and Engineering Laboratories, Center for Devices and Radiological Health, U.S. Food and Drug Administration, White Oak Federal Research Center, Silver Spring, MD, United States; Krauthamer V., Division of Biomedical Physics, Office of Science and Engineering Laboratories, Center for Devices and Radiological Health, U.S. Food and Drug Administration, White Oak Federal Research Center, Silver Spring, MD, United States; Takmakov P.A., Division of Biology, Chemistry and Materials Science, Office of Science and Engineering Laboratories, Center for Devices and Radiological Health, U.S. Food and Drug Administration, White Oak Federal Research Center, Silver Spring, MD, United States","Objective: The Shannon model is often used to define an expected boundary between non-damaging and damaging modes of electrical neurostimulation. Numerous preclinical studies have been performed by manufacturers of neuromodulation devices using different animal models and a broad range of stimulation parameters while developing devices for clinical use. These studies are mostly absent from peer-reviewed literature, which may lead to this information being overlooked by the scientific community. We aimed to locate summaries of these studies accessible via public regulatory databases and to add them to a body of knowledge available to a broad scientific community. Methods: We employed web search terms describing device type, intended use, neural target, therapeutic application, company name, and submission number to identify summaries for premarket approval (PMA) devices and 510(k) devices. We filtered these records to a subset of entries that have sufficient technical information relevant to safety of neurostimulation. Results: We identified 13 product codes for 8 types of neuromodulation devices. These led us to devices that have 22 PMAs and 154 510(k)s and six transcripts of public panel meetings. We found one PMA for a brain, peripheral nerve, and spinal cord stimulator and five 510(k) spinal cord stimulators with enough information to plot in Shannon coordinates of charge and charge density per phase. Conclusions: Analysis of relevant entries from public regulatory databases reveals use of pig, sheep, monkey, dog, and goat animal models with deep brain, peripheral nerve, muscle and spinal cord electrode placement with a variety of stimulation durations (hours to years); frequencies (10–10,000 Hz) and magnitudes (Shannon k from below zero to 4.47). Data from located entries indicate that a feline cortical model that employs acute stimulation might have limitations for assessing tissue damage in diverse anatomical locations, particularly for peripheral nerve and spinal cord simulation. © 2017 International Neuromodulation Society",electrical stimulation; Electrodes; neural implants; safety of electrical stimulation; Shannon model,"Animals; Brain; Databases, Factual; Device Approval; Electric Stimulation Therapy; Humans; Neurotransmitter Agents; agents interacting with transmitter, hormone or drug receptors; access to information; animal experiment; brain depth stimulation; brain neurostimulator; device approval; dog; frequency modulation; goat; Haplorhini; information processing; Internet; knowledge base; nerve stimulation; nonhuman; pig; public regulatory databases; Review; sheep; animal; brain; devices; electrotherapy; factual database; human; legislation and jurisprudence; physiology; procedures; standards","P.A. Takmakov; Division of Biology, Chemistry and Materials Science, Office of Science and Engineering Laboratories, Center for Devices and Radiological Health, U.S. Food and Drug Administration, White Oak Federal Research Center, Silver Spring, United States; email: Pavel.Takmakov@fda.hhs.gov",,Blackwell Publishing Inc.,10947159,,NROMF,28782181,English,Neuromodulation,Review,Final,All Open Access; Green Open Access,Scopus,2-s2.0-85027098043
D'Souza R.D.; Vijayaraghavan S.,"D'Souza, Rinaldo D. (57191666573); Vijayaraghavan, Sukumar (7006698227)",57191666573; 7006698227,Paying attention to smell: Cholinergic signaling in the olfactory bulb,2014,Frontiers in Synaptic Neuroscience,6,SEP,21,,,51,10.3389/fnsyn.2014.00021,https://www.scopus.com/inward/record.uri?eid=2-s2.0-84987624719&doi=10.3389%2Ffnsyn.2014.00021&partnerID=40&md5=30eb53e35a02ebded18f35105dbc04be,"Department of Physiology and Biophysics and the Neuroscience Program, School of Medicine, University of Colorado, Aurora, CO, United States; Department of Anatomy and Neurobiology, Washington University School of Medicine, St. Louis, MO, United States","D'Souza R.D., Department of Physiology and Biophysics and the Neuroscience Program, School of Medicine, University of Colorado, Aurora, CO, United States, Department of Anatomy and Neurobiology, Washington University School of Medicine, St. Louis, MO, United States; Vijayaraghavan S., Department of Physiology and Biophysics and the Neuroscience Program, School of Medicine, University of Colorado, Aurora, CO, United States","The tractable, layered architecture of the olfactory bulb (OB), and its function as a relay between odor input and higher cortical processing, makes it an attractive model to study how sensory information is processed at a synaptic and circuit level. The OB is also the recipient of strong neuromodulatory inputs, chief among them being the central cholinergic system. Cholinergic axons from the basal forebrain modulate the activity of various cells and synapses within the OB, particularly the numerous dendrodendritic synapses, resulting in highly variable responses of OB neurons to odor input that is dependent upon the behavioral state of the animal. Behavioral, electrophysiological, anatomical, and computational studies examining the function of muscarinic and nicotinic cholinergic receptors expressed in the OB have provided valuable insights into the role of acetylcholine (ACh) in regulating its function. We here review various studies examining the modulation of OB function by cholinergic fibers and their target receptors, and provide putative models describing the role that cholinergic receptor activation might play in the encoding of odor information. © 2014 D'Souza and Vijayaraghavan.",Filter; GABAergic; Glomerular; Muscarinic; Nicotinic,acetylcholine; cholinergic receptor; muscarinic receptor; nicotinic receptor; Alzheimer disease; cholinergic system; degenerative disease; firing rate; granule cell; human; mitral cell; neuromodulation; nonhuman; odor; olfactory bulb; olfactory receptor neuron; Parkinson disease; protein analysis; protein expression; protein function; protein localization; Review; signal transduction,"S. Vijayaraghavan; Department of Physiology and Biophysics and the Neuroscience Program, School of Medicine, University of Colorado, Aurora, MS 8307, P18-7121, 12800 East 19th Avenue, 80045, United States; email: sukumar.v@ucdenver.edu",,Frontiers Media S.A.,16633563,,,,English,Front. Synaptic Neurosci.,Review,Final,All Open Access; Gold Open Access; Green Open Access,Scopus,2-s2.0-84987624719
Finsterer J.; Scorza F.A.,"Finsterer, Josef (55181651300); Scorza, Fulvio A (6602614525)",55181651300; 6602614525,Central nervous system abnormalities in spinal and bulbar muscular atrophy (Kennedy's disease),2019,Clinical Neurology and Neurosurgery,184,,105426,,,6,10.1016/j.clineuro.2019.105426,https://www.scopus.com/inward/record.uri?eid=2-s2.0-85069627844&doi=10.1016%2Fj.clineuro.2019.105426&partnerID=40&md5=ae2ce0c49e7729d38055871ce12ebbcb,"Krankenanstalt Rudolfstiftung, Messerli Institute, Vienna, Austria; Disciplina de Neurociência. Escola Paulista de, Medicina/Universidade Federal de São Paulo/. (EPM/UNIFESP), São Paulo, Brazil","Finsterer J., Krankenanstalt Rudolfstiftung, Messerli Institute, Vienna, Austria; Scorza F.A., Disciplina de Neurociência. Escola Paulista de, Medicina/Universidade Federal de São Paulo/. (EPM/UNIFESP), São Paulo, Brazil","Spinal and bulbar (bulbospinal) muscular atrophy (BSMA, SBMA, Kennedy's disease) is a progressive motor neuron disease with rare involvement of structures other than the lower motor neuron, such as the endocrine system and the central nervous system (CNS). Aim of the review was to study type and frequency of clinical, imaging, and functional (CNS) abnormalities in SBMA patients. The most frequent clinical CNS manifestations in SBMA are postural or kinetic tremor predominantly of the hands and mild cognitive impairment. The most frequent instrumental CNS abnormality in SBMA patients are white matter lesions, visible on voxel-based morphometry, magnetic resonance spectroscopy, or diffusion tensor imaging. Single patients with enlarged pituitary volume, or diminished somato-sensory representation in the cortex have been also reported. Seizures, epilepsy, ataxia, spasticity, dystonia, or migraine have not been found in SBMA patients. Only supportive treatment is available for CNS manifestations in SBMA. It is concluded that the most frequent CNS abnormalities in SBMA are tremor, cognitive impairment, and white matter lesions on new imaging modalities. CNS involvement in SBMA should not be neglected as a phenotypic manifestation of SBMA and, apart from cognitive involvement, may help to differentiate clinically SBMA from other types of motor neuron disease. © 2019 Elsevier B.V.",Androgen receptor; Brain; Bulbospinal muscular atrophy; CAG repeat expansion; Central nervous system; Spinal cord,"Central Nervous System Diseases; Humans; Motor Neuron Disease; Motor Neurons; Muscular Atrophy; Muscular Atrophy, Spinal; Nervous System Malformations; diffusion tensor imaging; hand tremor; human; Kennedy disease; mild cognitive impairment; multimodal imaging; neuroimaging; neuropsychology; nuclear magnetic resonance spectroscopy; Review; voxel based morphometry; white matter lesion; central nervous system disease; motoneuron; motor neuron disease; muscle atrophy; nervous system malformation; pathology; spinal muscular atrophy","J. Finsterer; Krankenanstalt Rudolfstiftung, Messerli Institute, Vienna, Austria; email: fifigs1@yahoo.de",,Elsevier B.V.,03038467,,CNNSB,31351215,English,Clin. Neurol. Neurosurg.,Review,Final,,Scopus,2-s2.0-85069627844
