Luesma M.J.; López-Marco L.; Monzón M.; Santander S.,"Luesma, María José (55701700600); López-Marco, Liberto (59345018100); Monzón, Marta (57202491032); Santander, Sonia (23499311000)",55701700600; 59345018100; 57202491032; 23499311000,Enteric Nervous System and Its Relationship with Neurological Diseases,2024,Journal of Clinical Medicine,13,18,5579,,,6,10.3390/jcm13185579,https://www.scopus.com/inward/record.uri?eid=2-s2.0-85205043512&doi=10.3390%2Fjcm13185579&partnerID=40&md5=7337b090f08bf7a438cd38ffb377a178,"Department of Human Anatomy and Histology, University of Zaragoza, Zaragoza, 50009, Spain; Department of Pharmacology, Physiology, Legal and Forensic Medicine, University of Zaragoza, Zaragoza, 50009, Spain","Luesma M.J., Department of Human Anatomy and Histology, University of Zaragoza, Zaragoza, 50009, Spain; López-Marco L., Department of Human Anatomy and Histology, University of Zaragoza, Zaragoza, 50009, Spain; Monzón M., Department of Human Anatomy and Histology, University of Zaragoza, Zaragoza, 50009, Spain; Santander S., Department of Pharmacology, Physiology, Legal and Forensic Medicine, University of Zaragoza, Zaragoza, 50009, Spain","The enteric nervous system (ENS) is a fundamental component of the gastrointestinal system, composed of a vast network of neurons and glial cells. It operates autonomously but is interconnected with the central nervous system (CNS) through the vagus nerve. This communication, known as the gut–brain axis, influences the bidirectional communication between the brain and the gut. Background/Objectives: This study aimed to review neurological pathologies related to the ENS. Methods: To this end, a comprehensive literature search was conducted in the “PubMed” database. Articles available in “free format” were selected, applying the filters “Humans” and limiting the search to publications from the last ten years. Results: The ENS has been linked to various neurological diseases, from autism spectrum disorder to Parkinson’s disease including neurological infection with the varicella zoster virus (VZV), even sharing pathologies with the CNS. This finding suggests that the ENS could serve as an early diagnostic marker or therapeutic target for neurological diseases. Gastrointestinal symptoms often precede CNS symptoms, and the ENS’s accessibility aids in diagnosis and treatment. Parkinson’s patients may show intestinal lesions up to twenty years before CNS symptoms, underscoring the potential for early diagnosis. However, challenges include developing standardized diagnostic protocols and the uneven distribution of dopaminergic neurons in the ENS. Continued research is needed to explore the ENS’s potential in improving disease prognosis. Conclusions: The ENS is a promising area for early diagnosis and therapeutic development. Nevertheless, it is essential to continue research in this area, especially to gain a deeper understanding of its organization, function, and regenerative capacity. © 2024 by the authors.",central nervous system (CNS); enteric nervous system (ENS); gastrointestinal system; glial cells; neurological diseases; varicella zoster virus (VZV),Alzheimer disease; amyotrophic lateral sclerosis; Article; autism; chickenpox; dopaminergic nerve cell; early diagnosis; frontotemporal dementia; gastrointestinal symptom; human; Huntington chorea; intestine injury; intestine innervation; Medline; multiple sclerosis; neurologic disease; Parkinson disease; pathophysiology; Preferred Reporting Items for Systematic Reviews and Meta-Analyses; prion disease; prognosis,"S. Santander; Department of Pharmacology, Physiology, Legal and Forensic Medicine, University of Zaragoza, Zaragoza, 50009, Spain; email: soniasb@unizar.es",,Multidisciplinary Digital Publishing Institute (MDPI),20770383,,,,English,J. Clin. Med.,Article,Final,All Open Access; Gold Open Access; Green Open Access,Scopus,2-s2.0-85205043512
Shi H.; Chen S.; Jiang Z.; Wang Y.,"Shi, Hao (60209921000); Chen, Sanyun (60209406400); Jiang, Zhuoying (59345843200); Wang, Yuting (60209279600)",60209921000; 60209406400; 59345843200; 60209279600,Wearable-Sensor-Based Analysis of Aerial Archimedean Spirals for Early Detection of Parkinson’s Disease,2025,Sensors,25,24,7579,,,0,10.3390/s25247579,https://www.scopus.com/inward/record.uri?eid=2-s2.0-105026000144&doi=10.3390%2Fs25247579&partnerID=40&md5=da18b35d4caa3d739aaa790d671559b4,"School of Information Engineering, Hangzhou Medical College, Hangzhou, 311399, China; School of Public Health, Hangzhou Medical College, Hangzhou, 311399, China","Shi H., School of Information Engineering, Hangzhou Medical College, Hangzhou, 311399, China; Chen S., School of Information Engineering, Hangzhou Medical College, Hangzhou, 311399, China; Jiang Z., School of Public Health, Hangzhou Medical College, Hangzhou, 311399, China; Wang Y., School of Information Engineering, Hangzhou Medical College, Hangzhou, 311399, China","Parkinson’s disease (PD) is a progressive neurodegenerative disorder whose early symptoms, especially mild tremor, are often clinically imperceptible. Early detection is crucial for initiating neuroprotective interventions to slow dopaminergic neuronal degeneration. Current PD diagnosis relies predominantly on subjective clinical assessments due to the absence of definitive biomarkers. This study proposes a novel approach for the early detection of PD through a custom-developed smart wristband equipped with an inertial measurement unit (IMU). Unlike previous paper-based or resting-tremor approaches, this study introduces a mid-air Archimedean spiral task combined with an attention-enhanced Long Short-Term Memory (LSTM) architecture, enabling substantially more sensitive detection of subtle early-stage Parkinsonian motor abnormalities. We propose LAFNet, a model based on an attention-enhanced LSTM network, which processes motion data that has been filtered using a Kalman algorithm for noise reduction, enabling rapid and accurate diagnosis. Clinical data evaluation demonstrated exceptional performance, with an accuracy of 99.02%. The proposed system shows significant potential for clinical translation as a non-invasive screening tool for early-stage Parkinson’s disease (PD). © 2025 by the authors.",Archimedean spiral; attention mechanism; early detection; IMU; Kalman filter; LAFNet; Parkinson’s disease,"Algorithms; Early Diagnosis; Humans; Male; Neural Networks, Computer; Parkinson Disease; Tremor; Wearable Electronic Devices; Antennas; Diagnosis; Long short-term memory; Medical computing; Neurodegenerative diseases; Neurons; Noise abatement; Screening; Wearable sensors; 'current; Archimedean spiral; Attention mechanisms; Disease diagnosis; Early detection; Inertial measurements units; LAFNet; Neurodegenerative disorders; Parkinson’s disease; Short term memory; algorithm; artificial neural network; diagnosis; early diagnosis; human; male; Parkinson disease; pathophysiology; tremor; wearable electronic device; Kalman filters","H. Shi; School of Information Engineering, Hangzhou Medical College, Hangzhou, 311399, China; email: shihao@hmc.edu.cn",,Multidisciplinary Digital Publishing Institute (MDPI),14248220,,,41471574,English,Sensors,Article,Final,All Open Access; Gold Open Access; Green Open Access,Scopus,2-s2.0-105026000144
Arogia Victor Paul M.; Shankar S.,"Arogia Victor Paul, M. (57216409817); Shankar, Sharmila (57195410521)",57216409817; 57195410521,CCZO Residual GhostNet: Parkinson Disease Classification using Optimized Deep Learning Technique,2024,International Journal of Electrical and Computer Engineering Systems,15,3,,275,283,2,10.32985/ijeces.15.3.6,https://www.scopus.com/inward/record.uri?eid=2-s2.0-85188421973&doi=10.32985%2Fijeces.15.3.6&partnerID=40&md5=44d0a3e33692bbbf42f2aa6f736da7de,"Department of Computer Science and Engineering, B.S. Abdur Rahman Crescent Institute of Science and Technology, Chennai, India","Arogia Victor Paul M., Department of Computer Science and Engineering, B.S. Abdur Rahman Crescent Institute of Science and Technology, Chennai, India; Shankar S., Department of Computer Science and Engineering, B.S. Abdur Rahman Crescent Institute of Science and Technology, Chennai, India","Parkinson's disease (PD) classification plays a crucial role in medical diagnosis and patient management. Identifying Parkinson's disease at an early stage can lead to more effective treatment and improved patient outcomes. However, existing methods for Parkinson's disease classification face several limitations. The foremost limitation is the need for accurate and reliable diagnostic tools, as misdiagnosis can lead to inappropriate treatments and unnecessary stress for patients. Thus, a hybrid deep learning model is introduced in this research. The proposed model involves the utilization of EEG signals obtained from a publicly available dataset. Key features are extracted from the EEG signals using a bandpass filter, and every feature is associated with specific brainwave frequencies and cognitive states. The feature mapping and classification are executed through the Chaotic Chebyshev Zebra optimization-based Residual GhostNet (CCZO_Residual_GhostNet). This hybrid classifier, Residual GhostNet, combines ResNet-152 with GhostNet, enhancing classification precision. Furthermore, the CCZO algorithm optimizes the loss function, introducing elements of chaos and Chebyshev mapping to improve classification accuracy. The assessment based on accuracy, sensitivity, specificity, and F-score acquired 98.76%, 98.59%, 98.95%, and 99%, respectively. © 2024, J.J. Strossmayer University of Osijek, Faculty of Electrical Engineering, Computer Science and Information Technology. All rights reserved.",EEG signal; Feature extraction; GhostNet; hybrid deep learning; Parkinson's disease classification; ResNet-152,,,,"J.J. Strossmayer University of Osijek , Faculty of Electrical Engineering, Computer Science and Information Technology",18476996,,,,English,Int. J. Electr. Comput. Eng.,Article,Final,All Open Access; Gold Open Access; Green Open Access,Scopus,2-s2.0-85188421973
Binder D.K.; Shah B.B.; Elias W.J.,"Binder, Devin K. (7004282499); Shah, Binit B. (53980383400); Elias, W. Jeffrey (57216594704)",7004282499; 53980383400; 57216594704,Focused ultrasound and other lesioning in the treatment of tremor,2022,Journal of the Neurological Sciences,435,,120193,,,25,10.1016/j.jns.2022.120193,https://www.scopus.com/inward/record.uri?eid=2-s2.0-85125654717&doi=10.1016%2Fj.jns.2022.120193&partnerID=40&md5=a85c14d4936324dd9483ab87f0b02c0d,"MemorialCare Neuroscience Institute, Orange Coast Medical Center, Fountain Valley, CA, United States; Division of Biomedical Sciences, School of Medicine, University of California, Riverside, CA, United States; Department of Neurology, University of Virginia, Charlottesville, VA, United States; Department of Neurological Surgery, University of Virginia, Charlottesville, VA, United States","Binder D.K., MemorialCare Neuroscience Institute, Orange Coast Medical Center, Fountain Valley, CA, United States, Division of Biomedical Sciences, School of Medicine, University of California, Riverside, CA, United States; Shah B.B., Department of Neurology, University of Virginia, Charlottesville, VA, United States; Elias W.J., Department of Neurological Surgery, University of Virginia, Charlottesville, VA, United States","There has been a long history of lesioning procedures to treat tremor associated with both essential tremor (ET) and Parkinson's disease (PD). These include radiofrequency (RF) thalamotomy, gamma knife radiosurgical (GKRS) thalamotomy, and magnetic resonance-guided focused ultrasound (MRgFUS). In this review, we summarize the clinical studies of lesioning procedures for tremor focusing on these ablative therapies for ET and tremor-predominant PD (TDPD). We then consider clinical treatment variables that influence decision-making regarding ablative therapies versus consideration of deep brain stimulation (DBS) and conclude with ongoing and future studies. This article is part of the Special Issue “Tremor” edited by Daniel D. Truong, Mark Hallett, and Aasef Shaikh. © 2022 Elsevier B.V.",Deep brain stimulation; Essential tremor; Magnetic resonance imaging; Parkinson's disease; Thermometry; Ultrasound,Essential Tremor; Humans; Magnetic Resonance Imaging; Parkinson Disease; Radiosurgery; Thalamus; Treatment Outcome; Tremor; ablation therapy; brain depth stimulation; decision making; essential tremor; focused ultrasound therapy; gamma knife radiosurgery; human; MR-guided focused ultrasound; Parkinson disease; Review; thalamotomy; diagnostic imaging; essential tremor; nuclear magnetic resonance imaging; Parkinson disease; procedures; radiosurgery; thalamus; treatment outcome; tremor,"D.K. Binder; MemorialCare Neuroscience Institute, 9940 Talbert Avenue #201, Fountain Valley, 92708, United States; email: dbinder@ucr.edu",,Elsevier B.V.,0022510X,,JNSCA,35259650,English,J. Neurol. Sci.,Review,Final,,Scopus,2-s2.0-85125654717
Channa A.; Ruggeri G.; Ifrim R.-C.; Mammone N.; Iera A.; Popescu N.,"Channa, Asma (57208174791); Ruggeri, Giuseppe (7005708769); Ifrim, Rares-Cristian (57221776506); Mammone, Nadia (55915193500); Iera, Antonio (7007176996); Popescu, Nirvana (9240753400)",57208174791; 7005708769; 57221776506; 55915193500; 7007176996; 9240753400,Cloud-Connected Bracelet for Continuous Monitoring of Parkinson’s Disease Patients: Integrating Advanced Wearable Technologies and Machine Learning,2024,Electronics (Switzerland),13,6,1002,,,8,10.3390/electronics13061002,https://www.scopus.com/inward/record.uri?eid=2-s2.0-85188814426&doi=10.3390%2Felectronics13061002&partnerID=40&md5=c99066302321f727dda7276dcb4e3e2b,"Computer Science Department, University Politehnica of Bucharest, Bucharest, 060042, Romania; Department of Information, Infrastructure and Sustainable Energy Engineering (DIIES), University Mediterranea of Reggio Calabria, Reggio Calabria, 89124, Italy; Department of Civil, Energy, Environmental and Material Engineering (DICEAM), University Mediterranea of Reggio Calabria, Reggio Calabria, 89124, Italy; Department of Computer Engineering, Modeling, Electronic and System Engineering, University of Calabria, Arcavacata, 87036, Italy; National Inter-University Consortium for Telecommunications (CNIT), Parma, 43124, Italy","Channa A., Computer Science Department, University Politehnica of Bucharest, Bucharest, 060042, Romania, Department of Information, Infrastructure and Sustainable Energy Engineering (DIIES), University Mediterranea of Reggio Calabria, Reggio Calabria, 89124, Italy; Ruggeri G., Department of Information, Infrastructure and Sustainable Energy Engineering (DIIES), University Mediterranea of Reggio Calabria, Reggio Calabria, 89124, Italy; Ifrim R.-C., Computer Science Department, University Politehnica of Bucharest, Bucharest, 060042, Romania; Mammone N., Department of Civil, Energy, Environmental and Material Engineering (DICEAM), University Mediterranea of Reggio Calabria, Reggio Calabria, 89124, Italy; Iera A., Department of Computer Engineering, Modeling, Electronic and System Engineering, University of Calabria, Arcavacata, 87036, Italy, National Inter-University Consortium for Telecommunications (CNIT), Parma, 43124, Italy; Popescu N., Computer Science Department, University Politehnica of Bucharest, Bucharest, 060042, Romania","Parkinson’s disease (PD) is one of the most unremitting and dynamic neurodegenerative human diseases. Various wearable IoT devices have emerged for detecting, diagnosing, and quantifying PD, predominantly utilizing inertial sensors and computational algorithms. However, their proliferation poses novel challenges concerning security, privacy, connectivity, and power optimization. Clinically, continuous monitoring of patients’ motor function is imperative for optimizing Levodopa (L-dopa) dosage while mitigating adverse effects and motor activity decline. Tracking motor function alterations between visits is challenging, risking erroneous clinical decisions. Thus, there is a pressing need to furnish medical professionals with an ecosystem facilitating comprehensive Parkinson’s stage evaluation and disease progression monitoring, particularly regarding tremor and bradykinesia. This study endeavors to establish a holistic ecosystem centered around an energy-efficient Wi-Fi-enabled wearable bracelet dubbed A-WEAR. A-WEAR functions as a data collection conduit for Parkinson’s-related motion data, securely transmitting them to the Cloud for storage, processing, and severity estimation via bespoke learning algorithms. The experimental results demonstrate the resilience and effectiveness of the suggested technique, with 86.4% accuracy for bradykinesia and 90.9% accuracy for tremor estimation, along with good sensitivity and specificity for each scoring class. The recommended approach will support the timely determination of the severity of PD and ongoing patient activity monitoring. The system helps medical practitioners in decision making when initially assessing patients with PD and reviewing their progress and the effects of any treatment. © 2024 by the authors.",bradykinesia; cloud computing; internet of things; Parkinson’s disease; remote monitoring; severity analysis; smart bracelet; tremor,,"A. Channa; Computer Science Department, University Politehnica of Bucharest, Bucharest, 060042, Romania; email: asma.channa@stud.acs.upb.ro",,Multidisciplinary Digital Publishing Institute (MDPI),20799292,,,,English,Electronics (Switzerland),Article,Final,All Open Access; Gold Open Access,Scopus,2-s2.0-85188814426
Cruz-Vicente P.; Passarinha L.A.; Silvestre S.; Gallardo E.,"Cruz-Vicente, Pedro (57221936772); Passarinha, Luís A. (12445439600); Silvestre, Samuel (8234535800); Gallardo, Eugenia (57197920214)",57221936772; 12445439600; 8234535800; 57197920214,Recent developments in new therapeutic agents against alzheimer and parkinson diseases: In-silico approaches,2021,Molecules,26,8,2193,,,43,10.3390/molecules26082193,https://www.scopus.com/inward/record.uri?eid=2-s2.0-85105035033&doi=10.3390%2Fmolecules26082193&partnerID=40&md5=c91a1a8a4de18a4d09b3ffe4ee91a843,"CICS-UBI, Health Sciences Research Centre, University of Beira Interior, Covilhã, 6201-001, Portugal; UCIBIO—Applied Molecular Biosciences Unit, Department of Chemistry, Faculty of Sciences and Technology, NOVA University Lisbon, Caparica, 2829-516, Portugal; Laboratory of Pharmaco-Toxicology—UBIMedical, University of Beira Interior, Covilhã, 6200-001, Portugal; CNC—Center for Neuroscience and Cell Biology, University of Coimbra, Coimbra, 3004-504, Portugal","Cruz-Vicente P., CICS-UBI, Health Sciences Research Centre, University of Beira Interior, Covilhã, 6201-001, Portugal, UCIBIO—Applied Molecular Biosciences Unit, Department of Chemistry, Faculty of Sciences and Technology, NOVA University Lisbon, Caparica, 2829-516, Portugal; Passarinha L.A., CICS-UBI, Health Sciences Research Centre, University of Beira Interior, Covilhã, 6201-001, Portugal, UCIBIO—Applied Molecular Biosciences Unit, Department of Chemistry, Faculty of Sciences and Technology, NOVA University Lisbon, Caparica, 2829-516, Portugal, Laboratory of Pharmaco-Toxicology—UBIMedical, University of Beira Interior, Covilhã, 6200-001, Portugal; Silvestre S., CICS-UBI, Health Sciences Research Centre, University of Beira Interior, Covilhã, 6201-001, Portugal, Laboratory of Pharmaco-Toxicology—UBIMedical, University of Beira Interior, Covilhã, 6200-001, Portugal, CNC—Center for Neuroscience and Cell Biology, University of Coimbra, Coimbra, 3004-504, Portugal; Gallardo E., CICS-UBI, Health Sciences Research Centre, University of Beira Interior, Covilhã, 6201-001, Portugal, Laboratory of Pharmaco-Toxicology—UBIMedical, University of Beira Interior, Covilhã, 6200-001, Portugal","Neurodegenerative diseases (ND), including Alzheimer’s (AD) and Parkinson’s Disease (PD), are becoming increasingly more common and are recognized as a social problem in modern societies. These disorders are characterized by a progressive neurodegeneration and are considered one of the main causes of disability and mortality worldwide. Currently, there is no existing cure for AD nor PD and the clinically used drugs aim only at symptomatic relief, and are not capable of stopping neurodegeneration. Over the last years, several drug candidates reached clinical trials phases, but they were suspended, mainly because of the unsatisfactory pharmacological benefits. Recently, the number of compounds developed using in silico approaches has been increasing at a promising rate, mainly evaluating the affinity for several macromolecular targets and applying filters to exclude compounds with potentially unfavorable pharmacokinetics. Thus, in this review, an overview of the current therapeutics in use for these two ND, the main targets in drug development, and the primary studies published in the last five years that used in silico approaches to design novel drug candidates for AD and PD treatment will be presented. In addition, future perspectives for the treatment of these ND will also be briefly discussed. © 2021 by the authors. Licensee MDPI, Basel, Switzerland.",Alzheimer’s Disease; Computer-aided drug design; In silico studies; Neurodegenerative diseases; Parkinson’s Disease,"Acetylcholinesterase; Alzheimer Disease; Amyloid Precursor Protein Secretases; Antiparkinson Agents; Aspartic Acid Endopeptidases; Catechol O-Methyltransferase; Cholinesterase Inhibitors; Clinical Trials as Topic; Computer Simulation; Dopamine Agents; Drug Design; Excitatory Amino Acid Antagonists; Gene Expression Regulation; GPI-Linked Proteins; Humans; Neuroprotective Agents; Parkinson Disease; Receptors, N-Methyl-D-Aspartate; Sirtuins; acetylcholinesterase; ACHE protein, human; amino acid receptor blocking agent; antiparkinson agent; aspartic proteinase; BACE1 protein, human; catechol methyltransferase; cholinesterase inhibitor; COMT protein, human; dopamine receptor stimulating agent; glycosylphosphatidylinositol anchored protein; n methyl dextro aspartic acid receptor; neuroprotective agent; secretase; sirtuin; Alzheimer disease; clinical trial (topic); computer simulation; drug design; gene expression regulation; genetics; human; metabolism; Parkinson disease; pathology; synthesis","L.A. Passarinha; CICS-UBI, Health Sciences Research Centre, University of Beira Interior, Covilhã, 6201-001, Portugal; email: lpassarinha@fcsaude.ubi.pt; S. Silvestre; CICS-UBI, Health Sciences Research Centre, University of Beira Interior, Covilhã, 6201-001, Portugal; email: samuel@fcsaude.ubi.pt; E. Gallardo; CICS-UBI, Health Sciences Research Centre, University of Beira Interior, Covilhã, 6201-001, Portugal; email: egallardo@fcsaude.ubi.pt",,MDPI AG,14203049,,MOLEF,33920326,English,Molecules,Review,Final,All Open Access; Gold Open Access; Green Open Access,Scopus,2-s2.0-85105035033
