Nakagawa H.; Shima Y.; Sasagawa Y.; Nikaido I.,"Nakagawa, Haruko (60032726800); Shima, Yasuyuki (59884984600); Sasagawa, Yohei (57202848923); Nikaido, Itoshi (6602838205)",60032726800; 59884984600; 57202848923; 6602838205,MitoDelta: identifying mitochondrial DNA deletions at cell-type resolution from single-cell RNA sequencing data,2025,BMC Genomics,26,1,810,,,0,10.1186/s12864-025-11931-0,https://www.scopus.com/inward/record.uri?eid=2-s2.0-105017184876&doi=10.1186%2Fs12864-025-11931-0&partnerID=40&md5=cd36b05285d151284489de975cabd4e9,"Department of Functional Genome Informatics, Division of Biological Data Science, Medical Research Laboratory, Institute of Integrated Research, Institute of Science Tokyo, 1-5-45 Yushima, Bunkyo-Ku, Tokyo, 113-8510, Japan; Omics AI Research Team, Advanced General Intelligence in Science Program (AGIS), TRIP Headquarters, RIKEN, 2-1 Hirosawa, Saitama, Wako, 351-0198, Japan; Neurodegenerative Disorders Collaborative Laboratory, RIKEN, 2-1 Hirosawa, Saitama, Wako, 351-0198, Japan; Laboratory of Molecular Dynamics of Mental Disorders, RIKEN, 2-1 Hirosawa, Saitama, Wako, 351-0198, Japan","Nakagawa H., Department of Functional Genome Informatics, Division of Biological Data Science, Medical Research Laboratory, Institute of Integrated Research, Institute of Science Tokyo, 1-5-45 Yushima, Bunkyo-Ku, Tokyo, 113-8510, Japan, Omics AI Research Team, Advanced General Intelligence in Science Program (AGIS), TRIP Headquarters, RIKEN, 2-1 Hirosawa, Saitama, Wako, 351-0198, Japan; Shima Y., Neurodegenerative Disorders Collaborative Laboratory, RIKEN, 2-1 Hirosawa, Saitama, Wako, 351-0198, Japan, Laboratory of Molecular Dynamics of Mental Disorders, RIKEN, 2-1 Hirosawa, Saitama, Wako, 351-0198, Japan; Sasagawa Y., Department of Functional Genome Informatics, Division of Biological Data Science, Medical Research Laboratory, Institute of Integrated Research, Institute of Science Tokyo, 1-5-45 Yushima, Bunkyo-Ku, Tokyo, 113-8510, Japan, Omics AI Research Team, Advanced General Intelligence in Science Program (AGIS), TRIP Headquarters, RIKEN, 2-1 Hirosawa, Saitama, Wako, 351-0198, Japan; Nikaido I., Department of Functional Genome Informatics, Division of Biological Data Science, Medical Research Laboratory, Institute of Integrated Research, Institute of Science Tokyo, 1-5-45 Yushima, Bunkyo-Ku, Tokyo, 113-8510, Japan, Omics AI Research Team, Advanced General Intelligence in Science Program (AGIS), TRIP Headquarters, RIKEN, 2-1 Hirosawa, Saitama, Wako, 351-0198, Japan","Background: Deletion variants in mitochondrial DNA (mtDNA) are associated with various diseases, such as mitochondrial disorders and neurodegenerative diseases. Traditionally, mtDNA deletions have been studied using bulk DNA sequencing, but bulk methods average signals across cells, thereby masking the cell-type-specific mutational landscapes. Resolving mtDNA deletions at single-cell resolution is beneficial for understanding how these mutations affect distinct cell populations. To date, no specialized method exists for detecting cell-type-specific mtDNA deletions from single-cell RNA sequencing data. Notably, mtDNA possesses unique molecular features: a high copy number, stable transcription, and compact structure of the mitochondrial genome. This results in a relatively high abundance of mtDNA-derived reads even in single-cell RNA sequencing data, suggesting the possibility of detecting mtDNA deletion variants directly from transcriptomic data. Results: Here, we present MitoDelta, a computational pipeline that enables the detection of mtDNA deletions at cell-type resolution solely from single-cell RNA sequencing data. MitoDelta combines a sensitive alignment strategy with robust statistical filtering based on a beta-binomial distribution model, allowing accurate identification of deletion events even from noisy single-cell transcriptomes. To capture cell-type-specific deletion patterns, MitoDelta analyzes reads pooled by annotated cell types, enabling quantification of deletion burden across distinct cellular populations. We benchmarked MitoDelta against existing mtDNA deletion detection tools and demonstrated superior overall performance. As a practical application, we applied MitoDelta to a published single-nucleus RNA sequencing dataset for Parkinson’s disease and revealed distinct mtDNA deletion burdens across neuronal subtypes. Conclusions: MitoDelta enables the transcriptome-integrated, cell-type-specific detection of mtDNA deletions from single-cell RNA sequencing data alone, offering a valuable framework for reanalyzing public datasets and studying mitochondrial genome alterations at cell-type resolution. This integrated approach enables insights into how mtDNA deletions are distributed across specific cell types and cellular states, providing new opportunities to investigate the role of mtDNA deletions in cell-type-specific disease mechanisms. The tool is available at https://github.com/NikaidoLaboratory/mitodelta. © The Author(s) 2025.",Deletion variant; Mitochondrial DNA; Single-cell transcriptomics; Variant caller,"Computational Biology; DNA, Mitochondrial; Humans; Sequence Analysis, RNA; Sequence Deletion; Single-Cell Analysis; Software; mitochondrial DNA; nuclear RNA; transcriptome; mitochondrial DNA; algorithm; Article; binomial distribution; bioinformatics; computer model; controlled study; copy number variation; degenerative disease; diagnostic accuracy; diagnostic test accuracy study; digital filtering; disease burden; disorders of mitochondrial functions; DNA sequence; gene deletion; gene expression; gene mutation; genetic variability; genome analysis; heteroplasmy; high throughput sequencing; human; human cell; human tissue; machine learning; measurement accuracy; measurement precision; mitochondrial DNA deletion; mitochondrial genome; nonhuman; Parkinson disease; quantitative analysis; recall; RNA sequence; sequence alignment; signal noise ratio; single cell RNA seq; single nucleotide polymorphism; whole exome sequencing; gene deletion; genetics; procedures; RNA sequencing; single cell analysis; software","I. Nikaido; Department of Functional Genome Informatics, Division of Biological Data Science, Medical Research Laboratory, Institute of Integrated Research, Institute of Science Tokyo, Tokyo, 1-5-45 Yushima, Bunkyo-Ku, 113-8510, Japan; email: itoshi.nikaido@riken.jp",,BioMed Central Ltd,14712164,,BGMEE,40999372,English,BMC Genomics,Article,Final,All Open Access; Gold Open Access; Green Open Access,Scopus,2-s2.0-105017184876
Prabakaran T.; Latha R.; Kavitha R.; Joshi S.; Radhika M.; Srinivasan C.,"Prabakaran, T. (57205055433); Latha, R. (59484419700); Kavitha, R. (59969793900); Joshi, Sneha (59866177800); Radhika, M. (56607042200); Srinivasan, C. (57204028096)",57205055433; 59484419700; 59969793900; 59866177800; 56607042200; 57204028096,PDCNet: Parkinson’s Disease Classification Network using MRI Scans,2025,Journal of Innovative Image Processing,7,1,,207,225,0,10.36548/jiip.2025.1.010,https://www.scopus.com/inward/record.uri?eid=2-s2.0-105004808509&doi=10.36548%2Fjiip.2025.1.010&partnerID=40&md5=265b3390df05ceebf3bc5dc942c5ad1a,"Department of Computer Science and Engineering, Joginpally B.R. Engineering College, Moinabad, Hyderabad, India; Department of Computer Science and Engineering, K.Ramakrishnan College of Engineering, Trichy, India; Department of Computer Science and Engineering, Chennai Institute of Technology, Chennai, India; Department of Mathematics, Malla Reddy College of Engineering, Hyderabad, India; Department of Information Technology, R.M.D. Engineering College, Kavaraipettai, Chennai, India; Department of Computer Science and Engineering, Saveetha School of Engineering, Chennai, India","Prabakaran T., Department of Computer Science and Engineering, Joginpally B.R. Engineering College, Moinabad, Hyderabad, India; Latha R., Department of Computer Science and Engineering, K.Ramakrishnan College of Engineering, Trichy, India; Kavitha R., Department of Computer Science and Engineering, Chennai Institute of Technology, Chennai, India; Joshi S., Department of Mathematics, Malla Reddy College of Engineering, Hyderabad, India; Radhika M., Department of Information Technology, R.M.D. Engineering College, Kavaraipettai, Chennai, India; Srinivasan C., Department of Computer Science and Engineering, Saveetha School of Engineering, Chennai, India","Parkinson's Disease (PD) is a neurodegenerative condition in which timely and precise diagnosis is essential for optimal care. A Convolutional Neural Networks (CNNs) architecture, PDCNet is designed to classify PD from Magnetic Resonance Imaging (MRI) scans sourced from the NTUA Parkinson dataset. The PDCNet has three convolution layers with different numbers of filters and two fully connected layers with efficient Gradient-weighted Class Activation Mapping (Grad-CAM) to improve generalization and mitigate overfitting. The proposed PDCNet uses different dropout ratios which provides the benefits of regularization without compromising predictive performance. The proposed PDCNet has a remarkable classification accuracy of 98.27%, with a sensitivity of 97.69% and specificity of 98.85% when using 10000 images of NTUA dataset for each class (normal and PD). The experimental results emphasize the capability of PDCNet with other deep learning architectures such as VGG, ResNet, and deep belief networks for non-invasive PD classification using MRI data. The study's findings indicate that integrating AI-driven diagnostics into clinical workflows may enhance early identification andKattankulathur individualised therapy planning for individuals with PD. © 2025 Inventive Research Organization.",Clinical Applications; Convolutional Neural Networks; Early Diagnosis; MRI; Parkinson’s Disease,,,,Inventive Research Organization,25824252,,,,English,J. Innov. Image. Processing,Article,Final,All Open Access; Gold Open Access,Scopus,2-s2.0-105004808509
Rosenfeldt A.B.; Lopez-Lennon C.; Suttman E.; Jansen A.E.; Owen K.; Dibble L.E.; Alberts J.L.,"Rosenfeldt, Anson B. (55539381700); Lopez-Lennon, Cielita (55794297800); Suttman, Erin (57404419000); Jansen, A. Elizabeth (57224227808); Owen, Kelsey (57480648200); Dibble, Leland E. (6505969020); Alberts, Jay L. (7102700580)",55539381700; 55794297800; 57404419000; 57224227808; 57480648200; 6505969020; 7102700580,"Use of a Home-Based, Commercial Exercise Platform to Remotely Monitor Aerobic Exercise Adherence and Intensity in People With Parkinson Disease",2024,Physical Therapy,104,2,pzad174,,,5,10.1093/ptj/pzad174,https://www.scopus.com/inward/record.uri?eid=2-s2.0-85184654883&doi=10.1093%2Fptj%2Fpzad174&partnerID=40&md5=3749a80284f0ab9964116036ae0d1acb,"Department of Biomedical Engineering, Cleveland Clinic, Cleveland, OH, United States; Department of Physical Therapy and Athletic Training, University of Utah, Salt Lake City, UT, United States; Center for Neurological Restoration, Cleveland Clinic, Cleveland, OH, United States","Rosenfeldt A.B., Department of Biomedical Engineering, Cleveland Clinic, Cleveland, OH, United States; Lopez-Lennon C., Department of Physical Therapy and Athletic Training, University of Utah, Salt Lake City, UT, United States; Suttman E., Department of Physical Therapy and Athletic Training, University of Utah, Salt Lake City, UT, United States; Jansen A.E., Department of Biomedical Engineering, Cleveland Clinic, Cleveland, OH, United States; Owen K., Center for Neurological Restoration, Cleveland Clinic, Cleveland, OH, United States; Dibble L.E., Department of Physical Therapy and Athletic Training, University of Utah, Salt Lake City, UT, United States; Alberts J.L., Department of Biomedical Engineering, Cleveland Clinic, Cleveland, OH, United States, Center for Neurological Restoration, Cleveland Clinic, Cleveland, OH, United States","Objective. Physical therapists are well-positioned to prescribe exercise outside of a clinical setting to promote positive health behaviors in people with Parkinson disease (PD). Traditionally, a barrier to precise exercise prescription has been reliance on participant self-reported exercise adherence and intensity. Home-based, commercially available exercise platforms offer an opportunity to remotely monitor exercise behavior and facilitate adherence based on objective performance metrics. The primary aim of this project was to characterize the feasibility and processes of remote aerobic exercise data monitoring from a home-based, commercially available platform in individuals participating in the 12-month Cyclical Lower Extremity Exercise for PD II (CYCLE-II) randomized clinical trial. Secondary aims focused on using exercise behavior to classify the cohort into exercise archetypes and describing a shared decision-making process to facilitate exercise adherence. Methods. Data from each exercise session were extracted, visualized, and filtered to ensure ride integrity. Weekly exercise frequency was used to determine exercise archetypes: Adherent (2–4 exercise sessions per week), Over-adherent (>4 exercise sessions per week), and Under-adherent (<2 exercise sessions per week). Results. A total of 123 people with PD completed 22,000+ exercise sessions. Analysis of exercise frequency indicated that 79% of participants were adherent; 8% were over-adherent; and 13% were under-adherent. Three case reports illustrate how shared decision-making with the use of exercise performance data points guided exercise prescription. Conclusions. The number of exercise sessions and completeness of the data indicate that people with PD were able to utilize a commercial, home-based exercise platform to successfully engage in long-term aerobic exercise. Physical therapists can use objective data as a part of a shared decision-making process to facilitate exercise adherence. Impact. Commercially available exercise platforms offer a unique approach for physical therapists to monitor exercise behavior outside of a clinical setting. The methods used in this project can serve as a roadmap to utilizing data from consumer-based platforms. © The Author(s) 2024. Published by Oxford University Press on behalf of the American Physical Therapy Association. All rights reserved.",Aerobic Exercise; Cycling; Exercise Adherence; Parkinson Disease,Exercise; Exercise Therapy; Health Behavior; Humans; Parkinson Disease; case report; controlled study; exercise; health behavior; human; kinesiotherapy; Parkinson disease; procedures; randomized controlled trial,"J.L. Alberts; Department of Biomedical Engineering, Cleveland Clinic, Cleveland, United States; email: albertj@ccf.org",,Oxford University Press,00319023,,PTHEA,38206881,English,Phys. Ther.,Article,Final,All Open Access; Green Open Access,Scopus,2-s2.0-85184654883
Wirth T.; Ferreira F.; Vijiaratnam N.; Girges C.; Pakzad A.; de Roquemaurel A.; Sinani O.; Hyam J.; Hariz M.; Zrinzo L.; Akram H.; Limousin P.; Foltynie T.,"Wirth, Thomas (57193722932); Ferreira, Francisca (57219145041); Vijiaratnam, Nirosen (36712860100); Girges, Christine (57199066418); Pakzad, Ashkan (57204598536); de Roquemaurel, Alexis (56007433300); Sinani, Olga (57193228849); Hyam, Jonathan (15072861200); Hariz, Marwan (7005641179); Zrinzo, Ludvic (57204578076); Akram, Harith (23768093200); Limousin, Patricia (7003880315); Foltynie, Thomas (57215196433)",57193722932; 57219145041; 36712860100; 57199066418; 57204598536; 56007433300; 57193228849; 15072861200; 7005641179; 57204578076; 23768093200; 7003880315; 57215196433,Parkinson's Disease Tremor Differentially Responds to Levodopa and Subthalamic Stimulation,2023,Movement Disorders Clinical Practice,10,11,,1639,1649,3,10.1002/mdc3.13876,https://www.scopus.com/inward/record.uri?eid=2-s2.0-85173436515&doi=10.1002%2Fmdc3.13876&partnerID=40&md5=afd9c73a31cb201a961f9a17adf21aaa,"Department of Clinical and Movement Neurosciences, UCL Queen Square Institute of Neurology and the National Hospital for Neurology and Neurosurgery, London, United Kingdom; Neurology Department, Strasbourg University Hospital, Strasbourg, France; Institute of Genetics and Cellular and Molecular Biology, INSERM-U964, CNRS-UMR7104, University of Strasbourg, Strasbourg, France; Strasbourg Translational Medicine Federation, University of Strasbourg, Strasbourg, France; Wellcome Centre for Human Neuroimaging, London, United Kingdom; EPSRC Centre for Doctoral Training i4health, University College London, London, United Kingdom; Department of Clinical Science, Neuroscience, Umeå University, Umeå, Sweden","Wirth T., Department of Clinical and Movement Neurosciences, UCL Queen Square Institute of Neurology and the National Hospital for Neurology and Neurosurgery, London, United Kingdom, Neurology Department, Strasbourg University Hospital, Strasbourg, France, Institute of Genetics and Cellular and Molecular Biology, INSERM-U964, CNRS-UMR7104, University of Strasbourg, Strasbourg, France, Strasbourg Translational Medicine Federation, University of Strasbourg, Strasbourg, France; Ferreira F., Department of Clinical and Movement Neurosciences, UCL Queen Square Institute of Neurology and the National Hospital for Neurology and Neurosurgery, London, United Kingdom, Wellcome Centre for Human Neuroimaging, London, United Kingdom; Vijiaratnam N., Department of Clinical and Movement Neurosciences, UCL Queen Square Institute of Neurology and the National Hospital for Neurology and Neurosurgery, London, United Kingdom; Girges C., Department of Clinical and Movement Neurosciences, UCL Queen Square Institute of Neurology and the National Hospital for Neurology and Neurosurgery, London, United Kingdom; Pakzad A., EPSRC Centre for Doctoral Training i4health, University College London, London, United Kingdom; de Roquemaurel A., Department of Clinical and Movement Neurosciences, UCL Queen Square Institute of Neurology and the National Hospital for Neurology and Neurosurgery, London, United Kingdom; Sinani O., Department of Clinical and Movement Neurosciences, UCL Queen Square Institute of Neurology and the National Hospital for Neurology and Neurosurgery, London, United Kingdom; Hyam J., Department of Clinical and Movement Neurosciences, UCL Queen Square Institute of Neurology and the National Hospital for Neurology and Neurosurgery, London, United Kingdom; Hariz M., Department of Clinical and Movement Neurosciences, UCL Queen Square Institute of Neurology and the National Hospital for Neurology and Neurosurgery, London, United Kingdom, Department of Clinical Science, Neuroscience, Umeå University, Umeå, Sweden; Zrinzo L., Department of Clinical and Movement Neurosciences, UCL Queen Square Institute of Neurology and the National Hospital for Neurology and Neurosurgery, London, United Kingdom; Akram H., Department of Clinical and Movement Neurosciences, UCL Queen Square Institute of Neurology and the National Hospital for Neurology and Neurosurgery, London, United Kingdom; Limousin P., Department of Clinical and Movement Neurosciences, UCL Queen Square Institute of Neurology and the National Hospital for Neurology and Neurosurgery, London, United Kingdom; Foltynie T., Department of Clinical and Movement Neurosciences, UCL Queen Square Institute of Neurology and the National Hospital for Neurology and Neurosurgery, London, United Kingdom","Background: Tremor in Parkinson's disease (PD) has an inconsistent response to levodopa and subthalamic deep brain stimulation (STN-DBS). Objectives: To identify predictive factors of PD tremor responsiveness to levodopa and STN-DBS. Material and Methods: PD patients with upper limb tremor who underwent STN-DBS were included. The levodopa responsiveness of tremor (overall, postural, and rest sub-components), was assessed using the relevant Unified Parkinson's Disease Rating Scale-III items performed during the preoperative assessment. Post-surgical outcomes were similarly assessed ON and OFF stimulation. A score for the rest/postural tremor ratio was used to determine the influence of rest and postural tremor severity on STN-DBS outcome. Factors predictive of tremor responsiveness were determined using multiple linear regression modeling. Volume of tissue activated measurement coupled to voxel-based analysis was performed to identify anatomical clusters associated with motor symptoms improvement. Results: One hundred and sixty five patients were included in this study. Male gender was negatively correlated with tremor responsiveness to levodopa, whereas the ratio of rest/postural tremor was positively correlated with both levodopa responsiveness and STN-DBS tremor outcome. Clusters corresponding to improvement of tremor were in the subthalamic nucleus, the zona incerta and the thalamus, whereas clusters corresponding to improvement for akinesia and rigidity were located within the subthalamic nucleus. Conclusion: More severe postural tremor and less severe rest tremor were associated with both poorer levodopa and STN-DBS response. The different locations of clusters associated with best correction of tremor and other parkinsonian features suggest that STN-DBS effect on PD symptoms is underpinned by the modulation of different networks. © 2023 International Parkinson and Movement Disorder Society.",levodopa; Parkinson's disease; subthalamic stimulation; tremor; volume of tissue activated,levodopa; adult; akinesia; Article; brain depth stimulation; clinical assessment; computer assisted tomography; female; finite element analysis; gait; human; limb tremor; major clinical study; male; nuclear magnetic resonance imaging; Parkinson disease; parkinsonism; preoperative evaluation; stimulation; subthalamic nucleus; subthalamic stimulation; surgical technique; T1 weighted imaging; T2 weighted imaging; thalamus; tremor; Unified Parkinson Disease Rating Scale; zona incerta,"T. Wirth; Unit of Functional Neurosurgery, National Hospital for Neurology and Neurosurgery, London, WC1N 3BG, United Kingdom; email: t.wirth@nhs.net",,John Wiley and Sons Inc,23301619,,,,English,Mov. Disord. Clin. Pract.,Article,Final,All Open Access; Green Open Access,Scopus,2-s2.0-85173436515
