Wu J.; Liu X.; Feng J.,"Wu, Jianhua (55714125800); Liu, Xuguang (55717209300); Feng, Jianfeng (7403884410)",55714125800; 55717209300; 7403884410,Detecting causality between different frequencies,2008,Journal of Neuroscience Methods,167,2,,367,375,22,10.1016/j.jneumeth.2007.08.022,https://www.scopus.com/inward/record.uri?eid=2-s2.0-36849032315&doi=10.1016%2Fj.jneumeth.2007.08.022&partnerID=40&md5=f5bdf7724c7cde490338b1e49957b162,"Department of Computer Science and Mathematics, University of Warwick, Coventry, CV4 7AL, United Kingdom; Charing Cross Hospital, Division of Neuroscience and Mental Health, Imperial College London, London, W6 8RF, United Kingdom","Wu J., Department of Computer Science and Mathematics, University of Warwick, Coventry, CV4 7AL, United Kingdom; Liu X., Charing Cross Hospital, Division of Neuroscience and Mental Health, Imperial College London, London, W6 8RF, United Kingdom; Feng J., Department of Computer Science and Mathematics, University of Warwick, Coventry, CV4 7AL, United Kingdom","Biological systems are usually non-linear and, as a result, the driving signal frequency (say, M Hz) is in general not identical with the output frequency (say, N Hz). Coherence and causality analysis have been well-developed to measure the (directional) correlation between input and output signals with identical frequencies (N = M), but they are not applicable to the cases with different frequencies (N ≠ M). In this paper, we propose a novel method called frequency-modified causality (coherence) analysis to resolve the issue. The input or output signal is first modulated by up-sampling or down-sampling, coherence and causality analysis are then applied to the frequency modulated and filtered signals. An optimal coherence and causality is found, revealing the true input-output relationship between signals. The method is successfully tested on data generated from a toy model, the van der Pol oscillator and then employed to analyze data recorded from Parkinson's disease (PD) patients. © 2007 Elsevier B.V. All rights reserved.",Coherence; Correlation; Granger causality; Parkinson's disease,"Algorithms; Data Compression; Humans; Models, Neurological; Nonlinear Dynamics; Oscillometry; Parkinson Disease; Reproducibility of Results; Sensitivity and Specificity; Signal Processing, Computer-Assisted; Wounds and Injuries; analytic method; article; calculation; causal attribution; correlation analysis; filter; frequency modified causality analysis; information processing; mathematical model; model; oscillation; oscillator; Parkinson disease; priority journal; signal detection; signal noise ratio; signal transduction",,,,01650270,,JNMED,17928062,English,J. Neurosci. Methods,Article,Final,,Scopus,2-s2.0-36849032315
BUCKINGHAM T.A.; RADIN M.M.; VOLGMAN A.S.; JHANGIANI A.; ZBILUT J.,"BUCKINGHAM, THOMAS A. (57191017726); RADIN, MICHAEL M. (7004066246); VOLGMAN, ANNABELLE S. (6602231395); JHANGIANI, ANIL (6506106917); ZBILUT, JOSEPH (7006588259)",57191017726; 7004066246; 6602231395; 6506106917; 7006588259,Does Atrial Fibrillation Cause False‐Positive Late Potentials?,1993,Pacing and Clinical Electrophysiology,16,12,,2222,2226,6,10.1111/j.1540-8159.1993.tb02327.x,https://www.scopus.com/inward/record.uri?eid=2-s2.0-0027728771&doi=10.1111%2Fj.1540-8159.1993.tb02327.x&partnerID=40&md5=6269236d6b1e917a10fe7059de85165f,"Section of Cardiology, Department of Medicine, Rush-Presbyterian St. Luke's Medical Center, United States; Department of Cardiology, Heart Institute of the Desert, California, United States; Section of Cardiology, Department of Medicine, Cook County Hospital, Chicago, Illinois, United States; Section of Cardiology, Department of Physiology, Rush-Presbyterian St. Luke's Medical Center, United States","BUCKINGHAM T.A., Section of Cardiology, Department of Medicine, Rush-Presbyterian St. Luke's Medical Center, United States; RADIN M.M., Department of Cardiology, Heart Institute of the Desert, California, United States; VOLGMAN A.S., Section of Cardiology, Department of Medicine, Rush-Presbyterian St. Luke's Medical Center, United States; JHANGIANI A., Section of Cardiology, Department of Medicine, Cook County Hospital, Chicago, Illinois, United States; ZBILUT J., Section of Cardiology, Department of Physiology, Rush-Presbyterian St. Luke's Medical Center, United States","We hypothesized that atrial fibrillation may cause false‐positive late potentials due to the recording of baseline atrial activity. We performed signal‐averaged ECGs in 26 patients with atrial fibrillation before and after conversion to normaJ sinus rhythm. Signal‐averaged ECGs were recorded for > 200 cycles with a noise level of ≤ 0.5 μV. The signals were band‐pass filtered at 40–250 Hz. We examined filtered QRS duration (fQRS), duration of low amplitude signal < 40 μV (LAS), and the root mean square (RMS) of the terminal 40 msec of the QRS complex. A late potential was considered present when two of the following three criteria were met: fQRS ± 114 msec, LAS ± 38 msec, and RMS ≤ 20 μV. The mean ± standard deviation of the fQRS in atriai fibrillation and sinus rhythm were 313 ± 28 and 110 ± 25 msec; of the LAS 38 ± 17 and 37 ± 15 msec; of the RMS 27 ± 22 and 28 ± 21 μV; of the noise 0.25 ± 0.08 and 0.22 ± 0.07 μV (P = NS). Ten signal‐averaged ECGs in atrial fibrillation had late potentials. With reversion to sinus rhythm one of these 26 patients gained a late potential; two others lost a late potential (P = NS by McNemar's Chi‐square). There was no significant difference in the signal‐averaged ECG parameters or noise levels. In conclusion, signal‐averaged ECG parameters are not significantly changed by cardioversion of atrial fibrillation to normal sinus rhythm. Moreover, the presence of a late potential in a patient with atrial fibrillation does not appear to be the result of a spurious recording of baseline atrial fibrillatory activity. Copyright © 1993, Wiley Blackwell. All rights reserved",atrial fibrillatio; electrocardiography; late potentials; signal‐averaged electrocardiography,Action Potentials; Aged; Atrial Fibrillation; Electric Countershock; Electrocardiography; False Positive Reactions; Female; Human; Male; adult; afterdischarge; aged; article; cardiomyopathy; cardioversion; clinical article; coronary artery disease; electrocardiography; female; heart atrium fibrillation; heart muscle potential; human; male; qrs complex; sinus rhythm; valvular heart disease; wolff parkinson white syndrome,,,,01478389,,,7508598,English,PACE Pacing Clin. Electrophysiol.,Article,Final,,Scopus,2-s2.0-0027728771
Camara C.; Isasi P.; Warwick K.; Ruiz V.; Aziz T.; Stein J.; Bakštein E.,"Camara, Carmen (56414371100); Isasi, Pedro (7004613522); Warwick, Kevin (7006258954); Ruiz, Virginie (7004348674); Aziz, Tipu (7102677271); Stein, John (56481036000); Bakštein, Eduard (43060996500)",56414371100; 7004613522; 7006258954; 7004348674; 7102677271; 56481036000; 43060996500,Resting tremor classification and detection in Parkinson's disease patients,2015,Biomedical Signal Processing and Control,16,,,88,97,61,10.1016/j.bspc.2014.09.006,https://www.scopus.com/inward/record.uri?eid=2-s2.0-84910073525&doi=10.1016%2Fj.bspc.2014.09.006&partnerID=40&md5=0640b4a4ec87039b2a92050adad3aa8e,"Center for Biomedical Technology, Technical University of Madrid, Montegancedo Campus, Pozuelo de Alarcón, Madrid, 28223, Spain; Dept. of Computer Science, Carlos III University of Madrid, Spain; Dept. of Cybernetics, University of Reading, United Kingdom; Dept. of Surgery, John Radcliffe Hospital, Oxford, United Kingdom; University Laboratory of Physiology, University of Oxford, United Kingdom; Dept. of Cybernetics FEE, Czech Technical University, Czech Republic","Camara C., Center for Biomedical Technology, Technical University of Madrid, Montegancedo Campus, Pozuelo de Alarcón, Madrid, 28223, Spain, Dept. of Computer Science, Carlos III University of Madrid, Spain; Isasi P., Dept. of Computer Science, Carlos III University of Madrid, Spain; Warwick K., Dept. of Cybernetics, University of Reading, United Kingdom; Ruiz V., Dept. of Cybernetics, University of Reading, United Kingdom; Aziz T., Dept. of Surgery, John Radcliffe Hospital, Oxford, United Kingdom; Stein J., University Laboratory of Physiology, University of Oxford, United Kingdom; Bakštein E., Dept. of Cybernetics FEE, Czech Technical University, Czech Republic","Parkinson is a neurodegenerative disease, in which tremor is the main symptom. This paper investigates the use of different classification methods to identify tremors experienced by Parkinsonian patients. Some previous research has focussed tremor analysis on external body signals (e.g., electromyography, accelerometer signals, etc.). Our advantage is that we have access to sub-cortical data, which facilitates the applicability of the obtained results into real medical devices since we are dealing with brain signals directly. Local field potentials (LFP) were recorded in the subthalamic nucleus of 7 Parkinsonian patients through the implanted electrodes of a deep brain stimulation (DBS) device prior to its internalization. Measured LFP signals were preprocessed by means of splinting, down sampling, filtering, normalization and rectification. Then, feature extraction was conducted through a multi-level decomposition via a wavelet transform. Finally, artificial intelligence techniques were applied to feature selection, clustering of tremor types, and tremor detection. The key contribution of this paper is to present initial results which indicate, to a high degree of certainty, that there appear to be two distinct subgroups of patients within the group-1 of patients according to the Consensus Statement of the Movement Disorder Society on Tremor. Such results may well lead to different resultant treatments for the patients involved, depending on how their tremor has been classified. Moreover, we propose a new approach for demand driven stimulation, in which tremor detection is also based on the subtype of tremor the patient has. Applying this knowledge to the tremor detection problem, it can be concluded that the results improve when patient clustering is applied prior to detection. © 2014 Elsevier Ltd. All rights reserved.",Artificial neural network (ANN); Deep brain stimulation (DBS); Discrete wavelet transform (DWT); Parkinson's disease (PD); Tremor Local field potential (LFP),Artificial intelligence; Biomedical signal processing; Brain; Deep neural networks; Discrete wavelet transforms; Electrophysiology; Neural networks; Neurodegenerative diseases; Neurosurgery; Signal sampling; Wavelet decomposition; Accelerometer signals; Artificial intelligence techniques; Classification methods; Deep brain stimulation; Degree of certainty; Implanted electrodes; Local field potentials; Parkinson's disease; Article; artificial intelligence; brain depth stimulation; consensus; disease classification; electric potential; electrode; electrophysiology; human; medical society; Parkinson disease; subthalamic nucleus; tremor; Feature extraction,,,Elsevier Ltd,17468094,,,,English,Biomed. Signal Process. Control,Article,Final,All Open Access; Green Open Access,Scopus,2-s2.0-84910073525
Bötzel K.; Olivares A.; Cunha J.P.; Górriz Sáez J.M.; Weiss R.; Plate A.,"Bötzel, Kai (7003298937); Olivares, Alberto (16040524500); Cunha, João Paulo (55663288500); Górriz Sáez, Juan Manuel (7004736801); Weiss, Robin (57201332112); Plate, Annika (51566129300)",7003298937; 16040524500; 55663288500; 7004736801; 57201332112; 51566129300,Quantification of gait parameters with inertial sensors and inverse kinematics,2018,Journal of Biomechanics,72,,,207,214,15,10.1016/j.jbiomech.2018.03.012,https://www.scopus.com/inward/record.uri?eid=2-s2.0-85044364500&doi=10.1016%2Fj.jbiomech.2018.03.012&partnerID=40&md5=49eb8b742ab28188870caa1e499448d9,"Department of Neurology, Ludwig-Maximilians University, Munich, Germany; Department of Signal Theory, Networking and Communications, University of Granada, Spain; Institute for Systems Engineering and Computers – Technology and Science (INESC TEC), Faculty of Engineering (FEUP), University of Porto, Porto, Portugal","Bötzel K., Department of Neurology, Ludwig-Maximilians University, Munich, Germany; Olivares A., Department of Signal Theory, Networking and Communications, University of Granada, Spain; Cunha J.P., Institute for Systems Engineering and Computers – Technology and Science (INESC TEC), Faculty of Engineering (FEUP), University of Porto, Porto, Portugal; Górriz Sáez J.M., Department of Signal Theory, Networking and Communications, University of Granada, Spain; Weiss R., Department of Signal Theory, Networking and Communications, University of Granada, Spain; Plate A., Department of Neurology, Ludwig-Maximilians University, Munich, Germany","Measuring human gait is important in medicine to obtain outcome parameter for therapy, for instance in Parkinson's disease. Recently, small inertial sensors became available which allow for the registration of limb-position outside of the limited space of gait laboratories. The computation of gait parameters based on such recordings has been the subject of many scientific papers. We want to add to this knowledge by presenting a 4-segment leg model which is based on inverse kinematic and Kalman filtering of data from inertial sensors. To evaluate the model, data from four leg segments (shanks and thighs) were recorded synchronously with accelerometers and gyroscopes and a 3D motion capture system while subjects (n = 12) walked at three different velocities on a treadmill. Angular position of leg segments was computed from accelerometers and gyroscopes by Kalman filtering and compared to data from the motion capture system. The four-segment leg model takes the stance foot as a pivotal point and computes the position of the remaining segments as a kinematic chain (inverse kinematics). Second, we evaluated the contribution of pelvic movements to the model and evaluated a five segment model (shanks, thighs and pelvis) against ground-truth data from the motion capture system and the path of the treadmill. Results: We found the precision of the Kalman filtered angular position is in the range of 2–6° (RMS error). The 4-segment leg model computed stride length and length of gait path with a constant undershoot of 3% for slow and 7% for fast gait. The integration of a 5th segment (pelvis) into the model increased its precision. The advantages of this model and ideas for further improvements are discussed. © 2018 Elsevier Ltd",Gait recording; Human; Inertial sensors; Kalman filter,"Adult; Biomechanical Phenomena; Foot; Gait; Humans; Leg; Male; Models, Biological; Pelvis; Accelerometers; Disease control; Gyroscopes; Inertial navigation systems; Inverse kinematics; Sporting goods; 3D motion capture systems; Gait recording; Ground truth data; Human; Inertial sensor; Motion capture system; Parkinson's disease; Scientific papers; adult; Article; calculation; controlled study; foot; gait; gait parameters; gyroscope; human; human experiment; inertial sensor; intermethod comparison; inverse kinematics; Kalman filtering; kinematics; male; mathematical analysis; mathematical model; measurement precision; musculoskeletal system parameters; pelvis; priority journal; quantitative analysis; thigh; walking; biological model; biomechanics; gait; leg; physiology; Kalman filters","K. Bötzel; Department of Neurology, Ludwig-Maximilians University, Munich, Marchioninistrasse 15, 81366, Germany; email: kboetzel@med.uni-muenchen.de",,Elsevier Ltd,00219290,,JBMCB,29602474,English,J. Biomech.,Article,Final,,Scopus,2-s2.0-85044364500
Fan B.; Li Q.; Liu T.,"Fan, Bingfei (57192276287); Li, Qingguo (57192388832); Liu, Tao (56352343300)",57192276287; 57192388832; 56352343300,Accurate foot clearance estimation during level and uneven ground walking using inertial sensors,2020,Measurement Science and Technology,31,5,055106,,,11,10.1088/1361-6501/ab6917,https://www.scopus.com/inward/record.uri?eid=2-s2.0-85081985652&doi=10.1088%2F1361-6501%2Fab6917&partnerID=40&md5=71918b042081d070134d359af9176fdd,"State Key Laboratory of Fluid Power and Mechatronic Systems, School of Mechanical Engineering, Zhejiang University, Hangzhou, 310027, China; Department of Mechanical and Materials Engineering, Queen's University, Kingston, K7L 3N6, ON, Canada","Fan B., State Key Laboratory of Fluid Power and Mechatronic Systems, School of Mechanical Engineering, Zhejiang University, Hangzhou, 310027, China; Li Q., Department of Mechanical and Materials Engineering, Queen's University, Kingston, K7L 3N6, ON, Canada; Liu T., State Key Laboratory of Fluid Power and Mechatronic Systems, School of Mechanical Engineering, Zhejiang University, Hangzhou, 310027, China","Foot clearance during walking is considered as a key indicator for assessing fall risk, obstacle negotiation strategies and energy expenditure. Foot clearance estimation using inertial measurement units (IMUs) has the advantages of small size, low cost and user-friendliness. However, its application is still limited due to issues with accuracy and reliability. In this paper, we aimed at understanding the limiting factors in foot clearance estimation using low-cost IMUs and proposed a foot clearance estimation method with millimeter-level accuracy. We first analyzed each component in conventional double-integration-based foot clearance estimation, and then proposed a set of new procedures for foot trajectory estimation, including a gait-adaptive complementary filter for orientation estimation, a two-IMU configuration and a shock absorber. Finally, we extracted the foot clearance from the estimated foot trajectory. In the experiments, we recruited eight healthy subjects and instructed them to walk under level and uneven ground conditions; moreover, to validate the applicability of the proposed method, we also instructed the subjects to mimic pathological gaits, including ataxic gait (zigzag walking), waddling gait and Parkinsonian gait. A total of 2640 gait cycles were collected and the extracted foot clearances were benchmarked with the optical motion capture system. With the proposed method, the average mean and standard deviation of the extracted maximal heel clearance and minimal toe clearance in all the gait cycles were -0.34 ± 0.24 cm and 0.02 ± 0.26 cm. The results are more accurate than in previous studies. Most importantly, the proposed method does not require any post correction and flat-floor assumption. The presented foot clearance estimation method provides an applicable and practical clinical solution not only for heel and toe clearance estimation but also for foot trajectory estimation. © 2020 IOP Publishing Ltd.",fall risk assessment; foot clearance; foot trajectory; inertial sensors; orientation estimation,Cost estimating; Inertial navigation systems; Motion capture; Risk assessment; Shock absorbers; Trajectories; Complementary filters; Foot clearances; Inertial measurement unit; Inertial sensor; Mean and standard deviations; Optical motion capture; Orientation estimation; Trajectory estimation; Risk perception,,,Institute of Physics Publishing,09570233,,MSTCE,,English,Meas. Sci. Technol.,Article,Final,,Scopus,2-s2.0-85081985652
Chang H.-C.; Hsu Y.-L.; Yang S.-C.; Lin J.-C.; Wu Z.-H.,"Chang, Hsing-Cheng (7407522806); Hsu, Yu-Liang (36729819300); Yang, Shih-Chin (36705419800); Lin, Jung-Chih (56129701700); Wu, Zhi-Hao (57192928730)",7407522806; 36729819300; 36705419800; 56129701700; 57192928730,A wearable inertial measurement system with complementary filter for gait analysis of patients with stroke or Parkinson's disease,2016,IEEE Access,4,,7762063,8442,8453,113,10.1109/ACCESS.2016.2633304,https://www.scopus.com/inward/record.uri?eid=2-s2.0-85009164625&doi=10.1109%2FACCESS.2016.2633304&partnerID=40&md5=b473375f4efb38c538e8cd09ad1cba75,"Department of Automatic Control Engineering, Feng Chia University, Taichung, 40724, Taiwan; Department of Mechanical Engineering, National Taiwan University, Taipei, 10617, Taiwan; Department of Integrated Chinese and Western Medicine, Chung Shan Medical University Hospital, Taichung, 402, Taiwan","Chang H.-C., Department of Automatic Control Engineering, Feng Chia University, Taichung, 40724, Taiwan; Hsu Y.-L., Department of Automatic Control Engineering, Feng Chia University, Taichung, 40724, Taiwan; Yang S.-C., Department of Mechanical Engineering, National Taiwan University, Taipei, 10617, Taiwan; Lin J.-C., Department of Integrated Chinese and Western Medicine, Chung Shan Medical University Hospital, Taichung, 402, Taiwan; Wu Z.-H., Department of Automatic Control Engineering, Feng Chia University, Taichung, 40724, Taiwan","This paper presents a wearable inertial measurement system and its associated spatiotemporal gait analysis algorithm to obtain quantitative measurements and explore clinical indicators from the spatiotemporal gait patterns for patients with stroke or Parkinson's disease. The wearable system is composed of a microcontroller, a triaxial accelerometer, a triaxial gyroscope, and an RF wireless transmission module. The spatiotemporal gait analysis algorithm, consisting of procedures of inertial signal acquisition, signal preprocessing, gait phase detection, and ankle range of motion estimation, has been developed for extracting gait features from accelerations and angular velocities. In order to estimate accurate ankle range of motion, we have integrated accelerations and angular velocities into a complementary filter for reducing the accumulation of integration error of inertial signals. All 24 participants mounted the system on their foot to walk along a straight line of 10 m at normal speed and their walking recordings were collected to validate the effectiveness of the proposed system and algorithm. Experimental results show that the proposed inertial measurement system with the designed spatiotemporal gait analysis algorithm is a promising tool for automatically analyzing spatiotemporal gait information, serving as clinical indicators for monitoring therapeutic efficacy for diagnosis of stroke or Parkinson's disease. © 2013 IEEE.",complementary filter; gait analysis; Inertial sensing; Parkinson's disease; sensor fusion; stroke,Angular velocity; Bandpass filters; Diagnosis; Gait analysis; Motion estimation; Neurodegenerative diseases; Signal processing; Wearable computers; Wearable sensors; Wearable technology; Complementary filters; Inertial sensing; Parkinson's disease; Sensor fusion; stroke; Pattern recognition,"H.-C. Chang; Department of Automatic Control Engineering, Feng Chia University, Taichung, 40724, Taiwan; email: hcchang@fcu.edu.tw",,Institute of Electrical and Electronics Engineers Inc.,21693536,,,,English,IEEE Access,Article,Final,All Open Access; Gold Open Access; Green Open Access,Scopus,2-s2.0-85009164625
